workorder,date_time_opened,date_time_closed,registration,total_time,ata_code,problem,date,action,cluster,cluster_name
1162355,2017-03-25 12:46:00,2017-03-25 00:00:00,N605ND,10379.1,2420.0,"PILOT REPORTS ""M BUS VOLTS 24 THROUGH OUT START AND TAXI - VOLTS REMAINED BELOW 25 ON RUN UP.",2017-03-25,PERFORMED ENGINE RUN. ALTERNATOR OUTPUT IS INADEQUATE. REMOVED AND REPLACED ALTERNATOR WITH OVERHAULED UNIT S/N H-O060982 PER CESSNA MM 24-20-00. PERFORMED ENGINE RUN. CHARGING SYSTEM OPS CHECK GOOD. NO FURTHER DEFECTS NOTED,c_40,battery issue low voltage weak battery charging issue
1162417,2017-03-28 06:29:00,2017-03-28 12:39:00,N654ND,6468.599999999999,3420.0,STBY ATTITUDE INDICATOR INOP (MEL).,2017-03-28,OPS CK GOOD.,c_40,battery issue low voltage weak battery charging issue
1162444,2017-03-28 16:22:00,2017-03-30 00:00:00,N605ND,10404.9,2670.0,TIE WRAP BROKEN ON BATTERY TERMINAL COVER,2017-03-29,TIE WRAP REMOVED AND REPLACED. TERMINAL COVER SECURE,c_40,battery issue low voltage weak battery charging issue
1162451,2017-03-29 06:28:00,2017-03-31 16:38:00,N574ND,17729.6,520.0,ALTERNATOR DUE TIME CHANGE.,2017-03-29,REMOVED ALTERNATOR.,c_40,battery issue low voltage weak battery charging issue
1162451,2017-03-29 06:28:00,2017-03-31 16:38:00,N574ND,17729.6,520.0,ALTERNATOR DUE TIME CHANGE.,2017-03-30,INSTALLED ALTERNATOR S/N H-Q091180.,c_40,battery issue low voltage weak battery charging issue
1162454,2017-03-29 07:32:00,2017-03-29 15:39:00,N524ND,18008.4,2430.0,SHOWED CONSISTANT -.3 AMP INDICATION ON STBY BATTERY THROUGHOUT ENTIRE FLIGHT. VOLTAGE INDICATIONS WERE CONSISTANTLY 28V & MAIN AMPS WERE NORMAL.,2017-03-29,PERFORMED STBY BATTERY AMMETER CALIBRATION PROCEDURE IAW G1000 NAV III LINE MAINTENANCE MANUAL.,c_40,battery issue low voltage weak battery charging issue
1162608,2017-04-03 05:49:00,2017-04-03 00:00:00,N605ND,10427.4,2400.0,STANDBY BATTERY FAILED TEST DURING PRE FLIGHT,2017-04-03,CLEANED TESTING CONNECTOR OPS CHECK GOOD NO FURTHER DEFECTS NOTED,c_40,battery issue low voltage weak battery charging issue
1162669,2017-04-04 07:55:00,2017-04-04 00:00:00,N569ND,15485.0,520.0,RG-24-15M CAP CHECK,2017-04-04,COMPLIED WITH CAP CHECK 66 A/HR CHARGED BATTERY,c_40,battery issue low voltage weak battery charging issue
1162688,2017-04-04 17:41:00,2017-04-06 00:00:00,N633ND,10730.8,2400.0,BATTERY TRAY BRACKET BROKEN,2017-04-05,REMOVED BROKEN BRACKET. INSTALLED NEW BRACKET. NO FURTHER DEFECT NOTED,c_40,battery issue low voltage weak battery charging issue
1162697,2017-04-05 06:36:00,2017-04-05 11:01:00,N573ND,17396.5,520.0,BATTERY CAP CK DUE.,2017-04-05,REMOVED & REPLACED BATTER W/ S/N 40775010. NEXT CAP CK DUE 4/30/18 OR 7689.8 TACH.,c_40,battery issue low voltage weak battery charging issue
1162745,2017-04-06 10:19:00,2017-04-06 14:09:00,N575ND,17576.300000000003,2430.0,STBY BATTERY FAILED SELF TEST.,2017-04-06,CONNECTED CHARGER TO A/C.,c_40,battery issue low voltage weak battery charging issue
1162745,2017-04-06 10:19:00,2017-04-06 14:09:00,N575ND,17576.300000000003,2430.0,STBY BATTERY FAILED SELF TEST.,2017-04-06,REMOVED CHARGER. BATTERY CHECKS GOOD.,c_40,battery issue low voltage weak battery charging issue
1162752,2017-04-06 13:44:00,2017-04-06 14:14:00,N782ND,1546.0,3310.0,UPPER AVIONICS MASTER SWITCH BULB IS INOP.,2017-04-06,"FOUND BULB LOOSE, RESECURED BULB. OPS CK GOOD.",c_40,battery issue low voltage weak battery charging issue
1162816,2017-04-09 10:11:00,2017-04-09 15:21:00,N536ND,15098.9,7110.0,BATTERY O/B VENT LINE NEEDS CAT TRACKS.,2017-04-09,APPLIED NEW CAT TRACK.,c_40,battery issue low voltage weak battery charging issue
1162880,2017-04-11 08:00:00,2017-04-11 11:04:00,N687ND,10546.2,2420.0,L/H ALTERNATOR INOP.,2017-04-11,"RAN A/C. FOUND ALTERNATOR NOT MAKING VOLTAGE. REMOVED & REPLACED ALTERNATOR W/ S/N H-Q070198. RAN A/C, OPS CK GOOD.",c_40,battery issue low voltage weak battery charging issue
1162907,2017-04-12 06:07:00,2017-04-12 15:53:00,N579ND,15298.399999999998,2400.0,BATTERY WEAK ON START UP.,2017-04-12,REINSTALLED BATTERY.,c_40,battery issue low voltage weak battery charging issue
1162907,2017-04-12 06:07:00,2017-04-12 15:53:00,N579ND,15298.399999999998,2400.0,BATTERY WEAK ON START UP.,2017-04-12,REMOVED BATTERY & PUT ON CHARGER.,c_40,battery issue low voltage weak battery charging issue
1162926,2017-04-12 13:45:00,2017-04-12 15:05:00,N565ND,18611.1,520.0,SEALED BATTERY CAPACITY CK DUE.,2017-04-12,REPLACED W/ REPAIRED BATTERY S/N 40666606.,c_40,battery issue low voltage weak battery charging issue
1162992,2017-04-14 09:29:00,2017-04-14 09:49:00,N655ND,8501.0,520.0,MAIN BATTERY CAP CK DUE.,2017-04-14,REMOVED & REPLACED W/ NEW BATTERY S/N 40844787. NEXT CAP CK DUE 4/30/18 OR 3458.5 TACH.,c_40,battery issue low voltage weak battery charging issue
1163016,2017-04-17 06:32:00,2017-04-17 00:00:00,N543ND,13178.0,3300.0,STANDBY ATTITUDE INDICATOR LIGHT INOP,2017-04-17,MEL STANDBY ALTITIDE INDICATOR,c_40,battery issue low voltage weak battery charging issue
1163016,2017-04-17 06:32:00,2017-04-17 00:00:00,N543ND,13178.0,3300.0,STANDBY ATTITUDE INDICATOR LIGHT INOP,2017-04-17,"PULLED MFD INSPECTED CONNECTIONS. OK TESTED LAMPS, VSI, ALTIMETER LAMP OK, STANDBY ALT LAMP DOES NOT COME ON",c_40,battery issue low voltage weak battery charging issue
1163035,2017-04-17 11:14:00,2017-04-17 13:15:00,N574ND,10181.2,2400.0,"M BATT AMPS DISCHARGING THE ENTIRE FLIGHT, UNLESS ABOVE ~ 2500 RPM.",2017-04-17,"PERFORMED MAIN BATTERY AMMETER CALIBRATION. GROUND RAN A/C, FOUND ALTERNATOR INOP - SEE W/O #1163043.",c_40,battery issue low voltage weak battery charging issue
1163043,2017-04-17 15:22:00,2017-04-17 13:34:00,N574ND,10181.2,2430.0,"MAIN BATTERY AMPS DISCHARGING ENTIRE FLIGHT, UNLESS ABOVE 2000 RPM. NO LOW VOLTS ANNUNCIATOR, BUT M + E BUSS VOLTS HIGH LIGHTED RED ON FINAL TRAFFIC PATTERN.",2017-04-17,"REMOVED PROP. REMOVED & REPLACED ALTERNATOR BELT & MAIN PIVOT BOLT. REINSTALLED PROP, TORQUED & SAFETIED. RAN A/C, OPS CK GOOD.",c_40,battery issue low voltage weak battery charging issue
1163072,2017-04-18 09:50:00,2017-04-20 14:41:00,N560ND,14058.9,2430.0,ALTERNATOR DUE TIME CHANGE.,2017-04-18,REMOVED ALTERNATOR.,c_40,battery issue low voltage weak battery charging issue
1163076,2017-04-18 13:35:00,2017-04-18 11:00:00,N513ND,12084.800000000001,2430.0,CLAMP BROKEN FOR BATTERY TRAY.,2017-04-18,REPLACED CLAMP.,c_40,battery issue low voltage weak battery charging issue
1163100,2017-04-19 09:39:00,2017-04-19 11:21:00,N719ND,733.2,2430.0,ALT FAIL ANNUNCIATOR ON FINAL.,2017-04-19,"RAN A/C FOR SEVERAL MINUTES, CYCLED ALT SWITCH MULTIPLE TIMES. OPS CK GOOD.",c_40,battery issue low voltage weak battery charging issue
1163145,2017-04-20 08:45:00,2017-04-20 00:00:00,N605ND,10586.1,2400.0,DURING BEFORE ENGINE START CHECKLIST STANDBY BATT WOULD NOT COME ON DURING TEST,2017-04-20,CLEANED STANDBY BATTERY TESTING CONNECTOR TEST SYSTEM NO DEFECTS NOTED,c_40,battery issue low voltage weak battery charging issue
1163172,2017-04-21 06:28:00,2017-04-21 13:05:00,N567ND,13964.2,520.0,CAP CK DUE.,2017-04-21,REPLACED W/ SERVICEABLE BATTERY S/N 40749437.,c_40,battery issue low voltage weak battery charging issue
1163182,2017-04-21 11:42:00,2017-04-25 15:27:00,N719ND,762.5999999999999,2400.0,"ALTERNATOR AMPS POSITIVE, BUT ""ALT FAIL"" LIGHT CAME ON ABOVE 1200 RPM.",2017-04-21,ORDERED ALT OUT SWITCH. REMOVED PART TO VERIFY P/N.,c_40,battery issue low voltage weak battery charging issue
1163182,2017-04-21 11:42:00,2017-04-25 15:27:00,N719ND,762.5999999999999,2400.0,"ALTERNATOR AMPS POSITIVE, BUT ""ALT FAIL"" LIGHT CAME ON ABOVE 1200 RPM.",2017-04-25,INSTALLED NEW ALT OUT SWITCH & AUX FUSE.,c_40,battery issue low voltage weak battery charging issue
1163189,2017-04-21 13:51:00,2017-04-21 12:41:00,N549ND,12762.0,520.0,CONCORDE BATTERY CAP CK DUE.,2017-04-21,REMOVED & REPLACED W/ NEW BATTERY S/N 40847263. CAP CK DUE 4/21/18 OR 7027.6 TACH.,c_40,battery issue low voltage weak battery charging issue
1163191,2017-04-21 13:27:00,2017-04-24 00:00:00,N605ND,10598.4,520.0,BATTERY CAP TEST,2017-04-21,CHARGED & REINSTALLED BATTERY.,c_40,battery issue low voltage weak battery charging issue
1163191,2017-04-21 13:27:00,2017-04-24 00:00:00,N605ND,10598.4,520.0,BATTERY CAP TEST,2017-04-21,BATTERY CAP TEST COMPLETED TEST GOOD,c_40,battery issue low voltage weak battery charging issue
1163214,2017-04-23 10:18:00,2017-04-23 14:11:00,N576ND,17250.6,2430.0,MAIN BATT DISCHARGE WHEN BELOW 1300 RPMS.,2017-04-23,INSP & FOUND ALT BELT TENSION LOW. TIGHTENED ALT BELT TENSION TO SPECS. OPS CK GOOD.,c_40,battery issue low voltage weak battery charging issue
1163240,2017-04-24 06:44:00,2017-04-24 00:00:00,N602ND,7146.4,2430.0,STBY BATTERY FAILED PREFLIGHT TEST,2017-04-24,"CLEANED CANNON & SERIAL PLUG CONNECTIONS AND TESTED BATTERY, OP CHECK GOOD",c_40,battery issue low voltage weak battery charging issue
1163280,2017-04-25 07:29:00,2017-04-25 00:00:00,N540ND,15043.7,8000.0,BATTERY IS SHOWING 24 VOLTS BUT BARELY CRANKED OVER AFTER 3 ATTEMPTS TO START IT WOULDN'T TURN AT ALL,2017-04-25,INSPECTED & REMOVED BATTERY FROM A/C - CHARGED BATTERY TO CAPACITY,c_40,battery issue low voltage weak battery charging issue
1163280,2017-04-25 07:29:00,2017-04-25 00:00:00,N540ND,15043.7,8000.0,BATTERY IS SHOWING 24 VOLTS BUT BARELY CRANKED OVER AFTER 3 ATTEMPTS TO START IT WOULDN'T TURN AT ALL,2017-04-25,PERFORMED CAPACITY TEST - 14 AMP HRS. NO FURTHER DISCREPANCY NOTED,c_40,battery issue low voltage weak battery charging issue
1163280,2017-04-25 07:29:00,2017-04-25 00:00:00,N540ND,15043.7,8000.0,BATTERY IS SHOWING 24 VOLTS BUT BARELY CRANKED OVER AFTER 3 ATTEMPTS TO START IT WOULDN'T TURN AT ALL,2017-04-25,RE-INSTALLED BATTERY INTO A/C -  FUNCTION CHECK - OK NO FURTHER DISCREPANCY NOTED,c_40,battery issue low voltage weak battery charging issue
1163281,2017-04-25 08:28:00,2017-04-25 00:00:00,N605ND,10605.3,2400.0,STBY BATTERY INOPERATIVE,2017-04-25,CLEANED CONTACTS AT SERIAL PLUG. BATTERY TEST FAILED. CHECKED VOLTAGE. FOUND BATTERY WAS BAD. INSTALLED NEW STBY BATTERY. OP CHECK GOOD,c_40,battery issue low voltage weak battery charging issue
1163298,2017-04-25 14:43:00,2017-04-27 00:00:00,N543ND,13218.800000000001,520.0,SEALED BATTERY CAPACITY CHECK DUE,2017-04-26,INSPECTED & CHARGED BATTERY TO CAPACITY - DEFERED CAPACITY CHECK UNTIL NEXT SCHEDULED PHASE INSPECTION,c_40,battery issue low voltage weak battery charging issue
1163306,2017-04-26 06:28:00,2017-04-26 00:00:00,N510ND,11947.900000000001,2400.0,MASTER BATTERY DIED ON PREFLIGHT PFD DID NOT TURN ON.,2017-04-26,REMOVED OLD BATTERY AND REPLACED WITH NEW P/N RG24-15M S/N 40845100,c_40,battery issue low voltage weak battery charging issue
1163351,2017-04-28 06:43:00,2017-05-01 10:15:00,N548ND,9876.2,3400.0,RED X TO RIGHT OF ALT/VSI. MFD HDG & ALT KNOBS WOULDN'T CHANGE VALUES.,2017-05-01,INSPECTED.,c_40,battery issue low voltage weak battery charging issue
1163353,2017-04-28 06:43:00,2017-04-28 15:12:00,N677ND,4517.700000000001,3400.0,"DURING AFTER START CHECKLIST; BOTH AVI 1 & 2 WERE TURNED ON BUT, MFD NEVER TURNED ON.",2017-04-28,"UNABLE TO CONFIRM. CYCLED AVI MST SW 20-30 TIMES. SWITCH IS WORKING PROPERLY. INSPECTED CB CPC, IT IS LOCKED & SECURE. SYSTEM TESTS GOOD.",c_40,battery issue low voltage weak battery charging issue
1163361,2017-04-28 09:45:00,2017-04-28 15:00:00,N523ND,11303.9,2400.0,STBY BATTERY LIGHT DOESN'T TURN ON.,2017-04-28,INSPECTED & FOUND SWITCH & STBY BATT SYSTEM TO OPS CK GOOD.,c_40,battery issue low voltage weak battery charging issue
1163364,2017-04-28 13:42:00,2017-05-02 13:19:00,N782ND,1669.5,2400.0,LEFT ALT FAILURE. RAN SINGLE ALT FAILURE CHECKLIST & DIDN'T HELP.,2017-04-28,"RAN A/C, VERIFIED NO INDICATED POWER OUTPUT FROM L/H ENG. INDICATED 24.3 VOLT & DROPPING, BATT DRAW SHOWN, NO OUTPUT INDICATED. VERIFIED BATT VOLTAGE TO ALT POWER WIRE & JUST LESS THAN BATT VOLTAGE TO FIELD & POWER TO AUX WIRE.",c_40,battery issue low voltage weak battery charging issue
1163367,2017-04-28 13:48:00,2017-04-28 15:15:00,N565ND,18750.3,7520.0,L/H ENGINE WIRE BUNDLE RUBBING ON BATTERY COOLING DUCT.,2017-04-28,"INSPECTED BATTERY COOLING DUCT, NO DEFECTS NOTED. SECURED DUCTR W/ SILICONE.",c_40,battery issue low voltage weak battery charging issue
1163392,2017-04-29 13:24:00,2017-04-29 00:00:00,N602ND,7213.9,2400.0,STANDBY BATTERY FAILED TEST CHECK,2017-04-29,OPS CHECKED GOOD NO DEFECTS NOTED,c_40,battery issue low voltage weak battery charging issue
1163432,2017-05-01 07:56:00,2017-05-01 00:00:00,N602ND,7213.9,2400.0,STANDBY BATTERY DOES NOT WORK GREEN LIGHT GOES OFF AFTER 1-2 SECONDS,2017-05-01,CLEANED STANDBY TEST CONNECTOR. PERFORMED OPERATION CHECK OPS CHECK GOOD. RAN AIRCRAFT TO CHARGE SYSTEM PERFORMED TEST AFTER SHUT DOWN OPS CHECK GOOD NO FURTHER DEFECTS NOTED,c_40,battery issue low voltage weak battery charging issue
1163440,2017-05-01 10:09:00,2017-05-04 00:00:00,N540ND,15099.8,2340.0,BATTERY IS NOT HOLDING CHARGE,2017-05-03,REPLACED W/ NEW BATTERY OF SAME TYPE/ P/N: RG24-15M S/N: 40845110,c_40,battery issue low voltage weak battery charging issue
1163446,2017-05-01 13:47:00,2017-05-26 12:25:00,N522ND,17262.2,520.0,SEALED BATTERY CAP CK DUE.,2017-05-01,REMOVED & REPLACED BATTERY W/ S/N 40779684.,c_40,battery issue low voltage weak battery charging issue
1163502,2017-05-02 15:30:00,2017-05-03 10:46:00,N525ND,16421.1,520.0,SEALED BATTERY CAP TEST DUE.,2017-05-03,INSTALLED SERVICEABLE S/N 40779555. OPS CK GOOD.,c_40,battery issue low voltage weak battery charging issue
1163519,2017-05-03 07:48:00,2017-05-03 15:21:00,N719ND,784.1999999999999,2400.0,DURING HOLDING A WARNING SOUNDED & THERE WAS LOW VOLTS & HIGH DISCHARGE. RAN CHECKLIST & HAD -9 AMPS AFTER ESSENTIAL & LIGHT CIRCUIT BREAKER PULLED. NO ALTERNATOR CB'S AUTOMATICALLY POPPED.,2017-05-03,REPAIRED ALT POWER WIRE TERMINAL END AT ALTERNATOR. OPS CK'ED GOOD.,c_40,battery issue low voltage weak battery charging issue
1163568,2017-05-04 10:24:00,2017-05-04 15:05:00,N546ND,15312.5,2400.0,"STBY BATTERY FAILED TEST, LIGHT CAME ON FOR ONLY 1 SEC.",2017-05-04,"TESTED STBY BATTERY SYSTEM, OPS & TESTED GOOD.",c_40,battery issue low voltage weak battery charging issue
1163629,2017-05-05 15:46:00,2017-05-05 13:31:00,N785ND,958.0,2430.0,"PULLED L ALT FIELD CIRCUIT BREAKER TO SIMULATE ALT FAILURE. AFTER COMPLETING ALT FAILURE CHECKLIST, R/H ALT SHOWED ZERO AMPS.",2017-05-05,RAN A/C & FOUND SYSTEM OPERATING NORMAL. BOTH ALTERNATORS OPS CK GOOD.,c_40,battery issue low voltage weak battery charging issue
1163630,2017-05-05 16:50:00,2017-05-05 14:23:00,N689ND,7484.8,2430.0,L/H ALTERNATOR INOP.,2017-05-05,INSPECTED SYSTEM & FOUND WIRE BROKEN NEAR FUSE FOR AUX WIRE. REPAIRED WIRE. OPS CK GOOD.,c_40,battery issue low voltage weak battery charging issue
1163742,2017-05-09 14:19:00,2017-05-12 11:03:00,N561ND,15878.1,520.0,BATTERY CAP CK DUE.,2017-05-12,"CHARGED BATTERY, CAP CK GOOD, 96%. RECHARGED.",c_40,battery issue low voltage weak battery charging issue
1163754,2017-05-10 06:04:00,2017-05-10 15:27:00,N579ND,15655.399999999998,520.0,ELT BATTERY REPLACEMENT DUE.,2017-05-10,DATE CORRECTED TO 11/30/21.,c_40,battery issue low voltage weak battery charging issue
1163767,2017-05-10 13:42:00,2017-05-10 15:35:00,N548ND,10005.5,7100.0,BATTERY BRACKET CLAMP ON ENGINE MOUNT BROKEN.,2017-05-10,REMOVED & REPLACED BATTERY BRACKET CLAMP ON ENGINE MOUNT.,c_40,battery issue low voltage weak battery charging issue
1163771,2017-05-10 12:47:00,2017-05-10 00:00:00,N569ND,15834.8,3900.0,"FIRST FLIGHT ENGINE INDICATING ALL RED X'S AFTER TURNING ON STBY BATT. TURNED OFF STBY. TURNED BACK ON, NO RED X'S. SECOND FLIGHT ON PREFLIGHT, RED X ON FUEL QUANTITY",2017-05-10,OPS CHECKED IN STBY MODE. NO DEFECT. OPS CHECKED WITH MAIN POWER NO DEFECT NOTED,c_40,battery issue low voltage weak battery charging issue
1163828,2017-05-12 09:41:00,2017-05-12 14:55:00,N523ND,11492.9,2400.0,"AFTER TURNING ON MASTER SWITCH, PFD SCREEN DID NOT COME ON.",2017-05-12,"INSPECTED BATTERY CONTACTOR, NO DEFECTS. FOUND CIRCUIT BREAKERS POPPED. RESET CIRCUIT BREAKERS. ALL SYSTEMS OPS GOOD.",c_40,battery issue low voltage weak battery charging issue
1163886,2017-05-15 05:46:00,2017-05-16 11:18:00,N543ND,13401.800000000001,520.0,SEALED BATTERY CAP CHECK DUE,2017-05-15,BATTERY CAP TEST PERFORMED - NO DISCREPANCY NOTED,c_40,battery issue low voltage weak battery charging issue
1163932,2017-05-16 10:02:00,2017-05-16 13:33:00,N565ND,18984.6,2430.0,"BATTERY MASTER ON, NO BATTERY LIFE REMAINING.",2017-05-16,REMOVED BATTERY & PLACED ON CHARGER.,c_40,battery issue low voltage weak battery charging issue
1163965,2017-05-16 10:07:00,2017-05-17 14:38:00,N652ND,6055.9,2300.0,AVIONICS MASTER SWITCH LOOSE ON PANEL.,2017-05-17,RESECURED AVIONICS SWITCH.,c_40,battery issue low voltage weak battery charging issue
1163968,2017-05-17 10:06:00,2017-05-18 00:00:00,N509ND,12280.5,2430.0,LOW VOLTS ANNUNCIATOR CAME ON AND STAYED ON BATT M WAS SHOWING 14.5,2017-05-18,FOUND BROKEN FIELD WIRE REPLACED WITH NEW TERMINAL END. RECONNECTED OPS CHECK GOOD,c_40,battery issue low voltage weak battery charging issue
1164039,2017-05-21 12:19:00,2017-05-22 13:05:00,N528ND,15781.3,520.0,SEALED BATTERY CAP CK DUE.,2017-05-22,INSTALLED BATTERY S/N 40714468.,c_40,battery issue low voltage weak battery charging issue
1164070,2017-05-22 12:20:00,2017-05-22 15:04:00,N576ND,17463.9,2430.0,ENGINE INSTRUMENTS SHOWED A DRAIN ON MAIN BATTERY DURING DESCENT INTO GRAND FORKS (2000 RPM).,2017-05-22,"RAN A/C, NO DEFECTS NOTED. OPS CK GOOD.",c_40,battery issue low voltage weak battery charging issue
1164103,2017-05-23 21:46:00,2017-05-23 14:02:00,N782ND,1921.5,2430.0,R/H ALTERNATOR DID NOT WORK ON ENGINE START.,2017-05-23,"RAN A/C, FOUND SYSTEM OPERATING NORMAL. R/H ALTERNATOR IS OPERATING CORRECTLY. OPS CK GOOD.",c_40,battery issue low voltage weak battery charging issue
1164117,2017-05-24 06:41:00,2017-05-24 00:00:00,N603ND,6613.2,8000.0,STARTER WOULD NOT ENGAGE PROP WOULD NOT CRANK,2017-05-24,STARTED PLANE 10 TIMES NO DEFECTS NOTED,c_40,battery issue low voltage weak battery charging issue
1164129,2017-05-24 14:16:00,2017-05-24 10:32:00,N524ND,18584.4,2400.0,DURING CLIMB; BATTERY M AMPS SHOWED YELLOW & -14 DISCHARGE.,2017-05-24,"RAN A/C, OPS CK GOOD.",c_40,battery issue low voltage weak battery charging issue
1164129,2017-05-24 14:16:00,2017-05-24 10:32:00,N524ND,18584.4,2400.0,DURING CLIMB; BATTERY M AMPS SHOWED YELLOW & -14 DISCHARGE.,2017-05-24,"PERFORMED GROUND RUN, VERIFIED ZERO ALTERNATOR OUTPUT INDICATED. FOUND ALT POWER WIRE AT ALT BROKEN OFF. REPLACED TERMINAL END.",c_40,battery issue low voltage weak battery charging issue
1164179,2017-05-26 06:45:00,2017-05-26 11:21:00,N782ND,1980.0,2400.0,"UPON ENGINE START; R/H ALT DID NOT DISPLAY AMPS, WHEN POWERED TO 2000 RPM & L/H ALT OFF, R/H ALT DISPLAYED CORRECT TEMPS.",2017-05-26,"TROUBLESHOT ALTERNATOR, FOUND ALTERNATOR TO BE BAD. REMOVED & REPLACED W/ NEW ALTERNATOR S/N H-R022702. RAN A/C, OPS CK GOOD.",c_40,battery issue low voltage weak battery charging issue
1164182,2017-05-26 06:58:00,2017-05-26 00:00:00,N605ND,10910.7,2400.0,UPON PRE FLIGHT STUDENT NOTICED MASTER SWITCHES WERE LEFT ON THROUGH THE NIGHT,2017-05-26,REMOVED BATTERY PLACED ON CHARGER TO CHARGE,c_40,battery issue low voltage weak battery charging issue
1164182,2017-05-26 06:58:00,2017-05-26 00:00:00,N605ND,10910.7,2400.0,UPON PRE FLIGHT STUDENT NOTICED MASTER SWITCHES WERE LEFT ON THROUGH THE NIGHT,2017-05-26,CHARGED BATTERY AND REINSTALLED OPS CHECK GOOD,c_40,battery issue low voltage weak battery charging issue
1164221,2017-05-29 06:22:00,2017-05-31 13:12:00,N562ND,12320.099999999999,7100.0,ENGINE CHANGE DUE.,2017-05-31,"COMPLETED INSTALLATION OF WIRES, HOSES, ALTERNATOR. INSTALLED EXHAUST SYSTEM, 8 QTS MINERAL OIL. PER-OILED ENGINE. REINSTALLED PLUGS & LEADS. RECONNECTED BATTERY. RECONNECTED ENGINE CONTROLS & TRAVEL CK GOOD. SEE PD #17 FOR ENGINE RUN.",c_40,battery issue low voltage weak battery charging issue
1164233,2017-05-30 05:13:00,2017-05-30 00:00:00,N602ND,7455.1,2400.0,TEST LIGHT FAILED TO REMAIN ILLUMINATED DURING STANDBY BATTERY TEST,2017-05-30,CLEANED AND TESTED OPS CHECK GOOD NO DEFECTS NOTED,c_40,battery issue low voltage weak battery charging issue
1164257,2017-05-30 11:27:00,2017-05-31 00:00:00,N608ND,10403.4,520.0,RG24-15M CAP CHECK DUE,2017-05-30,PERFORMED BATTERY CAP TEST. BATTERY PASSED. NO DEFECT NOTED,c_40,battery issue low voltage weak battery charging issue
1164300,2017-05-31 15:46:00,2017-05-31 12:48:00,N576ND,17563.5,2430.0,"THROTTLE @ 1000 RPM, M BATT WAS AT -5 AMPS & DURING RUN UP M BATT AMPS WERE POSITIVE.",2017-05-31,RAN A/C & FOUND ALTERNATOR TO BE OPERATING NORMAL AT CORRECT RPM. NO DEFECTS NOTED. OPS CK GOOD.,c_40,battery issue low voltage weak battery charging issue
1164302,2017-05-31 14:29:00,2017-05-31 00:00:00,N570ND,19226.7,2400.0,M BATTERY AMPS INDICATOR WITH RED X IN EXCESS OF 30 MIN,2017-05-31,PERFORMED OPERATION CHECK OF AMP METER NO DEFECTS NOTED,c_40,battery issue low voltage weak battery charging issue
1164375,2017-06-03 09:55:00,2017-06-03 00:00:00,N635ND,8900.8,2350.0,ON START UP THERE WAS CONSTANT STATIC FROM BOTH RADIOS. TURNING THE MASTER SWITCH OFF STOPPED THE STATIC NO STATIC WAS HEARD WHEN THE STANDBY BATTERY ONLY WAS ON,2017-06-03,TROUBLE SHOT DISCREPANCY. DETERMINED THE R/H STROBE POWER PACK HAD FAILED. REMOVED AND REPLACED POWERPACK RADIO AND STROBES FUNCTION CHECKED OK. NO DEFECTS NOTED,c_40,battery issue low voltage weak battery charging issue
1164411,2017-06-05 06:53:00,2017-06-05 00:00:00,N605ND,10978.2,2420.0,BATT M. SHOWING A DISCHARGE OF 10.5 AMPS ELECTRICAL BUS M&E VOLTS SHOWING 34.4 V. THIS HAPPENED AFTER ENGINE START - ELECTRICAL PROBLEM REMAINED THE SAME EVEN AFTER INCREASING RPM TO REMOVED ALTERNATOR,2017-06-05,INSPECTED ELECTRICAL SYSTEM - REMOVED INOP ALTERNATOR - INSTALLED AN OVERHAULED ALTERNATOR - OPERATIONS CHECK - NO FURTHER DISCREPACNY NOTED - INSTALLED PN 9910591-11 SERIAL # H0060932,c_40,battery issue low voltage weak battery charging issue
1164448,2017-06-06 12:10:00,2017-06-23 00:00:00,N540ND,15456.8,2400.0,BATTERY TRAY ADEL CLAMP BROKEN,2017-06-21,REPLACED BROKEN CLAMP WITH SERVICABLE CLAMP,c_40,battery issue low voltage weak battery charging issue
1164456,2017-06-06 16:43:00,2017-06-06 10:20:00,N561ND,6170.599999999999,2430.0,BATTERY VOLTAGE IS LOW.,2017-06-06,CONNECTED BATTERY TO CHARGER.,c_40,battery issue low voltage weak battery charging issue
1164456,2017-06-06 16:43:00,2017-06-06 10:20:00,N561ND,6170.599999999999,2430.0,BATTERY VOLTAGE IS LOW.,2017-06-06,DISCONNECTED CHARGER. OPS CK GOOD.S,c_40,battery issue low voltage weak battery charging issue
1164456,2017-06-06 16:43:00,2017-06-06 10:20:00,N561ND,6170.599999999999,2430.0,"ELECTRICAL MAIN BATTERY NOT CHARGING WHEN ON FINAL. NOTICED M BUS VOLT 24.3, -11.5 AMPS.",2017-06-06,"RAN A/C, OPS CK GOOD.",c_40,battery issue low voltage weak battery charging issue
1164456,2017-06-06 16:43:00,2017-06-06 10:20:00,N561ND,6170.599999999999,2430.0,"ELECTRICAL MAIN BATTERY NOT CHARGING WHEN ON FINAL. NOTICED M BUS VOLT 24.3, -11.5 AMPS.",2017-06-06,RAN A/C. CONFIRMED DISCREP. FOUND FIELD WIRE BROKEN. REPAIRED WIRE.,c_40,battery issue low voltage weak battery charging issue
1164456,2017-06-06 16:43:00,2017-06-06 10:20:00,N561ND,6170.599999999999,3900.0,MASTER SWITCH FROZEN IN POSITION.,2017-06-06,REMOVED & REPLACED SWITCH. SCREENS WOULD NOT COME ON. FOUND ALT & BATTERY POWER WIRES SWITCHED. SWAPPED WIRES. OPS CK GOOD.,c_40,battery issue low voltage weak battery charging issue
1164466,2017-06-06 21:33:00,2017-06-07 10:56:00,N576ND,17599.8,2400.0,"DURING CRUISE, AT 2500 RPM, NOTICED MAIN BATTERY SHOWING -1 DISCHARGE.",2017-06-06,MULTIPLE WRITE UPS ON ALTERNATOR SYSTEM. INSPECTED WIRING & ALTERNATOR. CK'ED A/C HISTORY. CALIBRATED MAIN BATTERY AMP METER. OPS CK GOOD.,c_40,battery issue low voltage weak battery charging issue
1164466,2017-06-06 21:33:00,2017-06-07 10:56:00,N576ND,17599.8,2400.0,"DURING CRUISE, AT 2500 RPM, NOTICED MAIN BATTERY SHOWING -1 DISCHARGE.",2017-06-07,INSPECTED.,c_40,battery issue low voltage weak battery charging issue
1164530,2017-06-09 06:33:00,2017-06-09 14:50:00,N562ND,7197.299999999999,2430.0,ALT FIELD CB POPPED. REDUCED ELECTRICAL LOAD & RESET IT. IT POPPED AGAIN.,2017-06-09,TROUBLESHOT & INSPECTED FIELD WIRING. REPLACED ALTERNATOR W/ NEW S/N H-R021168. OPS CK GOOD.,c_40,battery issue low voltage weak battery charging issue
1164553,2017-06-10 10:43:00,2017-06-10 00:00:00,N570ND,19355.1,2400.0,"BATT M RED ""X"" NOTICED AFTER 3RD TAKEOFF WHILE OVER PRACTICE AREA. NO INDICATION OF LOW VOLTS, NO LOW VOLTS",2017-06-10,"GROUND OPS CHECKED GOOD, NO DEFECTS NOTED",c_40,battery issue low voltage weak battery charging issue
1164565,2017-06-10 16:32:00,2017-06-13 00:00:00,N606ND,14478.7,5300.0,RIVET ON TOP LH CORNER OF BATTERY BOX IS BROKEN,2017-06-13,REPLACED BROKEN RIVET,c_40,battery issue low voltage weak battery charging issue
1164641,2017-06-13 14:03:00,2017-06-15 10:52:00,N695ND,5533.599999999999,3400.0,"ON BEFORE START CK, PFD FAILED TO START W/ E. BATT ON. STANDBYS BECAME ACTIVE.",2017-06-13,FOUND STBY POWER. PFD 5 AMP FUSE BLOWN. REPLACED FUSE. NO OTHER PROBLEMS FOUND. PFD OPERATION TESTS GOOD.,c_40,battery issue low voltage weak battery charging issue
1164719,2017-06-16 05:56:00,2017-06-16 14:03:00,N559ND,13493.6,2570.0,MAIN BATTERY TRAY SUPPORT HAS BROKEN ADEL CLAMP.,2017-06-16,REMOVED & REPLACED ADEL CLAMP.,c_40,battery issue low voltage weak battery charging issue
1164720,2017-06-16 06:02:00,2017-06-19 15:36:00,N568ND,16922.2,2570.0,MAIN BATTERY MOUNT ADEL CLAMP BROKEN.,2017-06-19,REMOVED & REPLACED ADEL CLAMP.,c_40,battery issue low voltage weak battery charging issue
1164721,2017-06-16 06:34:00,2017-06-16 13:57:00,N522ND,17289.8,2400.0,DURING FLIGHT NOTICED S BATT DISCHARGING NEG .3 & NEG .4 TOWARDS END OF FLIGHT.,2017-06-16,REMOVED & REPLACED STBY BATT W/ S/N 16E44. OPS CK'ED GOOD.,c_40,battery issue low voltage weak battery charging issue
