workorder,date_time_opened,date_time_closed,registration,total_time,ata_code,problem,date,action,cluster,cluster_name
1116042,2012-10-03 15:05:00,2012-10-03 14:28:00,N538ND,6137.0,7230.0,R/H FWD BAFFLE SEAL TORN.,2012-10-03,REPAIRED HOLE IN BAFFLE SEAL.,c_9,baffle seal
1118801,2013-01-15 09:32:00,2013-01-15 14:28:00,N529ND,11559.099999999999,7230.0,BAFFLE SEAL LOOSE ON LEFT SIDE OF ENGINE.,2013-01-15,SECURED BAFFLE SEAL.,c_9,baffle seal
1120810,2013-03-19 13:34:00,2013-03-19 09:23:00,N509ND,7600.6,7230.0,R/H FWD BAFFLE SEAL NEEDS TO BE SECURED.,2013-03-19,"REPLACED BAFFLE SEAL, FOUND UNSERVICEABLE.",c_9,baffle seal
1121045,2013-03-25 11:51:00,2013-03-27 12:28:00,N562ND,3615.2999999999997,7110.0,"NEW TAPPING NOISE PRESENT, ORIGINAL NOISE PERSISTS.",2013-03-27,"REMOVED ALL CHAFE TAPE. ADJUSTED COWLING ALIGNMENT BY ADDING SHIMS TO COWL SHOCK MOUNTS 1, 10 & 11. SECURED ENG AIR BAFFLE SEALS ON FWD SIDE TO ENSURE PROPER PLACEMENT. APPLIED RTV TO LEFT NLG STEERING ROD BOOT SEAL PLATE & TO TOP OF WINDSHIELD.",c_9,baffle seal
1121184,2013-03-28 13:41:00,2013-03-28 14:44:00,N549ND,8127.099999999999,7230.0,FRONT R/H BAFFLE SEAL IS NOT ATTACHED.,2013-03-28,FOUND SEAL TORN. REMOVED & REPLACED BAFFLE SEAL.,c_9,baffle seal
1121218,2013-03-29 13:52:00,2013-03-30 13:42:00,N529ND,12187.599999999999,7230.0,FWD R/H BAFFLE SEAL IS TORN.,2013-03-29,REMOVED & REPLACED BAFFLE SEAL.,c_9,baffle seal
1122024,2013-04-25 14:52:00,2013-05-08 13:45:00,N517ND,9399.1,7230.0,BAFFLE SEAL LOOSE OVER CYL #3.,2013-04-25,RESECURED BAFFLE SEAL.,c_9,baffle seal
1122592,2013-05-11 10:15:00,2013-05-11 14:00:00,N525ND,6641.299999999999,7230.0,FWD R/H BAFFLE SEAL NEEDS TO BE REATTACHED.,2013-05-11,REMOVED & REPLACED BAFFLE SEAL.,c_9,baffle seal
1123464,2013-06-05 15:01:00,2013-06-05 10:12:00,N545ND,8861.6,7230.0,CYL #3 AFT UPPER BAFFLE SEAL IS LOOSE.,2013-06-05,RESECURED BAFFLE SEAL.,c_9,baffle seal
1124266,2013-06-28 14:50:00,2013-06-29 12:18:00,N560ND,4815.0,7230.0,UPPER R/H BAFFLE SEAL LOOSE.,2013-06-29,RESECURED BAFFLE SEAL.,c_9,baffle seal
1126035,2013-08-29 12:55:00,2013-08-29 14:09:00,N532ND,6690.299999999999,7230.0,CYL #1 GOV BAFFLE SEAL IS COMING OFF.,2013-08-29,REFASTENED BAFFLE SEAL.,c_9,baffle seal
1126260,2013-09-05 18:12:00,2013-09-05 14:27:00,N571ND,9055.8,7230.0,FWD R/H ENGINE BAFFLE SEAL LOOSE.,2013-09-05,RESECURED BAFFLE SEAL.,c_9,baffle seal
1126373,2013-09-09 14:51:00,2013-09-09 14:31:00,N524ND,8900.9,7230.0,R/H FWD BAFFLE SEAL LOOSE.,2013-09-09,RESECURED BAFFLE SEAL.,c_9,baffle seal
1126514,2013-09-13 09:33:00,2013-09-25 13:58:00,N513ND,13368.8,7900.0,OIL COOLER MISSING LOWER FOAM BAFFLE SEAL.,2013-09-25,INSTALLED FOAM.,c_9,baffle seal
1126514,2013-09-13 09:33:00,2013-09-25 13:58:00,N513ND,13368.8,7230.0,R/H FORWARD BAFFLE SEAL IS LOOSE.,2013-09-25,RESECURED R/H BAFFLE SEAL.,c_9,baffle seal
1126527,2013-09-13 13:57:00,2013-09-13 13:21:00,N520ND,9354.2,7230.0,R/H FWD BAFFLE SEAL IS LOOSE.,2013-09-13,RESECURED BAFFLE SEAL.,c_9,baffle seal
1126527,2013-09-13 13:57:00,2013-09-13 13:21:00,N520ND,9354.2,7230.0,"AFT BAFFLE SEAL LOOSE, R/H SIDE.",2013-09-13,RESECURED BAFFLE SEAL.,c_9,baffle seal
1126607,2013-09-16 15:01:00,2013-09-17 15:26:00,N571ND,9206.4,7230.0,R/H FWD BAFFLE SEAL IS LOOSE.,2013-09-17,RESECURED.,c_9,baffle seal
1127110,2013-10-02 14:29:00,2013-10-02 15:12:00,N564ND,9660.4,7230.0,CYL #2 TOP BAFFLE SEAL IS  LOOSE.,2013-10-02,RESECURED BAFFLE SEAL.,c_9,baffle seal
1127196,2013-10-05 10:42:00,2013-10-05 12:38:00,N509ND,9437.5,7230.0,FWD BOTTOM ENGINE BAFFLE SEAL HAS HOLES IN IT.,2013-10-05,REMOVED & REPLACED BAFFLE.,c_9,baffle seal
1127202,2013-10-06 08:50:00,2013-10-06 10:54:00,N574ND,14027.2,7250.0,OIL COOLER LOWER BAFFLE SEAL IS MISSING.,2013-10-06,APPLIED HIGH TEMP SILICONE.,c_9,baffle seal
1127346,2013-10-10 14:28:00,2013-10-10 14:36:00,N526ND,12273.6,7900.0,OIL COOLER LOWER FOAM BAFFLE SEAL IS MISSING.,2013-10-10,APPLIED HIGH TEMP SILICONE.,c_9,baffle seal
1127391,2013-10-11 14:28:00,2013-10-11 11:24:00,N551ND,10489.099999999999,7900.0,LOWER OIL COOLER BAFFLE SEAL IS MISSING.,2013-10-11,APPLIED HIGH TEMP SILICONE.,c_9,baffle seal
1127398,2013-10-12 07:16:00,2013-10-12 09:43:00,N508ND,7293.799999999999,7900.0,LOWER OIL COOLER BAFFLE SEAL IS MISSING.,2013-10-12,APPLIED HIGH TEP SILICONE.,c_9,baffle seal
1127719,2013-10-22 14:38:00,2013-10-22 14:33:00,N508ND,7366.0,7230.0,R/H FWD ENGINE BAFFLE SEAL LOOSE.,2013-10-22,REATTACHED BAFFLE SEAL.,c_9,baffle seal
1127752,2013-10-23 14:57:00,2013-10-23 15:00:00,N524ND,9325.4,7230.0,LOWER L/H FWD BAFFLE SEAL IS LOOSE.,2013-10-23,REPAIRED BAFFLE SEAL & SECURED.,c_9,baffle seal
1128002,2013-10-31 09:23:00,2013-10-31 11:27:00,N571ND,9632.1,7230.0,FWD LOWER BAFFLE SEAL LOOSE.,2013-10-31,RESECURED BAFFLE SEAL.,c_9,baffle seal
1128133,2013-11-04 14:41:00,2013-11-04 14:50:00,N543ND,9032.8,7230.0,L/H ENGINE BAFFLE SEAL RIVETS LOOSE.,2013-11-04,REMOVED RIVETS & REINSTALLED NEW.,c_9,baffle seal
1129172,2013-12-09 14:57:00,2013-12-09 14:04:00,N571ND,9935.1,7230.0,FWD LOWER ENGINE BAFFLE SEAL LOOSE.,2013-12-09,RESECURED BAFFLE SEAL ON FWD ENGINE BAFFLE.,c_9,baffle seal
1130171,2014-01-23 07:24:00,2014-01-24 15:48:00,N565ND,10060.4,7230.0,ENGINE COOLING BAFFLE SEAL LOOSE ON TOP L/H SIDE.,2014-01-23,REATTACHED BAFFLE SEAL ON TOP L/H SIDE.,c_9,baffle seal
1130220,2014-01-24 07:32:00,2014-01-24 15:32:00,N579ND,6289.299999999999,7140.0,BOTTOM R/H SIDE ENGINE COOLING BAFFLE SEAL TORN.,2014-01-24,SECURED BOTTOM R/H SIDE ENGINE COOLING BAFFLE SEAL.,c_9,baffle seal
1130887,2014-02-11 06:59:00,2014-02-11 13:35:00,N530ND,11060.8,7230.0,#2 SIDE BAFFLE SEAL STAPLES LOOSE.,2014-02-11,TIGHTENED/RECRIMPED STAPLES.,c_9,baffle seal
1131144,2014-02-19 06:56:00,2014-02-19 10:57:00,N569ND,7718.1,7230.0,"ENGINE BAFFLE SEAL TORN, BOTTOM R/H CORNER.",2014-02-19,REPAIRED & SECURED BAFFLE SEAL.,c_9,baffle seal
1132392,2014-03-28 06:42:00,2014-03-28 10:17:00,N515ND,11369.8,7230.0,ENGINE BAFFLE RUBBER SEAL INSECURE @ #2 CYLINDER.,2014-03-28,ATTACHED/SECURED BAFFLE RUBBER SEAL.,c_9,baffle seal
1132434,2014-03-29 10:59:00,2014-03-30 12:55:00,N507ND,8771.9,7230.0,R/H & L/H SIDE OF FRONT BAFFLE SEAL TORN.,2014-03-29,SECURED R/H & L/H BAFFLE SEAL.,c_9,baffle seal
1132643,2014-04-07 14:41:00,2014-04-14 10:03:00,N560ND,6921.599999999999,7230.0,"BAFFLE SEAL TORN, BOTTOM LEFT SIDE.",2014-04-07,RESECURED BAFFLE SEAL.,c_9,baffle seal
1133154,2014-04-23 06:38:00,2014-04-23 14:34:00,N516ND,14848.599999999999,7230.0,#1 FRONT BAFFLE SEAL TORN.,2014-04-23,REPLACED SECTION OF SEAL.,c_9,baffle seal
1133510,2014-05-05 14:43:00,2014-05-05 15:19:00,N561ND,6765.0,7230.0,BOTTOM LEFT BAFFLE SEAL TORN.,2014-05-05,SECURED BAFFLE SEAL W/ SAFETY WIRE.,c_9,baffle seal
1133519,2014-05-05 20:22:00,2014-05-05 14:35:00,N574ND,10132.7,7230.0,"BAFFLE SEAL TORN, BOTTOM R/H SIDE.",2014-05-05,SECURED BAFFLE SEAL W/ SAFETY WIRE.,c_9,baffle seal
1134169,2014-05-27 10:09:00,2014-05-28 15:04:00,N531ND,7873.9,7230.0,"BAFFLE SEAL LOOSE, #1 CYL FWD BAFFLE.",2014-05-28,RESECURED BAFFLE SEAL TO FWD BAFFLE.,c_9,baffle seal
1134993,2014-06-24 06:32:00,2014-07-08 14:06:00,N558ND,11556.5,7100.0,RIGHT SIDE BAFFLE SEAL TORN.,2014-06-25,SECURED BAFFLE.,c_9,baffle seal
1135069,2014-06-26 13:16:00,2014-06-26 11:26:00,N564ND,11541.4,7230.0,"BAFFLE SEAL, ON BOTTOM RIGHT SIDE, NEEDS TO BE SECURED.",2014-06-26,SECURED BOTTOM RIGHT SIDE BAFFLE SEAL.,c_9,baffle seal
1135142,2014-07-01 06:00:00,2014-07-01 11:11:00,N574ND,10584.5,561.0,STARTER WIRE IS CHAFING ON BAFFLE SEAL.,2014-07-01,REPAIRED WIRE & CREATED CLEARANCE AROUND BAFFLE SEAL.,c_9,baffle seal
1135761,2014-07-22 12:41:00,2014-07-22 14:33:00,N551ND,12363.800000000001,7230.0,R/H & L/H FRONT BAFFLE SEAL NEEDS TO BE SECURED.,2014-07-22,SECURED R/H & L/H FRONT BAFFLE SEAL.,c_9,baffle seal
1135823,2014-07-24 06:14:00,2014-07-24 12:44:00,N608ND,1823.3999999999999,7230.0,R/H FRONT TOP ENGINE BAFFLE RUBBER SEAL NOT ATTACHED.,2014-07-24,REATTACHED R/H TOP ENGINE RUBBER BAFFLE SEAL.,c_9,baffle seal
1136269,2014-08-11 14:48:00,2014-08-15 10:36:00,N511ND,10845.2,7230.0,"FRONT BAFFLE SEAL ON BOTTOM LEFT & BOTTOM RIGHT SIDES, NEEDS TO BE SECURED.",2014-08-11,SECURED BOTTOM LEFT & BOTTOM RIGHT SIDES OF FRONT BAFFLE SEAL.,c_9,baffle seal
1136294,2014-08-12 13:37:00,2014-08-13 12:09:00,N608ND,2025.3000000000002,7230.0,UPPER RIGHT BAFFLE SEAL NEEDS TO BE SECURED.,2014-08-12,SECURED UPPER RIGHT BAFFLE SEAL.,c_9,baffle seal
1136351,2014-08-14 14:32:00,2014-08-22 14:23:00,N548ND,9881.8,7230.0,"FRONT BAFFLE SEAL NEEDS TO BE SECURED, TOP LEFT & RIGHT SIDES.",2014-08-14,SECURED FRONT BAFFLE SEALS.,c_9,baffle seal
1136372,2014-08-15 14:36:00,2014-08-16 15:08:00,N514ND,7838.700000000001,7230.0,FOUND RIGHT BAFFLE SEAL NEEDS TO BE SECURED.,2014-08-16,SECURED BAFFLE SEAL.,c_9,baffle seal
1136506,2014-08-22 06:21:00,2014-08-22 11:01:00,N551ND,12542.0,561.0,#2 SIDE BAFFLE SEAL LOOSE ON BAFFLE.,2014-08-22,RESECURED BAFFLE SEAL.,c_9,baffle seal
1136730,2014-09-02 06:18:00,2014-09-02 12:18:00,N549ND,7932.5,7230.0,"BAFFLE SEAL, FWD OF #2 CYL, IS LOOSE.",2014-09-02,SECURED BAFFLE SEAL.,c_9,baffle seal
1136874,2014-09-05 06:16:00,2014-09-06 11:13:00,N543ND,11336.8,7250.0,OIL COOLER LWR BAFFLE SEAL MISSING.,2014-09-05,SEALED AREA W/ RTV.,c_9,baffle seal
1137040,2014-09-10 15:47:00,2014-09-18 10:39:00,N536ND,10535.2,7210.0,FWD LOWER R/H BAFFLE SEAL NEEDS REPLACEMENT.,2014-09-11,INSTALLED NEW SECTION OF BAFFLE MATERIAL.,c_9,baffle seal
1137638,2014-09-27 10:41:00,2014-10-05 13:17:00,N531ND,9814.3,7230.0,ENGINE BAFFLE MISSING HARDWARE.,2014-10-05,REPLACED MISSING HARDWARE AT STARTER BAFFLE SEAL.,c_9,baffle seal
1137742,2014-09-30 13:34:00,2014-10-01 11:10:00,N564ND,12082.9,7230.0,R/H FUEL TOP ENGINE BAFFLE SEAL NEEDS TO BE SECURED.,2014-10-01,RESECURED BAFFLE SEAL.,c_9,baffle seal
1137826,2014-10-03 06:07:00,2014-10-03 13:35:00,N548ND,10245.7,7230.0,FRONT BAFFLE SEAL WORN BY ENG INLET & EDGES.,2014-10-03,INSTALLED RTV IN WORN AREAS.,c_9,baffle seal
1137998,2014-10-09 05:59:00,2014-10-10 13:35:00,N512ND,6415.0,7230.0,FWD BAFFLE SEALS HAVE WORN SPOTS.,2014-10-09,NO DAMAGED NOTED. APPLIED SILICONE TO SEAL AS BUFFER.,c_9,baffle seal
1138133,2014-10-13 15:29:00,2014-10-14 13:31:00,N655ND,384.0,7230.0,"BAFFLE SEAL ABOVE AIR FILTER BOX, CHAFED.",2014-10-14,APPLIED SILICONE TO AREA WHERE NEEDED. NO DAMAGE NOTED.,c_9,baffle seal
1138963,2014-11-11 06:26:00,2014-11-11 11:17:00,N570ND,12169.1,7230.0,COWL SEAL ON FRONT R/H BAFFLE LOOSE.,2014-11-11,TIGHTENED BAFFLE & RESEALED W/ RTV.,c_9,baffle seal
1139017,2014-11-13 06:23:00,2014-11-13 13:42:00,N561ND,8818.8,7230.0,R/H FWD BAFFLE SEAL LOOSE.,2014-11-13,REATTACHED BAFFLE SEAL TO ENGINE BAFFLE.,c_9,baffle seal
1139077,2014-11-14 14:51:00,2014-11-17 14:19:00,N522ND,15667.5,7230.0,FWD BAFFLE SEAL HAS WORN SPOTS BY ENG INDUCTION.,2014-11-14,INSTALLED BLACK RTV IN AREAS WORN.,c_9,baffle seal
1139361,2014-11-25 06:04:00,2014-11-25 11:20:00,N545ND,12841.0,561.0,#2 BAFFLE SEAL DISCONNECTED.,2014-11-25,RESECURED LOOSE BAFFLE SEAL.,c_9,baffle seal
1139400,2014-11-26 06:12:00,2014-11-26 13:17:00,N574ND,11760.8,7230.0,R/H FWD ENGINE BAFFLE SEAL LOOSE.,2014-11-26,REATTACHED BAFFLE SEAL.,c_9,baffle seal
1139567,2014-12-03 06:04:00,2014-12-04 09:49:00,N563ND,12402.8,7230.0,FWD LWR ENG BAFFLE SEAL WORN ABOVE ENG AIR INTAKE.,2014-12-03,INSTALLED RTV TO AREAS.,c_9,baffle seal
1139799,2014-12-11 06:06:00,2014-12-11 11:02:00,N538ND,11539.6,7230.0,BAFFLE SEAL WORN & WEARING ABOVE ENG INLET.,2014-12-11,SEALED UP AREAS W/ RTV.,c_9,baffle seal
1139933,2014-12-18 06:23:00,2014-12-22 13:14:00,N558ND,12771.8,7230.0,R/H FWD ENGINE BAFFLE LOOSE.,2014-12-19,RESECURED BAFFLE SEAL.,c_9,baffle seal
1139937,2014-12-18 06:28:00,2014-12-22 13:36:00,N511ND,11881.1,7230.0,"FWD LWR BAFFLE SEAL FOR ENG, INTAKE WEARING INTO IT.",2014-12-20,PATCHED BAFFLE W/ SILICONE SEALANT.,c_9,baffle seal
1140057,2014-12-29 16:16:00,2015-01-12 11:03:00,N510ND,4722.7,7100.0,FWD ENG BAFFLE LWR BLACK SEAL WORN AT AIR INTAKE AREA.,2014-12-31,APPLIED RTV AS NEEDED.,c_9,baffle seal
1140576,2015-01-21 13:56:00,2015-01-21 10:32:00,N564ND,7284.299999999999,7230.0,"SEAL WEARING AT FWD LWR BAFFLE, ABOVE INTAKE.",2015-01-21,INSTALLED RTV IN AREAS.,c_9,baffle seal
1140988,2015-02-02 19:25:00,2015-02-02 09:51:00,N556ND,12702.9,7230.0,CYL #1 FWD BAFFLE SEAL IS TORN LOOSE FROM FASTENER.,2015-02-02,REMOVED & REPLACED BAFFLE SEAL FASTENER.,c_9,baffle seal
1141022,2015-02-03 14:42:00,2015-02-03 11:08:00,N517ND,12296.5,7230.0,#1 CYL FWD BAFFLE SEAL HAS A HOLE WORN IN IT.,2015-02-03,REPAIRED W/ HIGH TEMP SILICONE.,c_9,baffle seal
1141070,2015-02-04 14:49:00,2015-02-04 13:32:00,N509ND,13205.5,7230.0,FWD LWR BAFFLE BLACK SEAL WORN FROM INTAKE.,2015-02-04,INSTALLED RTV IN WORN AREAS.,c_9,baffle seal
1141658,2015-02-23 06:37:00,2015-03-10 13:06:00,N531ND,11059.0,7230.0,FWD ENG BAFFLE SEAL TORN/DAMAGED.,2015-03-10,REPLACED SEAL MATERIAL.,c_9,baffle seal
1142313,2015-03-11 17:24:00,2015-03-13 10:22:00,N522ND,16434.0,7230.0,#2 CYL BAFFLE SEAL NEEDS TO BE SECURED.,2015-03-12,RESECURED CYL #2 SIDE BAFFLE SEAL.,c_9,baffle seal
1142922,2015-04-01 13:31:00,2015-04-01 10:49:00,N515ND,14216.2,7110.0,"COWL SEAL CHAFING ON BOTTOM COWL, L/H SIDE.",2015-04-01,RESECURED BAFFLE SEAL RUBBING ON COWL & INSTALLED CHAFE TAPE.,c_9,baffle seal
1143170,2015-04-10 16:46:00,2015-04-16 12:11:00,N532ND,13662.0,7230.0,BAFFLE SEAL DETACHED ABOVE #4 CYLINDER.,2015-04-16,SECURED W/ PULL RIVETS.,c_9,baffle seal
1143243,2015-04-14 09:22:00,2015-04-14 13:51:00,N519ND,10517.800000000001,7230.0,#1 CYL BAFFLE SEAL LOOSE.,2015-04-14,SECURED SEAL.,c_9,baffle seal
1143719,2015-04-30 06:03:00,2015-04-30 14:23:00,N549ND,9709.400000000001,7210.0,"FWD BAFFLE SEAL WORN, BY AIR FILTER.",2015-04-30,APPLIED RTV TO WORN AREAS.,c_9,baffle seal
1144060,2015-05-13 06:09:00,2015-05-22 13:26:00,N567ND,13632.5,7230.0,"BAFFLE SEAL LOOSE, FWD OF #1 CYL.",2015-05-13,SECURED BAFFLE SEAL.,c_9,baffle seal
1144579,2015-06-01 13:43:00,2015-06-02 10:53:00,N545ND,14113.0,7230.0,"FRONT BAFFLE SEAL NEEDS RTV, ABOVE ENG INLET.",2015-06-02,INSTALLED RTV TO SEAL.,c_9,baffle seal
1144790,2015-06-09 15:00:00,2015-06-09 13:45:00,N687ND,1513.5,7230.0,#2 FWD SIDE BAFFLE SEAL DISCONNECTED.,2015-06-09,REATTACHED USING POP RIVETS.,c_9,baffle seal
1144861,2015-06-11 16:42:00,2015-06-11 00:00:00,N572ND,7944.3,7230.0,PILOT REPORTED THAT CYL #1 FWD BAFFLE SEAL NEEDED TO BE LOOKED AT,2015-06-11,"LOOKED AT BAFFLE SEAL, REPOSITIONED, CHECKED GOOD",c_9,baffle seal
1144888,2015-06-12 08:52:00,2015-06-12 14:51:00,N515ND,7207.5,2450.0,STARTER WIRE CHAFING ON FRONT BAFFLE.,2015-06-12,TRIMMED BAFFLE SEAL TO CREATE CLEARANCE. FOUND WIRE DAMAGE NEGLIGIBLE. COVERED W/ SPIRAL WRAP.,c_9,baffle seal
1146705,2015-08-24 06:30:00,2015-08-24 13:47:00,N557ND,10043.199999999999,7230.0,#1 CYL FWD BAFFLE SEAL NEEDS TO BE RESECURED.,2015-08-24,RESECURED BAFFLE SEAL.,c_9,baffle seal
1146733,2015-08-24 13:52:00,2015-08-24 14:28:00,N572ND,8609.1,7230.0,#1 BAFFLE SEAL LOOSE.,2015-08-24,SECURED BAFFLE SEAL.,c_9,baffle seal
1146898,2015-08-31 13:45:00,2015-09-02 14:26:00,N529ND,7255.200000000001,7230.0,FWD R/H BAFFLE SEAL IS TORN.,2015-08-31,APPLIED HIGH TEMP SILICONE TO TEAR.,c_9,baffle seal
1147040,2015-09-05 10:24:00,2015-09-07 13:30:00,N575ND,13458.5,7230.0,FWD LWR BLACK BAFFLE SEAL WORN.,2015-09-05,INSTALLED RTV IN WORN AREAS.,c_9,baffle seal
1147459,2015-09-18 13:29:00,2015-09-21 14:37:00,N521ND,7128.6,7110.0,LWR FWD ENG COWL SEAL WORN SPOTS FROM INTAKE.,2015-09-18,SEALED TORN RUBBER BAFFLE HOLE W/ HIGH TEMP SILICONE.,c_9,baffle seal
1147628,2015-09-23 13:39:00,2015-09-25 12:50:00,N556ND,14554.5,561.0,#4 AFT BAFFLE SEAL OFF 2 RIVETS.,2015-09-24,RESECURED BAFFLE SEAL.,c_9,baffle seal
1147628,2015-09-23 13:39:00,2015-09-25 12:50:00,N556ND,14554.5,561.0,#2 FWD BAFFLE SEAL DISCONNECTED FOR 3 RIVETS.,2015-09-24,RESECURED BAFFLE.,c_9,baffle seal
1147888,2015-10-01 21:40:00,2015-10-01 14:11:00,N564ND,9107.1,7230.0,CYL #1 FWD BAFFLE SEAL NEEDS TO BE SECURED.,2015-10-01,SECURED BAFFLE SEAL.,c_9,baffle seal
1148567,2015-10-26 13:22:00,2015-10-26 11:27:00,N549ND,11177.3,7230.0,CYL #2 BAFFLE SEAL IS LOOSE.,2015-10-26,RESECURED BAFFLE SEAL.,c_9,baffle seal
1148983,2015-11-09 13:24:00,2015-11-09 14:51:00,N512ND,9125.5,7230.0,#2 SIDE BAFFLE SEAL LOOSE.,2015-11-09,RECRIMPED STAPLES.,c_9,baffle seal
1149480,2015-11-30 13:38:00,2015-11-30 13:55:00,N562ND,7998.900000000001,7230.0,#2 SIDE BAFFLE SEAL IS LOOSE.,2015-11-30,SECURED W/ POP RIVETS.,c_9,baffle seal
1149507,2015-12-01 14:50:00,2015-12-04 13:35:00,N569ND,16906.3,7230.0,LOWER FRONT BAFFLE SEAL TORN.,2015-12-03,REPLACED TORN SECTION OF BAFFLE SEAL.,c_9,baffle seal
1149714,2015-12-08 14:52:00,2015-12-08 13:00:00,N538ND,19633.7,7230.0,UPPER EXHAUST SHROUD DOES NOT ALIGN W/ LOWER SHROUD.,2015-12-08,TRIMMED FRONT BAFFLE & SEAL TO ALLOW PROPER ALIGNMENT.,c_9,baffle seal
1150140,2016-01-11 05:46:00,2016-01-12 13:45:00,N655ND,3574.5,7230.0,FRONT BAFFLE SEAL TORN.,2016-01-11,ZIP TIED & APPLIED SILICONE TO BAFFLE SEAL.,c_9,baffle seal
1150237,2016-01-13 13:34:00,2016-01-13 14:06:00,N511ND,14606.0,7230.0,BLACK FWD COWL (ENG) SEAL WORN BY INTAKE FILTER.,2016-01-13,APPLIED BLACK SILICONE TO FRONT ENGINE BAFFLE SEAL.,c_9,baffle seal
1150656,2016-01-29 06:34:00,2016-01-29 12:41:00,N527ND,11714.2,7230.0,FWD BAFFLE SEAL WORN BY ENG INTAKE.,2016-01-29,APPLIED SEALANT TO BAFFLE.,c_9,baffle seal
1151204,2016-02-16 06:10:00,2016-02-16 10:43:00,N529ND,8497.8,7230.0,BLACK SEAL FOR FWD BAFFLE NEEDS RTV.,2016-02-16,SEALED AREA W/ RTV.,c_9,baffle seal
1151294,2016-02-18 05:33:00,2016-02-18 14:30:00,N558ND,9652.900000000001,7230.0,"LWR ENG FWD BLACK BAFFLE SEAL, BY AIR FILTER, HAS WORN SPOTS.",2016-02-18,APPLIED 2 PART EPOXY.,c_9,baffle seal
1151325,2016-02-19 05:40:00,2016-02-26 11:35:00,N575ND,14491.7,7230.0,BAFFLE SEAL STAPLES LOOSE ON #1 CYLINDER BAFFLE SECTION.,2016-02-19,RESECURED BAFFLE SEAL W/ POP RIVETS.,c_9,baffle seal
1151370,2016-02-21 14:26:00,2016-02-26 13:11:00,N697ND,1768.5,7230.0,L/H ENG #1 CYLINDER FWD BAFFLE SEAL NEEDS TO BE SECURED.,2016-02-22,SECURED FWD BAFFLE SEAL.,c_9,baffle seal
1151707,2016-03-02 13:12:00,2016-03-02 14:32:00,N563ND,10485.1,7230.0,R/H FWD BAFFLE SEAL LOOSE.,2016-03-02,RESECURED BAFFLE SEAL.,c_9,baffle seal
1151768,2016-03-04 06:29:00,2016-03-04 11:14:00,N550ND,13034.8,7230.0,BAFFLE SEAL SECTION BY AIR FILTER NEEDS REPAIR.,2016-03-04,REPAIRED SEAL SECTION W/ SILICONE & NEW POP RIVETS.,c_9,baffle seal
1151803,2016-03-07 06:23:00,2016-03-07 11:13:00,N551ND,14340.9,7230.0,FRONT SEAL LOOSE & HAS WORN SPOTS (BAFFLE SEAL).,2016-03-07,SECURED SEAL & PUT RTV AT WORN SPOTS.,c_9,baffle seal
1152217,2016-03-21 13:30:00,2016-03-21 14:37:00,N514ND,12151.2,7230.0,LEFT BAFFLE LOOSE (#2 CYL BAFFLE SEAL).,2016-03-21,REATTACHED BAFFLE SEAL.,c_9,baffle seal
1152483,2016-03-31 06:10:00,2016-03-31 14:25:00,N575ND,14710.099999999999,7110.0,L/H FWD BAFFLE SEAL NEEDS TO BE RESECURED.,2016-03-31,RESECURED BAFFLE SEAL.,c_9,baffle seal
1153424,2016-05-03 13:37:00,2016-05-03 10:55:00,N515ND,9685.2,7230.0,"BLACK BAFFLE SEAL, FWD ENG, HAS SMALL WORN SPOT ON L/H SIDE.",2016-05-03,INSTALLED RTV TO WORN AREA.,c_9,baffle seal
1153641,2016-05-10 06:18:00,2016-05-10 13:18:00,N697ND,2396.5,7110.0,R/H ENG #2 BAFFLING MISSING COWL SEAL.,2016-05-10,FABRICATED & INSTALLED NEW BAFFLE SEAL.,c_9,baffle seal
1153694,2016-05-11 13:06:00,2016-05-11 14:48:00,N536ND,12191.599999999999,7230.0,#1 FWD BAFFLE SEAL LOOSE.,2016-05-11,RESECURED SEAL.,c_9,baffle seal
1153898,2016-05-18 12:47:00,2016-05-18 14:22:00,N678ND,1620.0,7230.0,FWD BAFFLE SEAL LOOSE @ #1 CYL.,2016-05-18,RESECURED BAFFLE MATERIAL.,c_9,baffle seal
1154225,2016-05-31 13:35:00,2016-05-31 11:20:00,N549ND,15099.3,7230.0,#1 CYLINDER BAFFLE SEAL NEEDS TO BE SECURED.,2016-05-31,RESECURED SEAL W/ POP RIVETS.,c_9,baffle seal
1154301,2016-06-03 05:57:00,2016-06-03 15:03:00,N511ND,15518.0,7230.0,BAFFLE SEAL IS LOOSE ON FWD BOTTOM R/H SIDE.,2016-06-03,SECURED BAFFLE SEAL.,c_9,baffle seal
1154686,2016-06-14 21:24:00,2016-06-15 13:08:00,N560ND,11361.0,7230.0,FWD R/H BAFFLE NEEDS TO BE SEALED.,2016-06-15,SEALED BAFFLE.,c_9,baffle seal
1154723,2016-06-16 05:10:00,2016-06-24 00:00:00,N604ND,5805.8,7130.0,L/H SIDE COWL BAFFLE SEAL TORN,2016-06-17,REPAIRED BAFFLE SEAL,c_9,baffle seal
1154781,2016-06-17 13:17:00,2016-06-17 13:24:00,N642ND,1980.6000000000001,7230.0,ENGINE BAFFLE SEAL LOOSE BY #1 CYLINDER.,2016-06-17,RESECURED BAFFLE SEAL.,c_9,baffle seal
1155110,2016-06-29 05:58:00,2016-07-05 11:10:00,N560ND,11522.1,7230.0,FWD BAFFLE SEAL MISSING FROM MUFFLER INTAKE ON BAFFLE.,2016-07-05,INSTALLED NEW BAFFLE SEAL.,c_9,baffle seal
1155197,2016-06-30 17:44:00,2016-06-30 00:00:00,N569ND,13793.0,5400.0,FLEXABLE BAFFLE SEAL TORN,2016-06-30,REPLACED BAFFLE SEAL WITH NEW MATERIAL,c_9,baffle seal
1155331,2016-07-08 06:19:00,2016-07-08 14:04:00,N550ND,14087.8,7230.0,BAFFLE SEAL BY #1 CYL LOOSE.,2016-07-08,RIVETED BAFFLE SEAL TO BAFFLE.,c_9,baffle seal
1155333,2016-07-08 06:26:00,2016-07-09 14:12:00,N567ND,16688.0,7110.0,BLACK FWD LWR ENG COWL SEAL HAS WORN SPOTS.,2016-07-08,APPLIED BLACK SILICONE TO BAFFLE SEALS.,c_9,baffle seal
1156008,2016-08-03 13:53:00,2016-08-04 10:20:00,N572ND,11331.9,7230.0,BAFFLE SEAL ABOVE #3 CYL LOOSE.,2016-08-03,RESECURED BAFFLE SEAL.,c_9,baffle seal
1156225,2016-08-15 05:50:00,2016-08-16 14:55:00,N507ND,11717.1,7100.0,FWD #2 BAFFLE SEAL IS TORN.,2016-08-15,APPLIED SILICONE TO BAFFLE SEAL.,c_9,baffle seal
1156302,2016-08-17 06:06:00,2016-08-17 09:43:00,N579ND,13492.699999999999,7230.0,BAFFLE SEAL ON #1 CYL NEEDS TO BE SECURED.,2016-08-17,SECURED BAFFLE SEAL W/ NEW RIVETS.,c_9,baffle seal
1156469,2016-08-23 13:41:00,2016-08-23 13:21:00,N556ND,14572.6,7230.0,BLACK FWD LWR ENG SEAL WORN AT AIR INTAKE FILTER.,2016-08-23,APPLIED RTV TO FWD LOWER BAFFLE SEAL.,c_9,baffle seal
1157261,2016-09-16 13:50:00,2016-09-16 14:20:00,N642ND,2717.3999999999996,7230.0,"BAFFLE SEAL LOOSE, FWD OF #1 CYL.",2016-09-16,REATTACHED BAFFLE.,c_9,baffle seal
1157296,2016-09-19 05:49:00,2016-09-19 14:01:00,N653ND,5600.1,7110.0,BLACK FWD SEAL 1 SECTION NEEDS TO BE SECURED ON BAFFLE.,2016-09-19,SECURED TOGETHER W/ WIRE.,c_9,baffle seal
1157307,2016-09-19 06:27:00,2016-09-20 00:00:00,N532ND,12107.4,7110.0,BAFFLE SEAL RIGHT SIDE PULLED THRU RIVETS,2016-09-19,REMOVED DEFECTIVE SEAL FABRICATED A NEW UPPER RIGHT COWL SEAL OF LIKE MATERIAL INSTALLED NEW SEAL,c_9,baffle seal
1157467,2016-09-23 09:39:00,2016-09-23 10:12:00,N524ND,16865.7,7230.0,BAFFLE SEAL NEEDS TO BE SECURED ON #1 CYL.,2016-09-23,SECURED BAFFLE SEAL.,c_9,baffle seal
1157537,2016-09-27 06:01:00,2016-09-27 11:10:00,N508ND,11991.3,7230.0,BAFFLE SEAL ON #1 CYLINDER NEEDS TO BE SECURED.,2016-09-27,SECURED BAFFLE SEAL.,c_9,baffle seal
1157881,2016-10-07 06:00:00,2016-10-07 12:54:00,N520ND,17475.5,561.0,#2 SIDE BAFFLE SEAL LOOSE.,2016-10-07,SECURED BAFFLE SEAL W/ POP RIVETS.,c_9,baffle seal
1158227,2016-10-18 13:41:00,2016-10-19 10:40:00,N512ND,10702.6,7110.0,#2 CYL BAFFLE SEAL IS LOOSE.,2016-10-18,RESECURED BAFFLE SEAL.,c_9,baffle seal
1158260,2016-10-19 13:30:00,2016-10-20 15:40:00,N524ND,17049.6,7100.0,#1 CYL BAFFLE SEAL HAS LOOSE RIVETS.,2016-10-19,REMOVED & REPLACED RIVETS.,c_9,baffle seal
1158341,2016-10-22 06:52:00,2016-10-26 12:35:00,N576ND,15860.400000000001,7230.0,BAFFLE SEAL ABOVE CYLINDERS 1 & 4 LOOSE.,2016-10-22,RESECURED BAFFLE SEALS.,c_9,baffle seal
1158691,2016-11-04 06:58:00,2016-11-08 00:00:00,N635ND,7764.4,7230.0,R/H FRONT BAFFLE SEAT TORN FROM BAFFLE,2016-11-08,R/H BAFFLE SEAL REAPAIRED,c_9,baffle seal
1158870,2016-11-11 06:07:00,2016-11-11 12:46:00,N523ND,10206.8,7230.0,R/H FWD BAFFLE SEAL IS LOOSE.,2016-11-11,RESECURED SEAL.,c_9,baffle seal
1159704,2016-12-14 09:30:00,2016-12-17 00:00:00,N608ND,8793.6,7230.0,RED RTV NEEDS TO BE APPLIED TO TOP CENTER ENGINE BAFFLE OF AFT SIDE TO SEAL BETWEEN ENGINE AND BAFFLE,2016-12-17,RED RTV APPLIED TO AREA TO SEAL VOID,c_9,baffle seal
1159734,2016-12-15 05:49:00,2016-12-16 09:18:00,N579ND,14366.300000000001,7230.0,LH/ TOP ENGINE BAFFLE SEAL LOOSE.,2016-12-15,RESCURED BAFFLE SEAL.,c_9,baffle seal
1160864,2017-02-03 06:33:00,2017-02-04 14:03:00,N523ND,10531.1,7100.0,"BAFFLE SEAL LOOSE, L/H SIDE.",2017-02-03,RESECURED BAFFLE SEAL.,c_9,baffle seal
1160964,2017-02-07 09:03:00,2017-02-09 00:00:00,N577ND,10748.5,8000.0,STARTER WIRING BEGINNING TO CHAFE ON BAFFLE SEAL,2017-02-07,CLEARANCED BAFFLE SEAL AND REPOSITIONING WIRE. NO FURTHER DEFECT NOTED,c_9,baffle seal
1161147,2017-02-13 05:52:00,2017-02-14 11:02:00,N522ND,16343.6,7230.0,"LOOSE RIVETS, R/H FWD BAFFLE SEAL.",2017-02-13,REMOVED RIVETS & REPLACED W/ NUTS & SCREWS.,c_9,baffle seal
1161329,2017-02-17 06:23:00,2017-02-17 13:31:00,N678ND,7892.299999999999,7900.0,ENG OIL COOLER HAS NO SEAL AT BOTTOM @ BAFFLE.,2017-02-17,INSTALLED RTV TO SEAL AREA.,c_9,baffle seal
1161330,2017-02-17 06:28:00,2017-02-17 13:50:00,N567ND,13247.5,7230.0,#1 FRONT BAFFLE SEAL IS LOOSE.,2017-02-17,SECURED BAFFLE SEAL W/ POP RIVETS.,c_9,baffle seal
1161851,2017-03-08 06:29:00,2017-03-10 13:16:00,N652ND,7006.799999999999,7110.0,BLACK SEAL (FWD) COWL/BAFFLE WORN.,2017-03-08,APPLIED RTV (BLACK) TO WORN AREAS.,c_9,baffle seal
1162070,2017-03-15 05:58:00,2017-03-15 13:42:00,N522ND,16723.1,7230.0,L/H FWD BAFFLE SEAL LOOSE.,2017-03-15,REATTACHED BAFFLE SEAL.,c_9,baffle seal
1162144,2017-03-20 06:34:00,2017-03-20 10:35:00,N508ND,13077.599999999999,7230.0,#1 CYL FWD BAFFLE SEAL HAS COME LOOSE.,2017-03-20,RESECURED SEAL.,c_9,baffle seal
1163123,2017-04-19 15:07:00,2017-04-20 15:51:00,N653ND,5409.400000000001,7230.0,WORN SPOTS ON FWD LWR BAFFLE SEAL ABOVE INTAKE.,2017-04-20,FILLED IN SPOTS W/ RTV.,c_9,baffle seal
1163503,2017-05-02 15:37:00,2017-05-03 10:33:00,N641ND,4306.799999999999,7230.0,"BAFFLE SEAL, ABOVE ENG INTAKE HAS WORN SPOTS.",2017-05-03,INSTALLED BLACK RTV TO WORN AREAS.,c_9,baffle seal
1163873,2017-05-15 05:58:00,2017-05-15 14:23:00,N526ND,13287.900000000001,7130.0,L/H FWD ENGINE BAFFLE SEAL LOOSE.,2017-05-15,RESECURED SEAL.,c_9,baffle seal
1164227,2017-05-30 06:20:00,2017-05-30 09:34:00,N539ND,17195.9,7920.0,"SEAL FOR OIL COOLER, AT BAFFLE LWR SIDE, MISSING.",2017-05-30,INSTALLED RTV TO FILL SPACE @ BAFFLE.,c_9,baffle seal
