workorder,date_time_opened,date_time_closed,registration,total_time,ata_code,problem,date,action,cluster,cluster_name
1147333,2015-09-15 13:22:00,2015-09-15 11:10:00,N527ND,10866.7,2430.0,BATTERY MOUNT BRACKET IS CRACKED.,2015-09-15,REMOVED & REPLACED BRACKET W/ NEW.,c_40,battery issue low voltage weak battery charging issue
1147390,2015-09-16 16:14:00,2015-10-19 10:11:00,N605ND,6660.900000000001,5310.0,BATTERY SUPPORT BRACKET CRACKED,2015-09-17,REPLACED BRACKET,c_40,battery issue low voltage weak battery charging issue
1147416,2015-09-17 09:51:00,2015-10-19 09:04:00,N510ND,9803.3,2400.0,"ON PREFLIGHT, BATT MASTER FOUND TO BE ON. M BUS VOLTAGE WAS SHOW @0 WITH PFD ON FROM STBY BATT",2015-09-17,CHARGED MAIN BATTERY OPERATION CHECKED GOOD. STANDBY BATTERY FULLY CHARGED. NO DEFECTS NOTED,c_40,battery issue low voltage weak battery charging issue
1147418,2015-09-17 12:35:00,2015-09-17 15:06:00,N654ND,2513.7,2400.0,"AFTER START UP NOTICED ""LOW VOLTS"" ANNUNCIATOR ILLUMINATED.",2015-09-17,"REMOVED CHARGER FROM BATTERY, CK'ED GOOD.",c_40,battery issue low voltage weak battery charging issue
1147418,2015-09-17 12:35:00,2015-09-17 15:06:00,N654ND,2513.7,2400.0,"AFTER START UP NOTICED ""LOW VOLTS"" ANNUNCIATOR ILLUMINATED.",2015-09-17,"RAN A/C, NOTICED BATTERY CHARGE WAS LOW. ALTERNATOR WORKS FINE, OPS CK GOOD. PLACED A/C ON BATTERY CHARGER.",c_40,battery issue low voltage weak battery charging issue
1147437,2015-09-17 16:16:00,2015-10-19 09:07:00,N509ND,9666.300000000001,2410.0,MASTER ALT/BATT SWITCH BROKEN,2015-09-17,RESECURED SWITCH INTO BEZEL NO DEFECTS NOTED,c_40,battery issue low voltage weak battery charging issue
1147443,2015-09-17 22:47:00,2015-09-17 14:53:00,N547ND,13590.8,2400.0,"WHEN TURN MASTER BATT SWITCH ON, THERE IS AN ELECTRIC NOISE BEHIND INST PANEL.",2015-09-17,"INSPECTED, NO DEFECTS NOTED.",c_40,battery issue low voltage weak battery charging issue
1147451,2015-09-18 09:23:00,2015-09-18 15:05:00,N557ND,10274.8,2430.0,"WHEN PERFORMING STBY BATTERY TEST, LIGHT CAME ON FOR A COUPLE SECONDS, THEN WENT OUT.",2015-09-18,BEGAN CHARGING BATTERY.,c_40,battery issue low voltage weak battery charging issue
1147451,2015-09-18 09:23:00,2015-09-18 15:05:00,N557ND,10274.8,2430.0,"WHEN PERFORMING STBY BATTERY TEST, LIGHT CAME ON FOR A COUPLE SECONDS, THEN WENT OUT.",2015-09-18,"REMOVED CHARGER, OPS CK GOOD ON BATTERY TEST.",c_40,battery issue low voltage weak battery charging issue
1147467,2015-09-18 16:52:00,2015-09-18 10:08:00,N571ND,8167.8,2400.0,"UPON TESTING, STBY BATT TEST FAILED.",2015-09-18,REMOVED & REPLACED STBY BATT W/ S/N 14K471. OPS CK'ED GOOD.,c_40,battery issue low voltage weak battery charging issue
1147472,2015-09-18 22:26:00,2015-09-18 10:19:00,N511ND,13861.1,2400.0,STBY BATTERY FAILED TEST.,2015-09-18,"CHARGED BATTERY, OPS CK'ED GOOD.",c_40,battery issue low voltage weak battery charging issue
1147500,2015-09-20 11:44:00,2015-09-20 10:40:00,N576ND,12704.1,2400.0,"AMMETER SHOWED DRAW OF -1.0 AMPS ON MAIN BATTERY, ON APPROACH TO LANDING THROUGOUT  TAXI, UNTIL SHUT DOWN.",2015-09-20,"RAN A/C, OPS CK GOOD. NO DEFECTS NOTED. ALL NUMBERS ARE W/IN PARAMETERS.",c_40,battery issue low voltage weak battery charging issue
1147564,2015-09-22 06:17:00,2015-09-22 09:45:00,N550ND,11959.0,2430.0,ALTERNATOR GROUND HAS SEVERAL BROKEN STRANDS.,2015-09-22,REMOVED ALTERNATOR & INSTALLED NEW TERMINAL. REINSTALLED ALTERNATOR. OPS CK GOOD.,c_40,battery issue low voltage weak battery charging issue
1147627,2015-09-23 13:26:00,2015-09-23 13:41:00,N508ND,12604.400000000001,520.0,SEALED BATT CAP CK DUE.,2015-09-23,REMOVED & REPLACED SEALED BATT W/ S/N 40712254. CAP CK DUE 9/30/016 OR 5432.5 TACH.,c_40,battery issue low voltage weak battery charging issue
1147628,2015-09-23 13:39:00,2015-09-25 12:50:00,N556ND,14554.5,7100.0,ENGINE CHANGE DUE.,2015-09-23,DISCONNECTED ALL ELECTRICAL & LIQUID LINES. DISCONNECTED ENGINE CONTROLS. REMOVED ENGINE FROM A/C. INSTALLED OVERHAULED ENGINE S/N RL-7640-51E ONTO A/C. STARTED ROUTING ELECTRICAL WIRES. TORQUED MOUNTS.,c_40,battery issue low voltage weak battery charging issue
1147628,2015-09-23 13:39:00,2015-09-25 12:50:00,N556ND,14554.5,561.0,ALT OUTPUT WIRE LOOSE.,2015-09-24,SECURED OUTPUT WIRE.,c_40,battery issue low voltage weak battery charging issue
1147628,2015-09-23 13:39:00,2015-09-25 12:50:00,N556ND,14554.5,561.0,BATTERY BLAST TUBE RUBBING #4 EXHAUST STACK.,2015-09-24,RESECURED BLAST TUBE.,c_40,battery issue low voltage weak battery charging issue
1147645,2015-09-23 19:33:00,2015-09-23 11:22:00,N517ND,14051.5,2400.0,"BATTERY M AMPS WERE DISCHARGING DURING FLIGHT, AT TIMES AS LOW AS 94.0.",2015-09-23,COULD NOT DUPLICATE. SEE W/O #1147648 FOR MX FLIGHT.,c_40,battery issue low voltage weak battery charging issue
1147662,2015-09-24 10:33:00,2015-09-26 13:26:00,N532ND,14706.3,2400.0,"MAIN @ AND ESSENTIAL VOLTAGE BOTH DROPPED BELOW 24 V MAIN BATT WES DISCHARGING AT 9.5 AMPS WITH LIGHTS OFF. RESET ALTERNATOR SWITCH, ALTERNATOR CAME BACK ON LINE",2015-09-24,RAN AIRCRAFT NO DEFECTS NOTED,c_40,battery issue low voltage weak battery charging issue
1147717,2015-09-26 16:25:00,2015-10-21 09:50:00,N602ND,6841.5,5340.0,BATTERY TRAY SUPPORT BRACKET CRACKED,2015-09-28,REPLACED BRACKET,c_40,battery issue low voltage weak battery charging issue
1147717,2015-09-26 16:25:00,2015-10-21 09:50:00,N602ND,6841.5,2420.0,ALTERNATOR GROUND WIRE TERMINAL BROKEN,2015-09-29,INSTALLED NEW TERMINAL END,c_40,battery issue low voltage weak battery charging issue
1147761,2015-09-28 13:40:00,2015-09-28 10:55:00,N545ND,14977.9,520.0,BATTERY CAP CK DUE.,2015-09-28,INSTALLED REPAIRED BATTERY S/N 40614786. NEXT CAP CK DUE 9/30/16 OR 6820.2 TACH.,c_40,battery issue low voltage weak battery charging issue
1147865,2015-10-01 09:23:00,2015-10-24 10:03:00,N634ND,6264.0,2400.0,MAIN BATT NOTED AT -1.7 AMPS ON FINAL AT AROUND 1400 RPM AND REMAINING AT -1 AMP FOR THE WHOLE TAXI BACK,2015-10-01,INSPECTED CHARGING SYSTEM WIRING. FOUND NO BROKEN CONNECTION. RAN AIRCRAFT FOUND CHARGING SYSTEM TO BE PERFORMING NORMALLY,c_40,battery issue low voltage weak battery charging issue
1147875,2015-10-01 14:42:00,2015-10-01 00:00:00,N641ND,178.5,1120.0,ELT PLACARD OBSCURED,2015-10-01,UNOBSCURED ELT PLACARD,c_40,battery issue low voltage weak battery charging issue
1147884,2015-10-01 16:55:00,2015-10-09 13:48:00,N561ND,10999.199999999999,2400.0,STBY BATT WAS LEFT ON & BATTERY IS NOW DEAD.,2015-10-09,"CHARGED BATTERY, TESTS GOOD.",c_40,battery issue low voltage weak battery charging issue
1147891,2015-10-02 06:26:00,2015-10-02 11:18:00,N549ND,10972.400000000001,7100.0,ADEL CLAMP FROM ENGINE MOUNT TO BATTERY BOX BROKEN.,2015-10-02,REMOVED & REPLACED ADEL CLAMP.,c_40,battery issue low voltage weak battery charging issue
1147912,2015-10-02 21:29:00,2015-10-02 11:14:00,N511ND,14005.4,2400.0,STBY BATTERY TEST FAILED.,2015-10-02,STARTED CHARGING BATTERY.,c_40,battery issue low voltage weak battery charging issue
1147912,2015-10-02 21:29:00,2015-10-02 11:14:00,N511ND,14005.4,2400.0,STBY BATTERY TEST FAILED.,2015-10-02,"COMPLETED CHARGING BATTERY, TESTED GOOD.",c_40,battery issue low voltage weak battery charging issue
1147927,2015-10-03 12:31:00,2015-10-05 11:30:00,N549ND,10975.400000000001,2430.0,"STBY BATTERY TEST SHOWS GREEN, BUT PFD STAYS OFF WHEN ARMED.",2015-10-03,"CK'ED BATTERY & FUSE. CK'ED WIRING, RESECURED LOOSE CONNECTOR. CHARGED STBY BATTERY, OPERATION TESTS GOOD.",c_40,battery issue low voltage weak battery charging issue
1148013,2015-10-06 12:22:00,2015-10-06 11:24:00,N512ND,8776.0,7200.0,ADEL CLAMP ON BATTERY MOUNT IS TOO LARGE.,2015-10-06,INSTALLED SMALLER ADEL CLAMP.,c_40,battery issue low voltage weak battery charging issue
1148015,2015-10-06 12:56:00,2015-10-06 11:23:00,N511ND,14040.2,2400.0,STBY BATTERY FAILED TEST.,2015-10-06,REMOVED & REPLACED STBY BATTERY W/ S/N 14L314. OPS CK GOOD.,c_40,battery issue low voltage weak battery charging issue
1148047,2015-10-07 13:27:00,2015-10-08 15:05:00,N677ND,203.10000000000002,520.0,ELT ME406 2 YEAR REG DUE.,2015-10-07,"VERIFIED REGISRTATION, INSTALLED PLACARD ON ELT (ADCDEA3DBA403C9). EXPIRES 8/27/17.",c_40,battery issue low voltage weak battery charging issue
1148073,2015-10-08 10:33:00,2015-10-08 13:14:00,N652ND,3167.7000000000003,2430.0,BATTERY DEAD.,2015-10-08,REPLACED BATTERY W/ NEW CONCORDE BATTERY S/N 40721313 IAW STC SA01118WI - SEE FAA FORM 377 DATED 10/8/15. UPDATED W&B AND EQUIPMENT LIST. OPS CK GOOD.,c_40,battery issue low voltage weak battery charging issue
1148077,2015-10-08 14:40:00,2015-10-08 13:22:00,N523ND,9756.3,520.0,BATTERY CAP CK DUE.,2015-10-08,REMOVED & REPLACED BATTERY W/ REPAIRED S/N 40666608. CAP CK DUE 10/31/16 OR 5249.3 TACH. OPS CK GOOD.,c_40,battery issue low voltage weak battery charging issue
1148099,2015-10-09 11:11:00,2015-10-27 14:25:00,N532ND,14773.5,520.0,BATTERY CAP CHECK DUE,2015-10-09,REMOVED BATTERY,c_40,battery issue low voltage weak battery charging issue
1148099,2015-10-09 11:11:00,2015-10-27 14:25:00,N532ND,14773.5,520.0,BATTERY CAP CHECK DUE,2015-10-09,TESTED BATTERY: 9.3/13.6 AH,c_40,battery issue low voltage weak battery charging issue
1148099,2015-10-09 11:11:00,2015-10-27 14:25:00,N532ND,14773.5,520.0,BATTERY CAP CHECK DUE,2015-10-12,REINSTALLED BATTERY,c_40,battery issue low voltage weak battery charging issue
1148099,2015-10-09 11:11:00,2015-10-27 14:25:00,N532ND,14773.5,5320.0,BATTERY TRAY BRACKET CRACKED,2015-10-12,REPLACED BATTERY TRAY BRACKET,c_40,battery issue low voltage weak battery charging issue
1148117,2015-10-09 19:33:00,2015-10-09 13:54:00,N511ND,14055.2,2400.0,"ON PREFLIGHT, STBY BATT FAILED TEST.",2015-10-09,REPAIRED BROKEN WIRE IN CONNECTOR & CHARGED BATTERY. CHECKS GOOD.,c_40,battery issue low voltage weak battery charging issue
1148198,2015-10-13 10:37:00,2015-10-13 13:45:00,N536ND,13424.2,2400.0,STBY BATT FAILED 1ST TEST.,2015-10-13,CONNECTED BATTERY TO CHARGER.,c_40,battery issue low voltage weak battery charging issue
1148198,2015-10-13 10:37:00,2015-10-13 13:45:00,N536ND,13424.2,2400.0,STBY BATT FAILED 1ST TEST.,2015-10-13,DISCONNECTED CHARGER. STBY BATTERY PASSED SELF TEST.,c_40,battery issue low voltage weak battery charging issue
1148267,2015-10-15 14:02:00,2015-10-15 12:41:00,N516ND,12253.2,2570.0,BATTERY SHROUD COOLING HOSE CHAFING ON BAFFLING.,2015-10-15,APPLIED HIGH TEMP RTV.,c_40,battery issue low voltage weak battery charging issue
1148272,2015-10-15 13:24:00,2015-10-30 08:14:00,N577ND,7921.599999999999,2400.0,BATTERY WAS FOUND DEAD ON START,2015-10-15,RAN AIRCRAFT UNTIL BATTERY WAS CHARGED. NO DEFECTS NOTED,c_40,battery issue low voltage weak battery charging issue
1148274,2015-10-15 13:32:00,2015-10-30 08:13:00,N635ND,6108.0,2400.0,UPON PREFLIGHT THE BATTERY MASTER WAS FOUND ON. THE PFD SHOWED THE MAIN BATTERY @ .2 AMPS,2015-10-15,CHARGED BATTERY. NO DEFECTS NOTED.,c_40,battery issue low voltage weak battery charging issue
1148288,2015-10-16 06:10:00,2015-10-22 10:14:00,N550ND,12149.8,2560.0,STICKER INDICATES ELT BATTERY IS EXPIRED.,2015-10-19,VERIFED CORRECT BATTERY EXPIRATION DATE OF 3/31/18; REMOVED OLD STICKER.,c_40,battery issue low voltage weak battery charging issue
1148375,2015-10-19 13:52:00,2015-10-19 14:44:00,N575ND,13828.7,520.0,BATTERY CAP CK DUE.,2015-10-19,REMOVED & REPLACED BATTERY W/ S/N 40633346.,c_40,battery issue low voltage weak battery charging issue
1148390,2015-10-20 06:01:00,2015-10-20 14:20:00,N519ND,11961.4,520.0,SEALED BATTERY CAP CK DUE.,2015-10-20,REMOVED & REPLACED BATTERY W/ S/N 40611274. NEXT CAP CK DUE 10/31/16 OR 6846.3 TACH.,c_40,battery issue low voltage weak battery charging issue
1148403,2015-10-20 10:20:00,2015-11-05 16:22:00,N634ND,6321.0,2430.0,MAIN BATTERY DISCHARGED,2015-10-20,RECHARGED BATTERY OPS CHECK GOOD,c_40,battery issue low voltage weak battery charging issue
1148442,2015-10-21 10:43:00,2015-11-03 12:29:00,N603ND,7042.799999999999,2400.0,STANDBY BATTERY FAILED TEST P/N S4236-7,2015-10-23,REPLACED STANDBY BATTERY INSTALLED S/N 14H563,c_40,battery issue low voltage weak battery charging issue
1148442,2015-10-21 10:43:00,2015-11-03 12:29:00,N603ND,7042.799999999999,2400.0,MAIN BATTERY FAILED CAPACITY TEST,2015-10-23,REPLACED WITH NEW GILL BATTERY INSTALLED AND CHARGED S/N G02815152 P/N G241,c_40,battery issue low voltage weak battery charging issue
1148459,2015-10-22 06:03:00,2015-10-30 10:07:00,N536ND,13512.099999999999,2400.0,"MAIN BATT AMPS RED X ON RUN UP. THEN AROUND -40, THEN -50 DURING TAXI.",2015-10-23,PERFORMED BATTERY AMMETER CALIBRATION PROCEDURE.,c_40,battery issue low voltage weak battery charging issue
1148459,2015-10-22 06:03:00,2015-10-30 10:07:00,N536ND,13512.099999999999,2400.0,"MAIN BATT AMPS RED X ON RUN UP. THEN AROUND -40, THEN -50 DURING TAXI.",2015-10-24,CHARGED BATTERY.,c_40,battery issue low voltage weak battery charging issue
1148459,2015-10-22 06:03:00,2015-10-30 10:07:00,N536ND,13512.099999999999,2400.0,"MAIN BATT AMPS RED X ON RUN UP. THEN AROUND -40, THEN -50 DURING TAXI.",2015-10-30,"RAN A/C, OPERATION TESTS GOOD.",c_40,battery issue low voltage weak battery charging issue
1148492,2015-10-23 06:47:00,2015-10-23 14:18:00,N537ND,12318.5,520.0,ELT ME406 2 YEAR REGISTRATION DUE.,2015-10-23,INSTALLED ID TAG ON ELT BEACON ID ADCC40B7F000261. UPDATED AIMS. EXPIRES 10/12/17.,c_40,battery issue low voltage weak battery charging issue
1148604,2015-10-27 09:47:00,2015-10-29 14:32:00,N697ND,935.5,3350.0,"""CAS R/H ALTR FAIL"" LIGHT CAME ON DURING RUN UP, ALT WAS STILL WORKING.",2015-10-28,"INSP AUX WIRE & FUSE, CLEANED FUSE HOLDER.",c_40,battery issue low voltage weak battery charging issue
1148604,2015-10-27 09:47:00,2015-10-29 14:32:00,N697ND,935.5,3350.0,"""CAS R/H ALTR FAIL"" LIGHT CAME ON DURING RUN UP, ALT WAS STILL WORKING.",2015-10-29,OPS CK GOOD.,c_40,battery issue low voltage weak battery charging issue
1148613,2015-10-27 11:36:00,2015-10-27 12:38:00,N517ND,14308.0,2420.0,"MAIN BATT AMPS SHOWED VARIABLE DISCHARGE, THEN CLEARED. MAIN VOLTS NEVER CHANGED.",2015-10-27,"RAN UP ENG, NORMAL TEMPS & ADDED DIFFERENT ELEC LOAD. COULD NO DUPLICATE. CK'ED ALTERNATOR & BELT TENSION - OK.",c_40,battery issue low voltage weak battery charging issue
1148682,2015-10-30 06:10:00,2015-11-02 13:42:00,N568ND,13205.599999999999,2400.0,BATTERY IS CRACKED.,2015-10-30,REMOVED BATTERY.,c_40,battery issue low voltage weak battery charging issue
1148682,2015-10-30 06:10:00,2015-11-02 13:42:00,N568ND,13205.599999999999,2570.0,BATTERY BOX HAS CORROSION.,2015-11-02,NEUTRALIZED ACID CORROSION CHEMICALLY & PAINTED BATTERY BOX.,c_40,battery issue low voltage weak battery charging issue
1148682,2015-10-30 06:10:00,2015-11-02 13:42:00,N568ND,13205.599999999999,2400.0,BATTERY IS CRACKED.,2015-11-02,INSTALLED SERVICEABLE BATTERY S/N 40686137. NEXT CAP CK DUE 11/30/16 OR 6539.2 TACH.,c_40,battery issue low voltage weak battery charging issue
1148705,2015-10-30 13:11:00,2015-10-30 13:23:00,N569ND,16700.8,2400.0,BATTERY MASTER WAS LEFT ON ALL NIGHT,2015-10-30,CHARGED MAIN BATTERY,c_40,battery issue low voltage weak battery charging issue
1148720,2015-10-31 10:35:00,2015-11-06 10:56:00,N577ND,7945.0,2400.0,DURING ENGINE START THE PROP WOULD NOT SPIN. LOOK LIKE THE BATTERY IS DEAD,2015-10-31,JUMP STARTED AIRCRAFT AND RAN TILL BATTERY WAS CHARGED. NO DEFECTS NOTED,c_40,battery issue low voltage weak battery charging issue
1148770,2015-11-02 13:24:00,2015-11-02 14:50:00,N525ND,11996.1,2430.0,BATTERY TRAY LOOSE (BATTERY MOUNT BOLTS LOOSE).,2015-11-02,READJUSTED BATTERY TRAY.,c_40,battery issue low voltage weak battery charging issue
1148803,2015-11-03 07:09:00,2015-11-05 12:51:00,N536ND,13529.2,2430.0,"MAIN BATTERY AMPS HAD RED X ON RUN UP, THEN WENT TO -70 BACK TO RAMP.",2015-11-04,"REASSEMBLED & TESTED WIRING CONTINUITY. RAN A/C, CURRENT INDICATIONS CK GOOD.",c_40,battery issue low voltage weak battery charging issue
1148844,2015-11-04 10:22:00,2015-11-06 12:03:00,N509ND,9886.800000000001,2430.0,"ON THE BEFORE START CHECKLIST, THE STANDBY BATTERY TEST FAILED",2015-11-04,"REMOVED, CHARGED, REINSTALLED STANDBY BATTERY. PERFORMED CAPACITY CHECK. PASSED CAPACITY CHECK. INSPECTED BATTERY AND TESTER WIRING NO DEFECTS NOTED. ONBOARD BATTERY TEST FUNCTIONS PROPERLY. RECHARGED STANDBY BATTERY.",c_40,battery issue low voltage weak battery charging issue
1148887,2015-11-06 10:12:00,2015-11-06 14:14:00,N548ND,13108.599999999999,2400.0,BATTERY MASTER IS STICK ON (DISCOVERED DURING PREFLIGHT).,2015-11-06,"INSPECTED, CLEANED SWITCH, OPS CK'ED GOOD. INSPECTED WIRING, NO DEFECTS NOTED.",c_40,battery issue low voltage weak battery charging issue
1148898,2015-11-06 12:52:00,2015-11-06 12:59:00,N561ND,11258.699999999999,8010.0,"MAIN BATTERY DEAD, STARTER WILL NOT ENGAGE.",2015-11-06,MAIN/AUX BATTERIES HAVE 24.2 VOLTS. INSTALLED NEW STARTER S/N FNE-2011124. OPS CK GOOD.,c_40,battery issue low voltage weak battery charging issue
1149000,2015-11-10 05:51:00,2015-11-10 10:58:00,N557ND,10747.6,520.0,SEALED BATTERY CAP CK DUE.,2015-11-10,REPLACED W/ S/N 40686139.,c_40,battery issue low voltage weak battery charging issue
1149019,2015-11-10 15:32:00,2015-11-10 16:48:00,N634ND,6411.599999999999,3100.0,"MAIN BATT SHOWED -1.5 DISCHARGE DURING FLT. CYCLED BATT/ALT SWITCH, NO CHANGE",2015-11-10,REMOVED & CLEANED GEA71 CONTACTS. RESEATED & CHECKED OPERATION. OPS CHECKED GOOD,c_40,battery issue low voltage weak battery charging issue
1149040,2015-11-11 12:57:00,2015-11-11 14:17:00,N529ND,7948.200000000001,2420.0,ALTERNATOR POWER TERMINAL BROKEN.,2015-11-11,OPS CK GOOD.,c_40,battery issue low voltage weak battery charging issue
1149040,2015-11-11 12:57:00,2015-11-11 14:17:00,N529ND,7948.200000000001,2420.0,ALTERNATOR POWER TERMINAL BROKEN.,2015-11-11,REMPOVED & REPLACED RING TERMINAL W/ NEW.,c_40,battery issue low voltage weak battery charging issue
1149079,2015-11-13 12:47:00,2015-11-13 11:41:00,N680ND,783.0,2400.0,"EMER BATT <23.0 VOLTS, LIGHT & SCREENS FLICKER.",2015-11-13,STARTED CHARGING BATTERY.,c_40,battery issue low voltage weak battery charging issue
1149079,2015-11-13 12:47:00,2015-11-13 11:41:00,N680ND,783.0,2400.0,"EMER BATT <23.0 VOLTS, LIGHT & SCREENS FLICKER.",2015-11-13,"COMPLETED CHARGING STANDBY BATTERY, OPS CK'ED GOOD.",c_40,battery issue low voltage weak battery charging issue
1149133,2015-11-16 07:03:00,2015-11-16 14:51:00,N547ND,14077.1,2310.0,LEFT HEADSET JACK INOPERATIVE.,2015-11-16,CK'ED ELECTRICAL CONNECTIONS ON LEFT HEADSET JACKS. NO PROBLEMS FOUND. CK'ED JACK CONDITION & TENSION. CHECKS GOOD. RESET AUDIO PANEL VOLUME LEVELS & SQUELCH SETTINGS. OPERATION OF AUDIO PANEL & INTERCOM CHECKS GOOD.,c_40,battery issue low voltage weak battery charging issue
1149212,2015-11-18 08:55:00,2015-11-18 09:27:00,N602ND,7195.5,2500.0,ELT ACCESS PANEL UNGLUED,2015-11-18,REGLUED PANEL VELCRO,c_40,battery issue low voltage weak battery charging issue
1149224,2015-11-18 13:51:00,2015-11-18 08:56:00,N569ND,16778.5,2400.0,STANDBY BATTERY TEST FAILED DURING BEFORE START CHECK,2015-11-18,UNABLE TO DUPLICATE. STANDBY BATTERY PASSED ON-BOARD TEST,c_40,battery issue low voltage weak battery charging issue
1149367,2015-11-24 06:00:00,2015-11-24 13:30:00,N507ND,13612.099999999999,520.0,BATTERY CAP CK DUE.,2015-11-24,REPLACED W/ S/N 40714629. NEXT CAP CK DUE @ 5726.9 TACH.,c_40,battery issue low voltage weak battery charging issue
1149449,2015-11-30 05:56:00,2015-11-30 12:49:00,N577ND,8200.3,2400.0,"ELECTRICAL BUS ""M"" WAS AT 17.1 W/ MASTER POWER ON. TRIED TO START ENGINE & BLADE TURNED ONLY 2 TIMES.",2015-11-30,"CHARGED BATTERY. PERFORMED ENGINE START, NO DEFECTS NOTED.",c_40,battery issue low voltage weak battery charging issue
1149492,2015-12-01 06:30:00,2015-12-03 11:25:00,N551ND,13805.7,2570.0,BATTERY BOX ENGINE MOUNT SUPPORT BRACKET CRACKED.,2015-12-01,"REMOVED BRACKET, RIVETED ON NEW BRACKET & REINSTALLED.",c_40,battery issue low voltage weak battery charging issue
1149493,2015-12-01 06:35:00,2015-12-02 14:19:00,N558ND,9317.199999999999,561.0,BATTERY NEG BOLT LOOSE.,2015-12-01,TIGHTENED BOLT.,c_40,battery issue low voltage weak battery charging issue
1149498,2015-12-01 08:58:00,2015-12-01 15:23:00,N577ND,8200.3,2400.0,BATTERY DEAD ON START.,2015-12-01,"REMOVED BATTERY, INSTALLED NEW BATTERY S/N G02882332.",c_40,battery issue low voltage weak battery charging issue
1149504,2015-12-01 13:45:00,2015-12-01 14:06:00,N525ND,12180.3,2560.0,ELT REMOVED FOR REPAIR.,2015-12-01,REINSTALLED BATTERY IN ELT & TESTED. INSTALLED ELT S/N 11768 IN A/C. REINSTALLED BEACON W/ NOAA & UPDATED REGISTRATION. EXPIRES 12/1/17.,c_40,battery issue low voltage weak battery charging issue
1149578,2015-12-03 14:52:00,2015-12-04 00:00:00,N548ND,13281.4,2500.0,ELT PLACARD INOP AND PAST 90 DAYS,2015-12-04,REMOVED PLACARD,c_40,battery issue low voltage weak battery charging issue
1149641,2015-12-06 15:21:00,2015-12-08 15:05:00,N680ND,904.0,3310.0,EMERGENCY BATTERY UPPER BULB BURNT OUT.,2015-12-07,"REPLACED BULB, OPS CK OK.",c_40,battery issue low voltage weak battery charging issue
1149671,2015-12-07 13:27:00,2015-12-07 15:14:00,N548ND,13310.2,2500.0,"DURING PREFLIGHT, PFD REMAINED ON DESPITE SHUTTING OFF MASTER & STBY SWITCHES.",2015-12-07,PLACED A/C ON CHARGER.,c_40,battery issue low voltage weak battery charging issue
1149671,2015-12-07 13:27:00,2015-12-07 15:14:00,N548ND,13310.2,2500.0,"DURING PREFLIGHT, PFD REMAINED ON DESPITE SHUTTING OFF MASTER & STBY SWITCHES.",2015-12-07,"REMVED CHARGER FROM A/C. TESTED SBY BATT, OPS CK GOOD.",c_40,battery issue low voltage weak battery charging issue
1149697,2015-12-08 06:25:00,2015-12-08 12:41:00,N677ND,744.9000000000001,2400.0,A/C BATTERY LOW ON WATER.,2015-12-08,SERVICED BATTERY W/ DISTILLED WATER.,c_40,battery issue low voltage weak battery charging issue
1149705,2015-12-08 10:44:00,2015-12-08 10:58:00,N549ND,11530.099999999999,2420.0,BATTERY BOX SUPPORT BRACKET CRACKED.,2015-12-08,REMOVED & REPLACED BRACKET.,c_40,battery issue low voltage weak battery charging issue
1149735,2015-12-09 06:08:00,2015-12-09 14:28:00,N654ND,3082.7999999999997,2400.0,BATTERY REQUIRES SERVICING.,2015-12-09,SERVICED BATTERY W/ DISTILLED WATER.,c_40,battery issue low voltage weak battery charging issue
1149751,2015-12-09 13:16:00,2015-12-09 14:48:00,N561ND,11557.5,2400.0,ALTERNATOR GROUND TERMINAL BROKEN.,2015-12-09,OPS CK'ED GOOD.,c_40,battery issue low voltage weak battery charging issue
1149762,2015-12-10 06:07:00,2015-12-10 12:59:00,N545ND,15551.8,2570.0,ADEL CLAMP FOR MAIN BATTERY BOX BROKEN.,2015-12-10,REMOVED & REPLACED CLAMP.,c_40,battery issue low voltage weak battery charging issue
1149783,2015-12-11 10:07:00,2015-12-15 00:00:00,N510ND,10393.7,520.0,SEALED BATTERY CAP TEST DUE,2015-12-14,COMPLIED WITH SEALED BATTERY CAP TEST PASSED WITH 4.1 AMP HOUR CHARGED BATTERY,c_40,battery issue low voltage weak battery charging issue
1149788,2015-12-12 06:38:00,2015-12-12 14:09:00,N678ND,741.3,2400.0,A/C BATTERY LOW ON WATER.,2015-12-12,SERVICED W/ DISTILLED WATER.,c_40,battery issue low voltage weak battery charging issue
1149790,2015-12-12 09:44:00,2015-12-13 14:17:00,N537ND,12707.6,520.0,BATTERY CAP TEST DUE.,2015-12-12,REMOVED BATTERY & INSTALLED REPAIRED BATTERY S/N 40689564.,c_40,battery issue low voltage weak battery charging issue
1149868,2015-12-18 22:33:00,2015-12-18 11:17:00,N654ND,3093.6000000000004,2400.0,"BATTERY APPEARS TO BE DYING, BATTERY STRUGGLED ON START & LOW VOLTS CAME ON WHILE TAXIING BACK AFTER FLIGHT.",2015-12-18,INSPECTED & OPERATIONALLY CK'ED CHARGING SYSTEM. VERIFIED PROPER OPERATION AS ALLOWED W/ GILL G241 BATTERY INSTALLED & LOW VOLT LIGHT ONLY CAME ON AT RPMS BELOW 900. OPS CK'ED GOOD.,c_40,battery issue low voltage weak battery charging issue
1149912,2015-12-22 06:31:00,2015-12-23 14:25:00,N508ND,13298.3,2430.0,BATTERY CAP CRACKED.,2015-12-22,REMOVED & REPLACED BATTERY W/ S/N 40714475. NEXT TEST DUE 12/31/16 OR 5663.8 TACH.,c_40,battery issue low voltage weak battery charging issue
1149972,2015-12-29 05:55:00,2015-12-29 12:57:00,N530ND,15100.5,2570.0,BATTERY BOX FWD ADEL CLAMP BROKEN.,2015-12-29,INSTALLED NEW ADEL CLAMP.,c_40,battery issue low voltage weak battery charging issue
1149973,2015-12-29 06:03:00,2015-12-30 13:45:00,N642ND,691.5,2400.0,A/C BATTERY LOW ON WATER.,2015-12-30,SERVICED BATTERY W/ DISTILLED WATER.,c_40,battery issue low voltage weak battery charging issue
1150009,2015-12-31 11:25:00,2015-12-31 11:49:00,N548ND,13756.6,2430.0,PDF SCREEN DOES NOT TURN OFF.,2015-12-31,TROUBLESHOT SYSTEM & FOUND BATTERY MASTER RELAY STICKING. REMOVED & REPLACED RELAY. OPS CK GOOD.,c_40,battery issue low voltage weak battery charging issue
1150017,2016-01-02 08:14:00,2016-01-02 11:41:00,N654ND,3118.7999999999997,2420.0,ALTERNATOR NOT PUTTING OUT 28V UNTIL RPM GOT UP TO 1800. CAUSING STBY BATT TO DISCHARGE.,2016-01-02,"RAN A/C, ALTERNATOR OPS GOOD. BATTERY CHARGE WAS LOW. CHARGED BATTERY.",c_40,battery issue low voltage weak battery charging issue
1150090,2016-01-07 12:48:00,2016-01-19 00:00:00,N603ND,7587.900000000001,510.0,ENGINE DUE FOR TIME CHANGE,2016-01-14,"INSTALLED NEW OIL AND FUEL LINES. PRELUBED, INSPECTED TORQUES, FUNCTION AND FIT OF ALL REPLACED EQUIPMENT. CHARGED BATTERY",c_40,battery issue low voltage weak battery charging issue
1150215,2016-01-12 19:40:00,2016-01-12 11:04:00,N545ND,15551.8,2400.0,"AFTER ENGINE START, M BATT BUS DID NOT GO TO POSITIVE.",2016-01-12,"TROUBLESHOT ALTERNATOR SYSTEM, FOUND NO POWER A FIELD, SOLENOID CONTROL CIRCUIT IN JUNCTION BOX & AT SWITCH. REPAIRED CONNECTOR PC 025 PIN 15. OPS CK'ED GOOD.",c_40,battery issue low voltage weak battery charging issue
1150270,2016-01-15 08:27:00,2016-01-15 10:54:00,N677ND,879.3000000000001,7110.0,BATTERY VENT HOLE REQUIRES CAT TRACK.,2016-01-15,APPLIED CAT TRACK.,c_40,battery issue low voltage weak battery charging issue
1150283,2016-01-15 15:27:00,2016-01-18 13:27:00,N517ND,14724.7,2400.0,NOTICED M BATT INDICATES -1.5 TO -5.0 AMPS.,2016-01-16,PERFORMED AMMETER CALIBRATION PROCEDURE ON MAIN BATTERY. CHARGED STBY BATTERY. OPS CK GOOD.,c_40,battery issue low voltage weak battery charging issue
