workorder,date_time_opened,date_time_closed,registration,total_time,ata_code,problem,date,action,cluster,cluster_name
1147884,2015-10-01 16:55:00,2015-10-09 13:48:00,N561ND,10999.199999999999,2750.0,L/H & R/H FLAP CHAFE TAPE NEEDS TO BE APPLIED.,2015-10-02,INSTALLED CHAFE TAPE.,c_49,flap
1147884,2015-10-01 16:55:00,2015-10-09 13:48:00,N561ND,10999.199999999999,2750.0,L/H FLAP HAS PLAY.,2015-10-02,"AFTER FURTHER INSP, FOUND L/H PLAY TO BE NORMAL. NO DEFECTS NOTED.",c_49,flap
1147891,2015-10-02 06:26:00,2015-10-02 11:18:00,N549ND,10972.400000000001,5500.0,L/H O/B TOP FLAP NEEDS CHAFE TAPE.,2015-10-02,INSTALLED CHAFE TAPE.,c_49,flap
1147933,2015-10-03 16:36:00,2015-10-03 10:24:00,N557ND,10427.199999999999,550.0,"FLAP OVERSPEED, FLAPS 20*, 93 KIAS.",2015-10-03,"INSPECTED IAW CESSNA MM OVERSPEED INSP, NO DEFECTS NOTED.",c_49,flap
1147938,2015-10-04 10:56:00,2015-10-29 00:00:00,N558ND,14797.400000000001,5750.0,FOD IN L/H FLAP,2015-10-29,REMOVED FOD,c_49,flap
1147938,2015-10-04 10:56:00,2015-10-29 00:00:00,N558ND,14797.400000000001,5750.0,ZIP TIE ON R/H FLAP ROLLER ARM,2015-10-29,REMOVED ZIP TIE,c_49,flap
1147938,2015-10-04 10:56:00,2015-10-29 00:00:00,N558ND,14797.400000000001,5750.0,FLAP POSITION 25 DEGREE MARK IS ALTERED,2015-10-29,UNALTERED MARK,c_49,flap
1147970,2015-10-05 11:33:00,2015-10-05 13:13:00,N551ND,13503.3,550.0,FLAP OVERSPEED.,2015-10-05,"INSPECTED IAW CESSNA 172 MAINTENANCE MANUAL FLAP OVERSPEED INSP, NO DEFECTS NOTED. OPS GOOD. 5-50-00, PARA 2, B.",c_49,flap
1147973,2015-10-05 13:30:00,2015-10-06 13:31:00,N687ND,2438.5,2360.0,BROKEN STATIC WICK ON L/H FLAP.,2015-10-05,REMOVED & REPLACED STATIC WICK.,c_49,flap
1148018,2015-10-06 14:43:00,2015-10-06 10:49:00,N560ND,9408.0,550.0,"AFTER TAKE OFF (FLAPS SET TO 10*), A/C WOULD SHAKE & COULD FEEL VIBRATION FOR ABOUT 5 SECS, THEN SHAKING & VIBRATION WOULD STOP. ONLY OCCURRED ON TAKE OFFS.",2015-10-06,"INSPECTED, FOUND EXCESSIVE PLAY IN NLG TORQUE LINK. TIGHTENED BOLTS & SAFETIED. MAINTENANCE FLIGHT REQUIRED - SEE W/O #1148021.",c_49,flap
1148019,2015-10-06 13:01:00,2015-10-27 10:22:00,N606ND,6339.0,5710.0,WING SKIN CRACK ABOVE FLAP ON LH & RH WING,2015-10-09,STOP DRILLED CRACKS,c_49,flap
1148020,2015-10-06 15:54:00,2015-10-06 10:50:00,N642ND,341.1,550.0,FLAP OVERSPEED AT 87 KTS FOR A COUPLE OF SECONDS.,2015-10-06,"PERFORMED FLAP OVERSPEED INSP, NO DEFECTS NOTED.",c_49,flap
1148031,2015-10-06 22:41:00,2015-10-06 10:02:00,N529ND,7583.4,550.0,ABOUT 4 SECONDS AT 115 KNOTS W/ 10* OF FLAPS.,2015-10-06,"INSPECTED FLAPS, FLAP MOTOR, GUIDES & PUSH RODS; NO DEFECTS FOUND. CYCLED FLAPS, OPS CK GOOD.",c_49,flap
1148053,2015-10-07 14:35:00,2015-10-07 14:06:00,N512ND,8783.8,5500.0,RIGHT FLAP PART MARK/NUMBER PLATE IS MISSING.,2015-10-07,"INSPECTED, VERIFIED DATA TAG TO BE MISSING. NOT REQUIRED FOR FLIGHT.",c_49,flap
1148087,2015-10-09 06:31:00,2015-10-09 14:24:00,N537ND,12167.6,5510.0,"R/H FLAP I/B FLAP TRACK, O/B INSP HOLE HAS BROKEN NUTPLATE.",2015-10-09,REMOVED & REPLACED NUTPLATE.,c_49,flap
1148142,2015-10-12 06:25:00,2015-10-12 11:01:00,N507ND,13273.400000000001,5510.0,R/H FLAP NEEDS CHAFE TAPE ON I/B END.,2015-10-12,APPLIED CHAFE TAPE.,c_49,flap
1148142,2015-10-12 06:25:00,2015-10-12 11:01:00,N507ND,13273.400000000001,5510.0,L/H FLAP I/B AFT ROLLER SLIDING IN TRACK.,2015-10-12,REMOVED & REPLACED BEARING. OPS CK GOOD.,c_49,flap
1148142,2015-10-12 06:25:00,2015-10-12 11:01:00,N507ND,13273.400000000001,5510.0,L/H FLAP NEEDS NEW CHAFE BUTTONS & TAPE.,2015-10-12,"APPLIED CHAFE TAPE, INSTALLED NEW CHAFE BUTTONS.",c_49,flap
1148185,2015-10-13 06:15:00,2015-10-13 14:11:00,N568ND,13035.5,2750.0,CHAFE TAPE NEEDED ON R/H FLAP.,2015-10-13,INSTALLED CHAFE TAPE.,c_49,flap
1148231,2015-10-14 05:59:00,2015-10-14 11:35:00,N556ND,12296.2,5700.0,CHAFE TAPE NEEDED ON R/H FLAP COVE.,2015-10-14,APPLIED CHAFE TAPE ON AFFECTED AREA.,c_49,flap
1148241,2015-10-14 12:29:00,2015-10-14 11:19:00,N511ND,14086.7,5510.0,L/H FLAP CHAFING IN L/H CORNER.,2015-10-14,REPLACED CHAFE BUTTON & APPLIED CHAFE TAPE.,c_49,flap
1148241,2015-10-14 12:29:00,2015-10-14 11:19:00,N511ND,14086.7,2750.0,FLAP CABLE TENSION LOW.,2015-10-14,ADJUSTED CABLE TENSION TO W/IN LIMITS & SAFETIED. TRAVEL & OPS CK GOOD.,c_49,flap
1148245,2015-10-14 12:51:00,2015-10-14 14:29:00,N652ND,3229.7999999999997,2750.0,CHAFING ON L/H SIDE FLAP.,2015-10-14,INSTALLED CHAFE TAPE.,c_49,flap
1148288,2015-10-16 06:10:00,2015-10-22 10:14:00,N550ND,12149.8,5730.0,L/H FLAP SKIN IS CRACKED BY I/B FLAP TRACK.,2015-10-16,STOP DRILLED CRACK.,c_49,flap
1148384,2015-10-19 18:46:00,2015-10-19 14:40:00,N536ND,13494.099999999999,550.0,FLAP OVERSPEED.,2015-10-19,"INSPECTED FLAPS, FLAP MOTOR, CABLES, BELL CRANKS & PUSH RODS. NO DEFECTS FOUND. CYCLED FLAPS SEVERAL TIMES, OPS CK GOOD.",c_49,flap
1148385,2015-10-19 21:35:00,2015-10-19 14:41:00,N521ND,7254.299999999999,2750.0,FLAPS INOPERATIVE.,2015-10-19,CLEANED MICROSWITCHES IN WING TIP FOR FLAPS. OPS CK GOOD.,c_49,flap
1148390,2015-10-20 06:01:00,2015-10-20 14:20:00,N519ND,11961.4,5500.0,R/H TOP I/B FLAP HAS WEAR MARK FROM SCREW HEAD.,2015-10-20,"INSPECTED, FOUND TO BE COSMETIC. CLEANED, PRIMED & PAINTED WEAR MARK. PROPER CLEARANCE IS ALLOWED W/ NEW SCREW.",c_49,flap
1148431,2015-10-21 06:08:00,2015-10-21 13:32:00,N655ND,3064.2,5510.0,BOTH FLAPS NEED NEW CHAFE TAPE.,2015-10-21,INSTALLED NEW CHAFE TAPE.,c_49,flap
1148444,2015-10-21 13:23:00,2015-10-21 12:52:00,N527ND,11213.5,5510.0,R/H FLAP ANTI-ABRASION TAPE LOOSE.,2015-10-21,INSTALLED NEW ANTI-ABRASION TAPE.,c_49,flap
1148460,2015-10-22 06:25:00,2015-10-22 13:49:00,N530ND,14707.2,550.0,A/C PULLS RIGHT IN CRUISE FLIGHT. TRIED BURNING FUEL FROM RIGHT TANK & FLEW IN ALL DIRECTIONS OF WIND - NO CHANGE.,2015-10-22,CK'ED AILERON TRAVELS - NO DEFECTS NOTED. CK FLAP TRAVELS - NO DEFECTS NOTED. INSPECTED FLAPS FOR DROOP ON EITHER SIDE - NO DEFECTS NOTED.,c_49,flap
1148485,2015-10-22 18:23:00,2015-10-22 14:58:00,N677ND,347.1,550.0,FLAP OVERSPEED.,2015-10-22,"PERFORMED FLAP OVERSPEED INSP IAW CESSNA MM, NO DEFECTS NOTED.",c_49,flap
1148490,2015-10-23 06:20:00,2015-10-26 14:49:00,N688ND,2731.0,5510.0,L/H FLAP (TOP) NEEDS CHAFE TAPE.,2015-10-23,INSTALLED CHAFE TAPE.,c_49,flap
1148510,2015-10-23 13:46:00,2015-10-23 14:13:00,N523ND,9917.7,5730.0,"BROKEN NUTPLATE, IN UPPER O/B FLAP INSP PANEL, ON R/H WING.",2015-10-23,REMOVED & REPLACED NUTPLATE.,c_49,flap
1148534,2015-10-26 05:59:00,2015-10-29 10:06:00,N680ND,635.0,2360.0,R/H FLAP STATIC WICK BROKEN.,2015-10-26,REMOVED & REPLACED STATIC WICK.,c_49,flap
1148604,2015-10-27 09:47:00,2015-10-29 14:32:00,N697ND,935.5,5510.0,L/H FLAP CHAFING ON NACELLE.,2015-10-28,APPLIED CHAFE TAPE.,c_49,flap
1148617,2015-10-27 13:09:00,2015-10-27 12:37:00,N564ND,9346.8,550.0,"FLAP OVERSPEED, 90 KTS AT FULL FLAPS.",2015-10-27,"INSPECTED IAW 05-50-00 2. B, NO DAMAGE FOUND. FLAPS OPS CK'ED OK.",c_49,flap
1148620,2015-10-27 14:36:00,2015-10-27 12:39:00,N527ND,11264.2,550.0,"FLAP OVERSPEED; FLAPS 20*, 93 KTS.",2015-10-27,"INSPECTED FLAPS, GUIDES, PUSH RODS, BELLCRANKS & MOTOR. NO DEFECTS FOUND. OPS CK GOOD.",c_49,flap
1148638,2015-10-28 06:01:00,2015-10-28 14:24:00,N561ND,11198.4,2750.0,L/H FLAP I/B ROLLER IS SLIDING.,2015-10-28,"CLEANED & LUBED ROLLER, OPS CK GOOD.",c_49,flap
1148682,2015-10-30 06:10:00,2015-11-02 13:42:00,N568ND,13205.599999999999,5510.0,R/H FLAP CHAFING ON RIVET HEAD.,2015-10-30,APPLIED CHAFE TAPE.,c_49,flap
1148696,2015-10-30 12:13:00,2015-10-30 11:13:00,N557ND,10656.400000000001,550.0,"WHILE TURNING BASE, 20* FLAPS WERE LOWERED WHILE AIRSPEED WAS 88 KTS.",2015-10-30,"PERFORMED FLAP OVERSPEED INSP, NO DEFECTS NOTED.",c_49,flap
1148697,2015-10-30 12:48:00,2015-10-30 11:19:00,N579ND,11133.699999999999,550.0,"WHILE ON BASE, FLAPS WERE EXTENDED TO 20* & SHORTLY AFTER, AIRSPEED EXCEEDED 85 KTS.",2015-10-30,"PERFORMED FLAP OVERSPEED INSP, NO DEFECTS NOTED.",c_49,flap
1148700,2015-10-30 13:48:00,2015-10-30 12:42:00,N654ND,2890.2,5750.0,CHAFE TAPE NEEDED ON R/H I/B FLAP.,2015-10-30,APPLIED CHAFE TAPE TO R/H I/B FLAP.,c_49,flap
1148728,2015-11-01 13:35:00,2015-11-01 15:07:00,N562ND,7792.5,550.0,EXTENDED FLAPS 20* @ 87 KNOTS.,2015-11-01,INSP REVEALED NO DEFECTS.,c_49,flap
1148732,2015-11-02 06:09:00,2015-11-03 14:03:00,N520ND,14960.0,2750.0,R/H FWD CABLE FOR FLAP WORN.,2015-11-02,DISCONNECTED & ROUTED THROUGH PULLEY READY FOR STRING. STRUNG CABLE THROUGH.,c_49,flap
1148732,2015-11-02 06:09:00,2015-11-03 14:03:00,N520ND,14960.0,2750.0,FLAP MOTOR LOOSE AT MOUNT BOLT.,2015-11-03,TIGHTENED BOLT.,c_49,flap
1148732,2015-11-02 06:09:00,2015-11-03 14:03:00,N520ND,14960.0,2750.0,R/H FWD CABLE FOR FLAP WORN.,2015-11-03,"INSTALLED PIN FOR END & INSTALLED PULLEYS. ADJUSTED TENSION, SAFETIED CABLE BARRELS. TENSION & TRAVEL CK GOOD.",c_49,flap
1148781,2015-11-02 16:23:00,2015-11-02 14:45:00,N564ND,9384.9,5510.0,FLAP OVERSPEED.,2015-11-02,"PERFORMED FLAP OVERSPEED INSP, NO DEFECTS FOUND. OPS CK GOOD.",c_49,flap
1148784,2015-11-02 17:04:00,2015-11-18 12:18:00,N540ND,12421.5,2750.0,FLAP CABLE TENSION LOW,2015-11-03,ADJUSTED FLAP CABLE TENSION,c_49,flap
1148784,2015-11-02 17:04:00,2015-11-18 12:18:00,N540ND,12421.5,5750.0,FLAPS CHAFING AGAINST WINGS,2015-11-03,APPLIED ANTI CHAFE TAPE TO WINGS,c_49,flap
1148792,2015-11-02 20:16:00,2015-11-02 14:46:00,N653ND,3301.2000000000003,550.0,FLAPS TO 20* @ 95 KIAS.,2015-11-02,"INSPECTED IAW CESSNA MM FLAP OVERSPEED INSP, NO DEFECTS NOTED.",c_49,flap
1148799,2015-11-03 05:59:00,2015-11-03 10:43:00,N563ND,9769.9,5510.0,R/H FLAP CHAFING ON RIVET HEAD.,2015-11-03,APPLIED CHAFE TAPE.,c_49,flap
1148812,2015-11-03 12:14:00,2015-11-03 14:30:00,N524ND,10434.0,550.0,"AIRSPEED AT 89 KTS, PUT FLAPS DOWN 20*.",2015-11-03,INSPECTED FLAPS & CONTROL MECHANISM. NO DAMAGE FOUND.,c_49,flap
1148881,2015-11-06 06:27:00,2015-11-06 12:40:00,N550ND,12286.599999999999,5510.0,R/H I/B FLAP INSP PANEL NEEDS CHAFE TAPE.,2015-11-06,APPLIED CHAFE TAPE TO AFFECTED AREAS.,c_49,flap
1148994,2015-11-09 16:47:00,2015-11-09 14:44:00,N655ND,3251.7000000000003,5500.0,FLAP EXTENSION & RETRACTION CAUSES RADIO INTERFERENCE.,2015-11-09,REPLACED FLAP MOTOR. OPS CK GOOD.,c_49,flap
1148997,2015-11-09 21:46:00,2015-11-09 14:31:00,N537ND,12494.3,2750.0,"NOTICED AS STUDENT LOWERED FLAPS, INDICATOR & FLAPS DID NOT ACTUATE. MOVED FLAP LEVER UP, THEN BACK TO 10*, THERE WAS NOTICEABLE SPARK IN FLAP LEVER WELL, THEN FLAPS EXTENDED.",2015-11-09,INSPECTED FLAP SYSTEM & FOUIND NO DEFECTS. CLEANED MICROSWITCHES LOCATED IN WING FOR FLAP CONTROL. OPS CK GOOD. FOUND NO SIGNS OF ARCING WIRES.,c_49,flap
1149057,2015-11-12 14:58:00,2015-11-12 00:00:00,N565ND,15686.7,5700.0,FOD NEAR LH FLAP ROLLER,2015-11-12,REMOVED FOD,c_49,flap
1149057,2015-11-12 14:58:00,2015-11-12 00:00:00,N565ND,15686.7,7100.0,FLASHLIGHT ON TOP OF MOTOR,2015-11-12,REMOVED FLASHLIGHT,c_49,flap
1149087,2015-11-13 16:23:00,2015-11-13 11:26:00,N655ND,3264.2999999999997,5750.0,"WHILE COMPLETING BEFORE START CHECKLIST, FLAPS STAYED IN FULL POSITION.",2015-11-13,"LUBRICATED AL FLAP ROLLERS, UNABLE TO DUPLICATE DISCREPANCY. FLAPS OPS CK GOOD.",c_49,flap
1149092,2015-11-13 17:56:00,2015-11-13 11:37:00,N539ND,13343.3,5750.0,DURING PATTERN WORK FLAPS BECAME INOPERATIVE.,2015-11-13,"INSPECTED & FOUND FLAP MOTOR COUPLER TO BE SHEARED. REMOVED & REPLACED COUPLER W/ NEW, OPS CK GOOD.",c_49,flap
1149124,2015-11-15 14:30:00,2015-11-15 14:12:00,N516ND,12509.1,2750.0,"DURING FLAP RETRACTION & EXTENSION IN FLIGHT, THERE WAS A LARGE AMOUNT OF RADIO INTERFERENCE.",2015-11-15,"REMOVED & REPLACED FLAP MOTOR, NO NOISE NOTICED WHEN CYCLING W/ RADIO. OPS CK GOOD.",c_49,flap
1149166,2015-11-16 13:19:00,2015-11-16 11:21:00,N677ND,559.2,5510.0,CHAFE TAPE REQUIRED R/H FLAP I/B.,2015-11-16,APPLIED ANTI-CHAFE TAPE TO I/B SIDE OF R/H FLAP.,c_49,flap
1149185,2015-11-17 13:08:00,2015-11-17 13:00:00,N523ND,10110.6,7110.0,L/H FLAP REQUIRES CHAFE TAPE.,2015-11-17,INSTALLED CHAFE TAPE.,c_49,flap
1149228,2015-11-18 17:50:00,2015-11-24 14:13:00,N539ND,13392.2,5510.0,L/H FLAP I/B BEARING STICKS (LWR ONE).,2015-11-19,ORDERED PART.,c_49,flap
1149228,2015-11-18 17:50:00,2015-11-24 14:13:00,N539ND,13392.2,5510.0,L/H FLAP I/B BEARING STICKS (LWR ONE).,2015-11-24,REMOVED & REPLACED BEARING. OPS CK GOOD.,c_49,flap
1149229,2015-11-18 17:57:00,2015-11-19 14:19:00,N688ND,2963.5,2360.0,R/H FLAP CENTER BONDING STRAP LOOSE.,2015-11-19,RESECURED STRAP.,c_49,flap
1149263,2015-11-20 13:00:00,2015-11-20 10:22:00,N550ND,12399.7,550.0,OVERSPEED FLAPS.,2015-11-20,"PERFORMED FLAP OVERSPEED INSP, NO DEFECTS NOTED.",c_49,flap
1149276,2015-11-20 15:20:00,2015-11-20 10:23:00,N655ND,3306.2999999999997,5750.0,2 SCREWS IN FLAP PANELS BROKEN.,2015-11-20,REMOVED BROKEN SCREWS & INSTALLED NEW SCREWS.,c_49,flap
1149299,2015-11-21 18:00:00,2015-11-21 10:40:00,N562ND,7933.799999999999,2750.0,"WHEN FLAPS WERE AT FULL, THEY DID NOT MOVE WHEN SELECTED UP.",2015-11-21,ADJUSTED FWD END OF FLAPS INDICATOR CABLE. OPS CK GOOD. TRAVEL CK GOOD.,c_49,flap
1149307,2015-11-22 11:27:00,2015-11-22 10:50:00,N677ND,580.5,2750.0,FLAP 10* @ 115 KTAS.,2015-11-22,"INSPECTED FLAPS, NO DEFECTS NOTED.",c_49,flap
1149313,2015-11-23 06:27:00,2015-11-25 09:28:00,N653ND,3411.2999999999997,5750.0,FLAP CABLE TENSION LOW.,2015-11-23,ADJUSTED FLAP CABLE TENSION IAW CESSNA MM. OPS & TRAVEL CK GOOD.,c_49,flap
1149338,2015-11-23 13:16:00,2015-11-23 13:51:00,N566ND,18646.1,5730.0,SCREW MISSING IN R/H FLAP COVE.,2015-11-23,INSTALLED SCREW.,c_49,flap
1149343,2015-11-23 13:30:00,2015-11-23 13:40:00,N524ND,10585.2,5750.0,CHAFE TAPE NEEDED ON L/H FLAP.,2015-11-23,APPLIED CHAFE TAPE.,c_49,flap
1149382,2015-11-24 13:28:00,2015-11-24 11:27:00,N687ND,3032.0,7110.0,L/H COWL FLAP LEVER WILL NOT LOCK.,2015-11-24,"REPLACED L/H LEVER, OPS CK GOOD.",c_49,flap
1149391,2015-11-24 15:08:00,2015-11-24 11:13:00,N579ND,11276.199999999999,550.0,FLAPS EXTENDED TO 20* BEYOND 85 KNOTS (APPROX 87-88 KTS).,2015-11-24,"INSPECTED FLAPS & A/C IAW CESSNA 172S MM 05-50-00 FLAP OVERSPEED INSP, NO DEFECTS NOTED.",c_49,flap
1149399,2015-11-24 17:44:00,2015-11-24 15:52:00,N546ND,14165.7,550.0,"WHILE ON BASE, FLAP SPEED EXCEEDED FOR 2 SECONDS; FLAP HAD BEEN EXTENDED TO 20* OVER VFE.",2015-11-24,"INSPECTED IAW CESSNA MM FLAP OVERSPEED INSP, NO DEFECTS NOTED.",c_49,flap
1149434,2015-11-28 11:11:00,2015-11-28 13:37:00,N556ND,12655.0,2750.0,FLAP MOTOR CAUSES SIGNIFICANT STATIC WHEN EXTENDING & RETRACTING.,2015-11-28,"REMOVED & REPLACED FLAP MOTOR, OPS CK GOOD.",c_49,flap
1149479,2015-11-30 13:05:00,2015-11-30 11:22:00,N556ND,12655.0,5730.0,BROKEN NUTPLATE ON #2 I/B FLAP PANEL.,2015-11-30,"REMOVED INSP RING, REPLACED NUTPLATE & REINSTALLED INSP RING.",c_49,flap
1149481,2015-11-30 13:38:00,2015-11-30 13:21:00,N547ND,14171.3,2750.0,CHAFE TAPE NEEDED ON R/H FLAP.,2015-11-30,INSTALLED CHAFE TAPE.,c_49,flap
1149489,2015-11-30 20:35:00,2015-11-30 13:54:00,N655ND,3381.2999999999997,550.0,"FLAP OVERSPEED DURING FLIGHT, FLAPS WERE SET TO 10* & AIRSPEED EXCEEDED 110 KTS.",2015-11-30,"INSPECTED IAW CESSNA MM FLAP OVERSPEED INSP, NO DEFECTS NOTED.",c_49,flap
1149492,2015-12-01 06:30:00,2015-12-03 11:25:00,N551ND,13805.7,5510.0,R/H FLAP HAS 2 CHAFE BUTTONS WORN.,2015-12-01,REPLACED BUTTONS.,c_49,flap
1149505,2015-12-01 13:45:00,2015-12-01 13:09:00,N576ND,13290.6,5750.0,CAT TRACK ON FLAP CABLE HOLE IN FUSELAGE NEEDS TO BE REMOVED.,2015-12-01,REMOVED CAT TRACK.,c_49,flap
1149555,2015-12-03 09:49:00,2015-12-03 14:36:00,N513ND,15507.1,5750.0,"AFTER TAKE OFF, FLAPS WOULD NOT RETRACT. UPON LANDING, FLAPS RETRACTED AFTER SEVERAL ATTEMPTS.",2015-12-03,LUBRICATED FLAP ROLLERS. FLAP OPS CK GOOD. UNABLE TO DUPLICATE DISCREPANCY.,c_49,flap
1149578,2015-12-03 14:52:00,2015-12-04 00:00:00,N548ND,13281.4,2700.0,L/H FLAP PUSH-ROD JAM NUT LOOSE,2015-12-03,TIGHTENED L/H FLAP AFT JAM NUT,c_49,flap
1149610,2015-12-04 14:50:00,2015-12-04 14:54:00,N564ND,9622.2,5510.0,R/H FLAP I/B FLAP TRACK BRACKET IS CRACKED.,2015-12-04,REMOVED & REPLACED BRACKET.,c_49,flap
1149616,2015-12-04 17:59:00,2015-12-04 13:25:00,N556ND,12691.0,550.0,FLAPS EXTENDED 20* @ 90 KIAS.,2015-12-04,"INSPECTED FLAPS & CONTROL MECHANISMS IN WINGS, NO DAMAGE NOTED.",c_49,flap
1149626,2015-12-05 11:06:00,2015-12-05 14:37:00,N513ND,15534.1,550.0,FLAP OVERSPEED @ 98 KIAS; FLAPS DID NOT MOVE BEYOND 15* FOR LESS THAN 2 SECONDS.,2015-12-05,PERFORMED FLAP OVERSPEED INSP; NO DEFECTS NOTED.,c_49,flap
1149629,2015-12-05 11:27:00,2015-12-05 14:35:00,N568ND,13450.4,550.0,AIRSPEED BRIEFLY WENT UP TO 86-87 KNOTS W/ FLAPS AT 20* ON BASE TURN.,2015-12-05,"PERFORMED FLAP OVERSPEED INSP, NO DEFECTS NOTED.",c_49,flap
1149637,2015-12-05 17:47:00,2015-12-05 14:04:00,N537ND,12642.5,2750.0,"DURING FLIGHT, FLAPS WERE SET IN DOWN POSITION BUT, FLAPS DIDN'T MOVE. FLAPS FINALLY EXTENDED AFTER CYCLING FLAP SWITCH SEVERAL TIMES.",2015-12-05,"CLEANED SWITCHES, OPS CK'ED GOOD.",c_49,flap
1149661,2015-12-07 10:24:00,2015-12-07 13:10:00,N574ND,14488.7,5500.0,CHAFE TAPE WORN THRU ON I/B END OF R/H FLAP.,2015-12-07,REPLACED SECTION OF CHAFE TAPE.,c_49,flap
1149661,2015-12-07 10:24:00,2015-12-07 13:10:00,N574ND,14488.7,5730.0,"SCREW MISSING IN AFT END OF R/H WING ROOT FAIRING, IN FLAP COVE.",2015-12-07,INSTALLED SCREW.,c_49,flap
1149679,2015-12-07 16:11:00,2015-12-07 15:18:00,N688ND,3194.5,2750.0,EXCEEDED FLAP OPERATING SPEED BY 2 KNOTS.,2015-12-07,INSPECTED IAW PIPER PA44-180 FLAP OVERSPEED INSP 5-50 UNSCHEDULED MAINTENANCE CHECKS. NO DEFECTS NOTED.,c_49,flap
1149750,2015-12-09 13:00:00,2015-12-09 12:26:00,N567ND,15115.7,2760.0,BROKEN NUTPLATE ON R/H FLAP UPPER I/B PANEL.,2015-12-09,REPLACED NUTPLATE.,c_49,flap
1149751,2015-12-09 13:16:00,2015-12-09 14:48:00,N561ND,11557.5,2400.0,AMP NUMBER ON FLAP BREAKER MISSING.,2015-12-09,RELABELED FLAP BREAKER.,c_49,flap
1149758,2015-12-09 19:39:00,2015-12-09 13:58:00,N562ND,8095.799999999999,2750.0,"FLAPS WOULD NOT RETRACT AFTER LANDING. RESET MOTOR/CYCLE FLAPS TO NO AVAIL. HALFWAY ACROSS C RAMP, FLAPS FINALLY CAME UP AFTER A FEW BUMPS.",2015-12-09,"CLEANED FLAP POSITION SWITCHES, OPS CK GOOD.",c_49,flap
1149760,2015-12-09 22:13:00,2015-12-09 14:00:00,N516ND,12649.2,2750.0,"W/ FLAP LEVER AT ZERO POSITION, FLAPS ARE STILL SLIGHTLY DEPLOYED.",2015-12-09,INSPECTED A/C & COULD NOT DUPLICATE DISREPANCY. R/H FLAP MAY HAVE APPEARED LOW IN COMPARISON TO R/H AILERON WHEN O/B TIP OF AILERON IS ALIGNED W/ WING TIP. THIS IS COMMON W/ MUCH OF FLEET WHERE AILERON CAN NOT LINE UP W/ FLAP & WING TIP.,c_49,flap
1149760,2015-12-09 22:13:00,2015-12-09 14:00:00,N516ND,12649.2,2750.0,"W/ FLAP LEVER AT ZERO POSITION, FLAPS ARE STILL SLIGHTLY DEPLOYED.",2015-12-09,"CYCLED FLAPS SEVERAL TIMES, OPS CK GOOD.",c_49,flap
1149762,2015-12-10 06:07:00,2015-12-10 12:59:00,N545ND,15551.8,5700.0,CHAFE TAPE NEEDED ON R/H WING FLAP WELL.,2015-12-10,"CLEANED AREA - OK, NEGLIGIBLE DAMAGE, PUT CHAFE TAPE ON.",c_49,flap
1149768,2015-12-10 10:23:00,2015-12-10 13:08:00,N537ND,12707.6,3310.0,RIGHT SIDE OF LOWER INSTRUMENT PANEL LIGHTS FLICKERED & WENT OFF IN FLIGHT.,2015-12-10,INSPECTED WIRING & TROUBLESHOT TO LED LIGHT THROTTLE/FLAP PANEL. REPLACED PANEL. OPS CK GOOD.,c_49,flap
1149776,2015-12-11 06:07:00,2016-01-21 15:04:00,N557ND,10969.3,5750.0,R/H FLAP REQUIRES NEW CHAFE TAPE.,2015-12-11,APPLIED NEW CHAFE TAPE.,c_49,flap
1149783,2015-12-11 10:07:00,2015-12-15 00:00:00,N510ND,10393.7,5710.0,LH INEER FLAP COVE BRACKET BROKEN,2015-12-15,REMOVED AND REPLACE W/ NEW BRACKET,c_49,flap
1149794,2015-12-13 12:11:00,2015-12-29 12:30:00,N689ND,3313.0,561.0,R/H COWL FLAP WILL NOT LOCK.,2015-12-15,ADJUSTED COWL FLAP DOOR & REPLACED LOCK TAB ON COWL FLAP LEVER.,c_49,flap
1149856,2015-12-18 11:27:00,2015-12-18 15:13:00,N527ND,11558.2,2750.0,"PRACTICING MANUEVERS; DEPLOYED FLAPS FULL. TRIED TO SET FLAPS TO ZERO, BUT WOULD NOT RETRACT.",2015-12-18,CLEANED MICROSWITCHES IN WING FOR FLAP CONTROL. OPS CK GOOD. CYCLED FLAPS MANY TIMES.,c_49,flap
1149973,2015-12-29 06:03:00,2015-12-30 13:45:00,N642ND,691.5,5700.0,R/H FLAP COVE CRACKED AT RIVET LINE.,2015-12-30,STOP DRILLED CRACK.,c_49,flap
1149986,2015-12-30 06:17:00,2015-12-30 13:51:00,N562ND,8143.200000000001,5510.0,L/H FLAP NEEDS NEW PIECE OF CHAFE TAPE.,2015-12-30,APPLIED CHAFE TAPE TO L/H FLAP.,c_49,flap
1150022,2016-01-02 11:34:00,2016-01-02 11:43:00,N550ND,12619.0,550.0,EXCEEDED FLAP LIMITATION BY APPROX 10 KTS.,2016-01-02,"PERFORMED FLAP OVERSPEED INSP IAW C172 FLAP OVERSPEED INSP, NO DEFECTS NOTED.",c_49,flap
1150124,2016-01-09 13:33:00,2016-01-09 10:53:00,N527ND,11627.5,550.0,FLAP OVERSPEED.,2016-01-09,INSPECTED IAW CESSNA OVERSPEED CHECKLIST 5-50-00. NO DEFECTS NOTED.,c_49,flap
1150140,2016-01-11 05:46:00,2016-01-12 13:45:00,N655ND,3574.5,5510.0,R/H FLAP CHAFING.,2016-01-11,APPLIED CHAFE TAPE.,c_49,flap
1150181,2016-01-12 06:24:00,2016-01-12 12:46:00,N525ND,12340.8,2750.0,AFT FLAP ROLLER BOLTS ARE LOOSE ON R/H FLAP.,2016-01-12,TIGHTENED BOLTS.,c_49,flap
1150197,2016-01-12 13:02:00,2016-01-12 14:43:00,N549ND,11540.3,2750.0,"ON DEPARTURE, AFTER 3 STOP & GO'S OVER FLAPS WOULD NOT RETRACT. REMAINED IN FULL DOWN POSITION REGARDLESS OF FLAPS LEVER SETTING.",2016-01-12,CLEANED MICROSWITCHES FOR FLAP CONTROL LOCATED IN R/H WING. OPS CK GOOD.,c_49,flap
1150236,2016-01-13 13:26:00,2016-01-13 13:29:00,N520ND,15272.0,5510.0,L/H FLAP CHAFE TAPE NEEDED.,2016-01-13,APPLIED CHAFE TAPE TO L/H FLAP.,c_49,flap
1150258,2016-01-14 10:19:00,2016-01-14 13:29:00,N507ND,13781.3,2750.0,LOOSENED 1 SCREW FOR L/H FLAP INSP PANEL (O/B).,2016-01-14,TIGHTENED SCREW.,c_49,flap
1150258,2016-01-14 10:19:00,2016-01-14 13:29:00,N507ND,13781.3,2750.0,"R/H FLAP INSP PANEL REMOVED, I/B ONE.",2016-01-14,INSTALLED PANEL W/ 3 SCREWS.,c_49,flap
1150324,2016-01-17 14:13:00,2016-01-17 13:51:00,N511ND,14626.1,550.0,"FLAP OVERSPEED FOR 5 SECONDS, 115 KTS, FLAPS 10*.",2016-01-17,"INSPECTED IAW CESSNA MODEL 172 MM 05-50-00 2.B, NO DEFECTS NOTED.",c_49,flap
1150337,2016-01-18 06:46:00,2016-01-18 15:05:00,N539ND,13520.9,550.0,FLAPS 20* OVERSPEED AT 90 KNOTS.,2016-01-18,"INSPECTED IAW CESSNA FLAP OVERSPEED INSP, NO DEFECTS NOTED.",c_49,flap
1150404,2016-01-19 09:49:00,2016-01-19 10:53:00,N697ND,1517.0,550.0,FLAPS PUT TO 10 AT 118 KTS.,2016-01-19,"INSPECTED IAW PIPER MM FLAP OVERSPEED INSP, NO DEFECTS NOTED.",c_49,flap
1150420,2016-01-19 14:43:00,2016-01-19 13:22:00,N522ND,13261.1,561.0,FLAP DRIVE COUPLING WORN.,2016-01-19,REMOVED & REPLACED FLAP DRIVE COUPLING.,c_49,flap
1150458,2016-01-21 19:48:00,2016-01-21 14:41:00,N526ND,15534.7,5510.0,"DURING FLIGHT, L/H FLAP SHOOK VIOLENTLY @ 20*.",2016-01-21,REMOVED & REPLACED L/H I/B AFT FLAP BEARING.,c_49,flap
1150507,2016-01-25 06:28:00,2016-01-25 13:08:00,N579ND,11447.199999999999,2750.0,FLAP SWITCH DETENT WORN AT 20* POSITION.,2016-01-25,"FILED DETENTS & CK'ED TRAVELS, TRAVEL CHECKS GOOD.",c_49,flap
1150544,2016-01-25 13:16:00,2016-01-25 14:22:00,N695ND,1396.0,2360.0,R/H FLAP STATIC WICK BROKEN.,2016-01-25,REMOVED & REPLACED STATIC WICK.,c_49,flap
1150571,2016-01-26 13:21:00,2016-01-26 13:48:00,N574ND,14566.4,2750.0,FLAPS INTERMITTENTLY INOP DURING FLIGHT.,2016-01-26,CLEANED SWITCHES & LUBED FLAP TRACKS. CYCLED FLAPS MULTIPLE TIMES. OPS CK GOOD.,c_49,flap
1150597,2016-01-26 22:14:00,2016-01-26 13:59:00,N652ND,3859.2000000000003,2750.0,"PILOT REPORTED PUT FLAP LEVER AT 10*, FLAP DID NOT COME DOWN.",2016-01-26,"ADJUSTED MICROSWITCH ON FLAP HANDLE, OPS CK GOOD.",c_49,flap
1150599,2016-01-27 06:20:00,2016-01-28 10:40:00,N519ND,12463.0,5500.0,L/H TOP FLAP NEEDS CHAFE TAPE ON RIVET HEAD.,2016-01-27,APPLIED CHAFE TAPE AS NEEDED.,c_49,flap
1150607,2016-01-27 10:46:00,2016-01-29 10:26:00,N604ND,4727.9,3400.0,INSTRUMENT AIR LINE CHAFING AGAINST FLAP FOLLOWUP CABLE BEHIND PFD,2016-01-28,INSTALLED ANTI CHAFE TAPE TO FOLLOWUP CABLE,c_49,flap
1150640,2016-01-28 13:44:00,2016-01-28 00:00:00,N548ND,13855.6,2750.0,WHITE TAPE OVER R/H FLAP ID PLATE,2016-01-28,REMOVED TAPE,c_49,flap
1150640,2016-01-28 13:44:00,2016-01-28 00:00:00,N548ND,13855.6,2750.0,WILKY PLUG MISSING ON O/B L/H FLAP,2016-01-28,REINSTALLED PLUG,c_49,flap
1150700,2016-01-30 16:51:00,2016-01-30 11:00:00,N560ND,10128.6,550.0,FLAP OVERSPEED @ 10* 87 KTS.,2016-01-30,C/W OVERSPEED INSPECTION IAW CESSNA MM. NO DEFECTS NOTED.,c_49,flap
1150717,2016-02-01 06:14:00,2016-02-01 14:16:00,N653ND,3771.6000000000004,2750.0,"L/H FLAP CHAFE TAPE NEEDED ON I/B, UPPER.",2016-02-01,APPLIED TAPE TO AFFECTED AREA.,c_49,flap
1150776,2016-02-01 20:19:00,2016-02-01 13:57:00,N689ND,3472.0,550.0,MOMENTARY OVER SPED FLAPS BY 2 KNOTS.,2016-02-01,"INSPECTED IAW PIPER MM FLAP EXTENDED ABOVE MAX VFE INSP, NO DEFECTS NOTED.",c_49,flap
1150822,2016-02-02 17:28:00,2016-02-02 12:26:00,N514ND,11770.8,550.0,"ON FINAL, FLAPS WERE BROUGHT DOWN TO 20* AT 91 KTS INDICATED.",2016-02-02,"INSPECTED IAW CESSNA MM FLAP OVERSPEED INSPECTION, NO DEFECTS NOTED.",c_49,flap
1150859,2016-02-03 12:25:00,2016-02-03 13:45:00,N678ND,809.0999999999999,550.0,"FLAPS 20* OVERSPEED, NO MORE THAN 88 KTS FOR 3 SECONDS.",2016-02-03,"PERFORMED FLAP OVERSPEED INSP, NO DEFECTS NOTED.",c_49,flap
1150909,2016-02-04 17:28:00,2016-02-04 14:04:00,N654ND,3281.3999999999996,5500.0,L/H FLAP APPEARS TO BE LOOSE.,2016-02-04,INSPECTED & FOUND FLAP CABLE TENSION LOW. ADJUSTED TENSION & SAFETIED.,c_49,flap
1150918,2016-02-05 06:31:00,2016-02-05 14:56:00,N545ND,15685.9,550.0,DIDN'T FLARE & TOUCHED DOWN REALLY HARD ON R/H MAIN GEAR.,2016-02-05,"SERVICED NOSE GEAR. CK'ED WINGS & STRUTS, SKINS & LOOSE FASTENERS & FUEL TANKS LEAK CK'ED GOOD. FLAP INSP OK. LEAK CK GOOD FOR NOSE STRUT.",c_49,flap
1150934,2016-02-05 14:45:00,2016-02-05 14:59:00,N530ND,15297.3,5510.0,FLAP INSP PANEL DOUBLER TINNERMAN BROKEN.,2016-02-05,"REMOVED, INSTALLED NEW TINNERMAN TO DOUBLER & REINSTALLED.",c_49,flap
1150958,2016-02-06 18:42:00,2016-02-06 13:34:00,N536ND,13869.099999999999,550.0,"ON FINAL APPROACH, OVERSPED FLAPS - SET @ 20* AT 93 KTS.",2016-02-06,"PERFORMED FLAP OVERSPEED INSP, NO DEFECTS NOTED.",c_49,flap
1151027,2016-02-09 12:25:00,2016-02-09 13:21:00,N574ND,14634.8,5740.0,L/H I/B FLAP TRACK MOUNT RIVET SHEARED OFF.,2016-02-09,INSPECTED AREA FOR DAMAGE. NO DEFECTS NOTED. INSTALLED NEW RIVET IAW CESSNA SE SRM 51-40-00.,c_49,flap
