workorder,date_time_opened,date_time_closed,registration,total_time,ata_code,problem,date,action,cluster,cluster_name
1211523,2022-05-19 11:24:00,2022-05-26 00:00:00,N785ND,6331.4,520.0,"RETEST COMPRESSIONS CYL. #2 AND #4, R/H ENGINE.",2022-05-19 00:00:00,PERFORMED COMPRESSION TEST ON CYL #2 AND CYL #4. CYL #2 70/80 CYL #4 30/80. INSPECTED CYL #4 EXHAUST LEAK NOTED. BORESCOPE INDICATED BURNED EXHAUST VALVE,c_13,cylinder compression low compression
1211523,2022-05-19 11:24:00,2022-05-26 00:00:00,N785ND,6331.4,520.0,"RETEST COMPRESSIONS CYL. #2 AND #4, R/H ENGINE.",2022-05-23 00:00:00,"REMOVED BAFFLING INDUCTION, EXHAUST & ELECTRICAL WIRING & SENSORS AS REQUIRED. REMOVED CYLINDER #4, CLEANED & INSPECTED CASE MOUNTING FLANGE. INSTALLED REPAIRED CYLINDER ASSY & TORQUED REF LYCOMING OVERHAUL MANUAL SECTION V SPECIAL TORQUE REQUIREMENTS. REMOVED LIFTERS & DEFLATED. INSTALLED LIFTERS. INSTALLED INNER BAFFLING.",c_13,cylinder compression low compression
1211523,2022-05-19 11:24:00,2022-05-26 00:00:00,N785ND,6331.4,520.0,"RETEST COMPRESSIONS CYL. #2 AND #4, R/H ENGINE.",2022-05-24 00:00:00,"ASSEMBLED VALVE TRAIN CHECKED VALVE CLEARANCES AND WERE WITHIN SPECIFICATION. INSTALLED NEW HOSE TO DRAINBACK LINE INSTALLED INTAKE & EXHAUST. INSTALLED BAFFLING. INSTALLED BAFFLING BRACE. INSTALLED PROP GOV OIL LINE. REMOVED, CLEANED, AND INSPECTED ALL R/H ENGINE SPARK PLUGS. INSTALLED, TORQUED, & CONNECTED IGNITION LEADS. CONNECTED & SAFETIED PROP GOV CONTROLS. INSTALLED EGT PROBES. MAP LINE. & HEAT DUCT. NO FURTHER DEFECTS NOTED.",c_13,cylinder compression low compression
1212109,2022-06-06 19:29:00,2022-06-07 13:48:00,N250TH,3622.2,520.0,50 HR CYLINDER COMPRESSION DUE.,2022-06-06 00:00:00,N/A BY ROBINSON SL 78.,c_13,cylinder compression low compression
1213434,2022-07-25 06:13:00,2022-08-03 15:50:00,N344Y,3476.0,520.0,50 hr oil change,2022-07-26 12:34:00,"C/W 50hr oil change, cylinder compressions #1 72/80 #2 70/80 #3 75/80 #4 70/80 #5 72/80 #6 72/80",c_13,cylinder compression low compression
1214202,2022-08-25 05:42:00,2022-08-29 00:00:00,N504ND,2122.5,7230.0,CYLINDER # 1 TESTED 55/80 ON COMPRESSION TEST. AIR WAS HEARD FROM OIL FILLER TUBE.,2022-08-26 00:00:00,"BORESCOPED CYL #1. INSPECTED VALVES, VALVE SEATS, CYLINDER WALLS, PISTON & CYLINDER HEAD. NO CRACKS, WARPED VALVES, OR EXCESSIVE WEAR NOTED.",c_13,cylinder compression low compression
1214202,2022-08-25 05:42:00,2022-08-29 00:00:00,N504ND,2122.5,7230.0,CYLINDER # 1 TESTED 55/80 ON COMPRESSION TEST. AIR WAS HEARD FROM OIL FILLER TUBE.,2022-08-29 00:00:00,"TESTED COMPRESSION CYL#1 POST RUN, 62/80 OBSERVED. NO FURTHER DEFECTS NOTED.",c_13,cylinder compression low compression
1214751,2022-09-13 13:31:00,2022-09-20 00:00:00,N785ND,6487.9,7230.0,L/H ENG #2 CYLINDER COMPRESSION MEASURED 50 PSI.,2022-09-19 00:00:00,"REMOVED CYL #2 INTAKE TUBE AND EXHAUST RISER. PERFORMED OIL CONTROL RING SOLVENT FLUSH CYLINDER #2. REINSPECTED CYL #2 COMPRESSION TESTED 76/80. INSTALLED INTAKE TUBE & EXHAUST SYSTEM USING NEW GASKETS. INSTALLED OIL SUMP QUICK DRAIN, SERVICED ENGINE W 7/QTS PHILLIPS 20W50 OIL.",c_13,cylinder compression low compression
1216308,2022-10-31 21:24:00,2022-11-01 11:12:00,N782ND,22559.0,7100.0,"Experienced engine roughness/aircraft shaking during climb out when throttles were brought to 25"". ran engine roughness checklist for LH engine, I thought it fixed the issue, however I elected to turn around. Roughness returned when we tried applying full power.",2022-10-31 22:26:00,"Ran Aircraft ,OPS check - Good ,Performed Compression check  #1 76/80#2 78/80 #3 79/80#4 79/80 ,Inspected Induction system and ignition system , Checks good ,Could not dupicate",c_13,cylinder compression low compression
1217779,2023-01-25 21:08:00,2023-01-26 15:43:00,N782ND,22873.0,7600.0,During cruise right engine shook violently and EGT did not rise at all when leaned. Any mixture setting except full rich caused a large decrease in EGT. Left engine worked normally. Turned on carb heat and fuel pump but neither helped.,2023-01-25 22:42:00,Found RH engine #1 cylinder lower spark plug to be damaged and replaced with new plug. Performed compression test on #1 cylinder and found to be 78/80. Ground run and ops check good.,c_13,cylinder compression low compression
1217909,2023-01-31 06:27:00,2023-02-10 14:07:00,N636ND,10187.4,7220.0,No compression from #1 cylinder,2023-01-31 13:16:00,"Removed and replaced #1 cylinder assy, performed dry tappet clearance, found intake pushrod too tight. Parts on order. Work done IAW Lycoming direct drive overhaul manual",c_13,cylinder compression low compression
1217909,2023-01-31 06:27:00,2023-02-10 14:07:00,N636ND,10187.4,7220.0,No compression from #1 cylinder,2023-02-01 11:49:00,Completed baffle installation,c_13,cylinder compression low compression
1217909,2023-01-31 06:27:00,2023-02-10 14:07:00,N636ND,10187.4,7220.0,No compression from #1 cylinder,2023-02-07 14:17:00,"Installed new pushrod, dry tappet clearance check good, Run-up and leak check good",c_13,cylinder compression low compression
1218933,2023-03-05 09:02:00,2023-03-08 15:18:00,N730ND,8952.9,7230.0,"#4 CYL, LOW COMPRESSION",2023-03-06 14:36:00,"removed cylinder, found exhaust valve ""burnt"" disassembled cylinder ground, and lapped exhaust valve seat and installed new exhaust valve. reassembled cylinder and reinstalled on engine. Torqued base nuts to spec, dry tappet clearance check good. All work done IAW Lycoming Direct Drive Overhaul Manual. Needs run up and leak check",c_13,cylinder compression low compression
1218933,2023-03-05 09:02:00,2023-03-08 15:18:00,N730ND,8952.9,7230.0,"#4 CYL, LOW COMPRESSION",2023-03-07 10:27:00,Ran a/c ops and leak check good,c_13,cylinder compression low compression
1219251,2023-03-20 16:58:00,2023-03-22 13:52:00,N609ND,9057.5,7200.0,"engine sounded and felt rough on start up amd during after start checklist. CHT on cylinder 3 was significantly lower than 1,2,4",2023-03-20 21:37:00,"Ran A/C verified discrep. cleaned #3 plugs and inspected injector no defects found. performed compression check, checked good. removed rocker cover and removed exhaust valve spring found exhaust valve stuck.",c_13,cylinder compression low compression
1219787,2023-04-11 06:17:00,2023-04-18 16:51:00,N847ND,12070.0,7230.0,RH ENG. #4 CYL. LOW COMPRESSION.,2023-04-11 14:07:00,"started #4 cyl change. removed baffles, rockers and pushrods.",c_13,cylinder compression low compression
1219787,2023-04-11 06:17:00,2023-04-18 16:51:00,N847ND,12070.0,7230.0,RH ENG. #4 CYL. LOW COMPRESSION.,2023-04-12 14:50:00,"Removed cylinder from engine. Removed and Replaced Exhaust valve. Fitted new Valve by grinding cylinder seat. Also, cleaned and lapped intake valve. Leak check good on both valves. Reinstalled cylinder. Torque to specs.  Reinstalled Baffles. Fuel line, oil gov. line, Manifold pressure line, fuel injector line. Also, reinstalled exhaust, Intake tube with new gasket. Checked dry tappet clearance and found be with in specs. All work done IAW Lycoming Direct Drive Manual.",c_13,cylinder compression low compression
1220552,2023-05-04 06:11:00,2023-05-16 13:47:00,N344Y,4261.2,7200.0,#6 cylinder has low compression (15/80),2023-05-08 10:23:00,"Removed baffling, intercylinder baffle, and oil return line on #6 cylinder",c_13,cylinder compression low compression
1220552,2023-05-04 06:11:00,2023-05-16 13:47:00,N344Y,4261.2,7200.0,#6 cylinder has low compression (15/80),2023-05-09 14:40:00,"Removed cylinder #6 found exhaust valve to be burnt, installed repaired cylinder kit, torqued cylinder nuts,installed intake and exhaust push rod,push rod tube, and rockers, checked tappet clearance checks good. reinstalled intercylinder baffle, #6 oil return line and began reinstalling baffling",c_13,cylinder compression low compression
1220552,2023-05-04 06:11:00,2023-05-16 13:47:00,N344Y,4261.2,7200.0,#6 cylinder has low compression (15/80),2023-05-10 14:37:00,Completed installation of baffling,c_13,cylinder compression low compression
1220552,2023-05-04 06:11:00,2023-05-16 13:47:00,N344Y,4261.2,7200.0,#6 cylinder has low compression (15/80),2023-05-15 09:29:00,Ops and leak check good,c_13,cylinder compression low compression
1221151,2023-05-23 06:32:00,2023-06-15 14:33:00,N780ND,9304.0,7230.0,LH engine # 3 cylinder has low compression,2023-05-23 15:04:00,removed cylinder assembly and started assembly of servicable cylinder torqued base nuts. needs reassembly of both sides of engine,c_13,cylinder compression low compression
1221151,2023-05-23 06:32:00,2023-06-15 14:33:00,N780ND,9304.0,7230.0,LH engine # 3 cylinder has low compression,2023-05-24 14:19:00,Assisted,c_13,cylinder compression low compression
1221151,2023-05-23 06:32:00,2023-06-15 14:33:00,N780ND,9304.0,7230.0,LH engine # 3 cylinder has low compression,2023-05-24 14:30:00,completed cylinder installation. installed servicable rocker  arm. and new rocker shaft and 1 new push rod in order to achieve clearance. dry tappet clearance check good. ran a/c ops and leak check good.,c_13,cylinder compression low compression
1221768,2023-06-13 06:19:00,2023-06-30 15:08:00,N847ND,12814.0,7230.0,R/H Engine #2 cylinder Compression 55/80,2023-06-14 13:13:00,"removed cylinder and replaced with repaired cyl. assembly. torqued base nuts. Installed new pushrods, dry tappet clearance check good. All work done IAW Lycoming Direct Drive Overhaul Manual.",c_13,cylinder compression low compression
1221768,2023-06-13 06:19:00,2023-06-30 15:08:00,N847ND,12814.0,7230.0,R/H Engine #2 cylinder Compression 55/80,2023-06-14 14:49:00,ops and leak check good,c_13,cylinder compression low compression
1222137,2023-06-27 06:18:00,2023-07-05 14:41:00,N782ND,22968.3,7230.0,rh eng #3 cyl low compression,2023-06-28 10:45:00,"found burnt exhaust valve, Installed overhauled cylinder assembly and torqued to case.",c_13,cylinder compression low compression
1222137,2023-06-27 06:18:00,2023-07-05 14:41:00,N782ND,22968.3,7230.0,rh eng #3 cyl low compression,2023-06-28 12:38:00,REMOVED AND REPLACED INTAKE AND EXHAUST PUSH RODS WITH NEW. REMOVED AND REPLACED INTAKE AND EXHAUST ROCKER ARMS WITH SERVICEABLE ROCKERS PN 17F19357.  TAPPET CLEARANCE CHECK GOOD. CYLINDER INSTALL COMPLETE. WORK PERFORMED IAW LYCOMING OVERHAUL MANUAL.,c_13,cylinder compression low compression
1222137,2023-06-27 06:18:00,2023-07-05 14:41:00,N782ND,22968.3,7230.0,rh eng #3 cyl low compression,2023-06-29 14:12:00,OPS CHECK AND LEAK CHECK GOOD,c_13,cylinder compression low compression
1222372,2023-07-03 10:14:00,2023-07-27 12:46:00,N793ND,11906.4,7230.0,"R/H engine, #4 cylinder compression differential greater than 12psi",2023-07-10 08:22:00,Staked both the intake and exhaust valve.  Compression came up to 74/80  No further defect noted.,c_13,cylinder compression low compression
1223464,2023-08-07 13:16:00,2023-08-30 11:13:00,N502ND,5401.799999999999,7230.0,Cylinder #1 compression is 57/80.,2023-08-07 14:42:00,Leak at rings and exhaust. Staked valve w/no change to compression.,c_13,cylinder compression low compression
1223464,2023-08-07 13:16:00,2023-08-30 11:13:00,N502ND,5401.799999999999,7230.0,Cylinder #3 compression is 20/80.,2023-08-07 14:44:00,Leak at rings and exhaust. Staked valve w/no change to compression.,c_13,cylinder compression low compression
1223464,2023-08-07 13:16:00,2023-08-30 11:13:00,N502ND,5401.799999999999,7230.0,Cylinder #3 compression is 20/80.,2023-08-08 15:35:00,Performed cylinder flush and lapped intake valve then rechecked compression.  Compression was still 20/80.  Assisted with removal of old cylinder and installation of repaired cylinder.,c_13,cylinder compression low compression
1223464,2023-08-07 13:16:00,2023-08-30 11:13:00,N502ND,5401.799999999999,7230.0,Cylinder #1 compression is 57/80.,2023-08-08 15:38:00,Performed cylinder flush on #1 cylinder.,c_13,cylinder compression low compression
1223464,2023-08-07 13:16:00,2023-08-30 11:13:00,N502ND,5401.799999999999,7230.0,Cylinder #1 compression is 57/80.,2023-08-08 18:21:00,"Assisted with ring flush, cylinder #1.",c_13,cylinder compression low compression
1223464,2023-08-07 13:16:00,2023-08-30 11:13:00,N502ND,5401.799999999999,7230.0,Cylinder #1 compression is 57/80.,2023-08-09 09:03:00,Inspected cylinder #1 compression after post run. Compression reading was 74/80. No further defects noted.,c_13,cylinder compression low compression
1224357,2023-09-11 06:29:00,2023-09-19 13:13:00,N725ND,1442.4,3200.0,On a flight the engine starting running rough on descent w/ RPM less than 2300. We landed and taxied off the a run up check and everything was fine. No issues in the pattern too. Same issue on the way home,2023-09-11 07:44:00,"Performed compression check, #1 75/80, #2 72/80, #3 72/80, #4 75/80. Found spark plugs to be wore past limits, removed and replaced 8 spark plugs. Ran up A/C, ops check good",c_13,cylinder compression low compression
1225139,2023-10-03 06:27:00,2023-10-17 13:26:00,N798ND,22230.4,7230.0,R/H Engine #1 cylinder has no compression.,2023-10-04 15:12:00,"Removed low compression cylinder, Installed new cylinder assembly IAW Lycoming direct drive manual section 6-126, dry tappet clearance check good",c_13,cylinder compression low compression
1225139,2023-10-03 06:27:00,2023-10-17 13:26:00,N798ND,22230.4,7230.0,L/H Engine #2 cylinder has no compression.,2023-10-04 15:13:00,"Removed low compression cylinder, Installed new cylinder assembly IAW Lycoming direct drive manual section 6-126, dry tappet clearance check good",c_13,cylinder compression low compression
1225139,2023-10-03 06:27:00,2023-10-17 13:26:00,N798ND,22230.4,7230.0,L/H Engine #2 cylinder has no compression.,2023-10-05 14:48:00,Completed engine assembly and added oil,c_13,cylinder compression low compression
1225139,2023-10-03 06:27:00,2023-10-17 13:26:00,N798ND,22230.4,7230.0,R/H Engine #1 cylinder has no compression.,2023-10-05 14:48:00,Completed engine assembly and added oil,c_13,cylinder compression low compression
1225139,2023-10-03 06:27:00,2023-10-17 13:26:00,N798ND,22230.4,7230.0,L/H Engine #2 cylinder has no compression.,2023-10-09 14:50:00,Ops and leak check good,c_13,cylinder compression low compression
1225139,2023-10-03 06:27:00,2023-10-17 13:26:00,N798ND,22230.4,7230.0,R/H Engine #1 cylinder has no compression.,2023-10-09 14:50:00,Ops and leak check good,c_13,cylinder compression low compression
1225528,2023-10-15 10:40:00,2023-11-13 10:33:00,N619ND,13160.1,7100.0,When throttle was reduced below 1800 RPM while in flight aircraft would start to shake. Cyl. 1 temp consistently ran 200-300 degrees below the others no matter the mixture setting.,2023-10-15 11:53:00,Turned prop and felt no compression on a couple cylinders. Performed compression check and found Zero compression on number 1 and 4 cylinder. Found to be leaking from exhaust. Removed rocker covers and found exhaust springs extending out above intake springs,c_13,cylinder compression low compression
1225746,2023-10-21 08:01:00,2023-11-28 16:25:00,N656ND,14585.3,7230.0,#4 cylinder compression 20/80,2023-10-23 11:46:00,Verified there was no valve tappet clearance,c_13,cylinder compression low compression
1225746,2023-10-21 08:01:00,2023-11-28 16:25:00,N656ND,14585.3,7230.0,#4 cylinder failed dry tappet clearance check and no compression.,2023-10-30 15:54:00,Disassembled and removed cylinder.  Installed new cylinder and started reassembly.,c_13,cylinder compression low compression
1225746,2023-10-21 08:01:00,2023-11-28 16:25:00,N656ND,14585.3,7230.0,#4 cylinder compression 20/80,2023-10-30 15:58:00,See PD #13 for corrective action,c_13,cylinder compression low compression
1225746,2023-10-21 08:01:00,2023-11-28 16:25:00,N656ND,14585.3,7230.0,#4 cylinder failed dry tappet clearance check and no compression.,2023-10-31 13:12:00,Completed installation and reasembled.  All work done IAW Piper and Lycoming direct drive overhaul manual. See Wko# 1226060 for break in flight.,c_13,cylinder compression low compression
1225746,2023-10-21 08:01:00,2023-11-28 16:25:00,N656ND,14585.3,7230.0,#4 cylinder failed dry tappet clearance check and no compression.,2023-10-31 14:01:00,Ran a/c ops. and leak ck. good.,c_13,cylinder compression low compression
1225772,2023-10-23 06:25:00,2023-11-07 16:24:00,N381ND,474.90000000000003,7230.0,Compression check due to check for Valve seat erosion,2023-10-27 15:05:00,"Check performed during phase inspection.Performed compression check to inspect for valve seat recession. #1 78, #2 78, #3 78, #4 78",c_13,cylinder compression low compression
1225810,2023-10-23 16:50:00,2023-11-03 11:25:00,N641ND,9871.8,7200.0,"WHILE INBOUND TO GFK, ENGINE STARTED RUNNING EXTREMELY ROUGH. WE RAN THE ENGINE ROUGHNESS CHECKLIST AND IT GOT BETTER SO WE RESUMED NORMAL FLIGHT. THEN ONCE WE ENTERED THE PATTERN, ROUGHNESS CAME BACK. NO ROUGHNESS WHILE ON THE GROUND.",2023-10-23 17:48:00,Found no compression on #2 Cylinder. All other cylinders test within specs. Upper spark plugs in cylinders were removed for compression test.,c_13,cylinder compression low compression
1225882,2023-10-25 14:47:00,2023-11-17 14:00:00,N631ND,12635.7,7230.0,WHILE DRESSING PROP FOUND CYL#1 TO HAVE NO COMPRESSION. TESTED WITH COMPRESSION TESTER AND CONFIRMED NO COMPRESSION ON CYL#1. CYL#1 (0) CYL#2 (76) CYL#3 (79) CYL#4 (79).,2023-10-26 07:59:00,"Found #1 Exhaust valve recessed, see PD 17 for cylinder replacement",c_13,cylinder compression low compression
1225882,2023-10-25 14:47:00,2023-11-17 14:00:00,N631ND,12635.7,7230.0,WHILE DRESSING PROP FOUND CYL#1 TO HAVE NO COMPRESSION. TESTED WITH COMPRESSION TESTER AND CONFIRMED NO COMPRESSION ON CYL#1. CYL#1 (0) CYL#2 (76) CYL#3 (79) CYL#4 (79).,2023-10-26 08:01:00,Accepted,c_13,cylinder compression low compression
1225882,2023-10-25 14:47:00,2023-11-17 14:00:00,N631ND,12635.7,7230.0,WHILE DRESSING PROP FOUND CYL#1 TO HAVE NO COMPRESSION. TESTED WITH COMPRESSION TESTER AND CONFIRMED NO COMPRESSION ON CYL#1. CYL#1 (0) CYL#2 (76) CYL#3 (79) CYL#4 (79).,2023-10-26 08:01:00,Assisted.,c_13,cylinder compression low compression
1225884,2023-10-25 14:58:00,2023-11-07 11:06:00,N359ND,668.7,520.0,Engine compression check for exhaust valve seat erosion,2023-10-26 12:49:00,"Performed compression check to inspect for valve seat recession. #1 78, #2 75, #3 78, #4 75",c_13,cylinder compression low compression
1225884,2023-10-25 14:58:00,2023-11-07 11:06:00,N359ND,668.7,520.0,Engine compression check for exhaust valve seat erosion,2023-10-26 14:05:00,Assisted,c_13,cylinder compression low compression
1225909,2023-10-26 13:00:00,2023-11-03 13:05:00,N650ND,15617.400000000001,550.0,Compression test due to valve seat recession.,2023-10-26 13:06:00,"Performed compression check to inspect for valve seat recession. #1 78, #2 79, #3 79, #4 78, no defects noted.",c_13,cylinder compression low compression
1225909,2023-10-26 13:00:00,2023-11-03 13:05:00,N650ND,15617.400000000001,550.0,Compression test due to valve seat recession.,2023-10-26 14:33:00,assisted,c_13,cylinder compression low compression
1225910,2023-10-26 13:08:00,2023-11-03 13:05:00,N250TH,5551.6,550.0,compression test for exhaust seat erosion,2023-10-26 13:14:00,"Performed compression check to inspect for valve seat recession. #1 78, #2 72, #3 77, #4 70, #5 78, #6 78",c_13,cylinder compression low compression
1225910,2023-10-26 13:08:00,2023-11-03 13:05:00,N250TH,5551.6,550.0,compression test for exhaust seat erosion,2023-10-26 13:53:00,Assisted,c_13,cylinder compression low compression
1225911,2023-10-26 13:18:00,2023-11-03 13:05:00,N586TS,2343.6,550.0,compression test for exhaust seat erosion,2023-10-26 13:21:00,"Performed compression check to inspect for valve seat recession. #1 78, #2 75, #3 72, #4 71,#5 77, #6 65",c_13,cylinder compression low compression
1225911,2023-10-26 13:18:00,2023-11-03 13:05:00,N586TS,2343.6,550.0,compression test for exhaust seat erosion,2023-10-26 13:53:00,Assisted,c_13,cylinder compression low compression
1225913,2023-10-26 13:23:00,2023-11-17 13:32:00,N896J,1345.4,550.0,compression test for exhaust seat erosion,2023-10-26 13:23:00,"Performed compression check to inspect for valve seat recession. #1 19, #2 20, #3 38, #4 50,#5 78, #6 61 requires run up for hot compression check",c_13,cylinder compression low compression
1225913,2023-10-26 13:23:00,2023-11-17 13:32:00,N896J,1345.4,550.0,compression test for exhaust seat erosion,2023-10-26 13:54:00,Assisted,c_13,cylinder compression low compression
1225913,2023-10-26 13:23:00,2023-11-17 13:32:00,N896J,1345.4,550.0,compression test for exhaust seat erosion,2023-10-28 15:24:00,"Performed hot compressions and found #1 25, #2 21, #3 57,#4 50,#5 78, #6 67",c_13,cylinder compression low compression
1225913,2023-10-26 13:23:00,2023-11-17 13:32:00,N896J,1345.4,550.0,compression test for exhaust seat erosion,2023-10-29 15:05:00,Disassembled engine for cylinder changes,c_13,cylinder compression low compression
1225913,2023-10-26 13:23:00,2023-11-17 13:32:00,N896J,1345.4,7200.0,#1 cylinder has low compression,2023-11-01 14:16:00,"Removed #1 cylinder, installed kit PN# 05K29641 on O/H cylinder. Began installation of cylinder assembly, torqued through bolts and cylinder base stud nuts",c_13,cylinder compression low compression
1225913,2023-10-26 13:23:00,2023-11-17 13:32:00,N896J,1345.4,7200.0,#2 cylinder has low compression,2023-11-01 14:17:00,"Removed #2 cylinder, installed kit PN# 05K29641 on O/H cylinder. Began installation of cylinder assembly, torqued through bolts and cylinder base stud nuts",c_13,cylinder compression low compression
1225913,2023-10-26 13:23:00,2023-11-17 13:32:00,N896J,1345.4,7200.0,#4 cylinder has low compression,2023-11-01 14:18:00,"Removed #4 cylinder. Began installation of cylinder assembly, torqued through bolts and cylinder base stud nuts",c_13,cylinder compression low compression
1225913,2023-10-26 13:23:00,2023-11-17 13:32:00,N896J,1345.4,7200.0,#3 cylinder has low compression,2023-11-01 14:18:00,"Removed #3 cylinder, installed kit PN# 05K29641 on O/H cylinder. Began installation of cylinder assembly, torqued through bolts and cylinder base stud nuts",c_13,cylinder compression low compression
1225913,2023-10-26 13:23:00,2023-11-17 13:32:00,N896J,1345.4,7200.0,#1 cylinder has low compression,2023-11-02 13:58:00,"found exhaust rocker arm and push rod gouging, installed new rocker arm and push rod. finished installing cylinder assy. tappet clearance checks good on intake and exhaust",c_13,cylinder compression low compression
1225913,2023-10-26 13:23:00,2023-11-17 13:32:00,N896J,1345.4,7200.0,#3 cylinder has low compression,2023-11-02 14:03:00,finished installing cylinder assy. tappet clearance checks good on intake and exhaust,c_13,cylinder compression low compression
1225913,2023-10-26 13:23:00,2023-11-17 13:32:00,N896J,1345.4,7200.0,#2 cylinder has low compression,2023-11-05 13:44:00,"Completed installation of #2 cylinder, dry tappet clearance intake .032 exhaust .045. Needs run up and leak check",c_13,cylinder compression low compression
1225913,2023-10-26 13:23:00,2023-11-17 13:32:00,N896J,1345.4,7200.0,#4 cylinder has low compression,2023-11-05 13:45:00,"Completed installation of #4 cylinder, dry tappet clearance intake .035, exhaust .040. Needs run up and leak check",c_13,cylinder compression low compression
1225913,2023-10-26 13:23:00,2023-11-17 13:32:00,N896J,1345.4,7200.0,#4 cylinder has low compression,2023-11-05 16:00:00,ASSISTED,c_13,cylinder compression low compression
1225913,2023-10-26 13:23:00,2023-11-17 13:32:00,N896J,1345.4,7200.0,#2 cylinder has low compression,2023-11-05 16:01:00,ASSISTED,c_13,cylinder compression low compression
1225913,2023-10-26 13:23:00,2023-11-17 13:32:00,N896J,1345.4,550.0,compression test for exhaust seat erosion,2023-11-06 14:08:00,"Installed baffles, oil return lines, fuel lines and baffle rods on engine",c_13,cylinder compression low compression
1225913,2023-10-26 13:23:00,2023-11-17 13:32:00,N896J,1345.4,550.0,compression test for exhaust seat erosion,2023-11-06 14:52:00,Continued installation of baffles,c_13,cylinder compression low compression
1225913,2023-10-26 13:23:00,2023-11-17 13:32:00,N896J,1345.4,7200.0,#1 cylinder has low compression,2023-11-08 08:57:00,"Ran up A/C, ops and leak check good. See W.O.# 1226248 for MX flight",c_13,cylinder compression low compression
1225913,2023-10-26 13:23:00,2023-11-17 13:32:00,N896J,1345.4,7200.0,#2 cylinder has low compression,2023-11-08 08:58:00,"Ran up A/C, ops and leak check good. See W.O.# 1226248 for MX flight",c_13,cylinder compression low compression
1225913,2023-10-26 13:23:00,2023-11-17 13:32:00,N896J,1345.4,7200.0,#4 cylinder has low compression,2023-11-08 08:58:00,"Ran up A/C, ops and leak check good. See W.O.# 1226248 for MX flight",c_13,cylinder compression low compression
1225913,2023-10-26 13:23:00,2023-11-17 13:32:00,N896J,1345.4,7200.0,#3 cylinder has low compression,2023-11-08 08:58:00,"Ran up A/C, ops and leak check good. See W.O.# 1226248 for MX flight",c_13,cylinder compression low compression
1225913,2023-10-26 13:23:00,2023-11-17 13:32:00,N896J,1345.4,550.0,compression test for exhaust seat erosion,2023-11-08 08:59:00,"Completed installation of baffles. Ran up A/C, ops and leak check good",c_13,cylinder compression low compression
1225915,2023-10-26 13:26:00,2023-11-03 13:08:00,N683R,3967.0,550.0,Compression test for exhaust seat erosion,2023-10-26 13:27:00,"Performed compression check to inspect for valve seat recession. #1 70, #2 78, #3 76, #4 76, #5 78, #6 60",c_13,cylinder compression low compression
1225915,2023-10-26 13:26:00,2023-11-03 13:08:00,N683R,3967.0,550.0,Compression test for exhaust seat erosion,2023-10-26 13:54:00,Assisted,c_13,cylinder compression low compression
