workorder,date_time_opened,date_time_closed,registration,total_time,ata_code,problem,date,action,cluster,cluster_name
1190530,2020-01-25 11:30:00,2020-01-29 00:00:00,N785ND,14407.4,7230.0,L/H ENGINE CYL #4 NO COMPRESSION 0/80,2020-01-29,TIGHTENED LINES. RAN ENGINE. LEAK CHECK GOOD. NO FURTHER DEFECTS NOTED.,c_13,cylinder compression low compression
1190530,2020-01-25 11:30:00,2020-01-29 00:00:00,N785ND,14407.4,7230.0,R/H ENGINE CYL #2 LOW COMPRESSION 58/80,2020-01-29,RAN ENGINE. RE-TESTED COMPRESSION. OBTAINED 68/80. NO FURTHER ACTION REQUIRED.,c_13,cylinder compression low compression
1191526,2020-02-25 06:30:00,2020-02-25 15:34:00,N764ND,7192.5,7220.0,#4 CYL HAS 0/80 ON COMPRESSION CK.,2020-02-25,"REMOVED CYLINDER & ATTACHING BAFFLES. EXHAUST VALVE BURNT. REMOVED EXHAUST VALVE, GROUND VALVE SEAT. INSTALLED & LAPPED NEW VALVE. LEAK CK GOOD. INSTALLED CYL ONTO ENGINE, TORQUED. INSTALLED BAFFLING, NEW INTAKE PUSH ROD, CUP, ROCKER SHAFT.",c_13,cylinder compression low compression
1191526,2020-02-25 06:30:00,2020-02-25 15:34:00,N764ND,7192.5,7220.0,#4 CYL HAS 0/80 ON COMPRESSION CK.,2020-02-25,ROCKER CLEARANCE CK GOOD. OPS & LEAK CK GOOD.,c_13,cylinder compression low compression
1192223,2020-03-26 12:38:00,2020-04-23 00:00:00,N785ND,15011.4,7230.0,L/H ENGINE CYLINDER #3 COMPR. LOW,2020-04-03,BORESCOPED AND RETESTED L/H ENGINE CYLINDER #3 COMPRESSION. FOUND TO BE IN SERVICABLE CONDITION.,c_13,cylinder compression low compression
1192223,2020-03-26 12:38:00,2020-04-23 00:00:00,N785ND,15011.4,7230.0,R/H ENGINE CYLINDER #2 COMPRESSION LOW,2020-04-04,VERIFIED LOW COMPRESSION. REMOVED AND REPLACED CYLINDER WITH OVERHAULED. RAN ENGINE. NO LEAKS FOUND. OPS CHECK GOOD. NO FURTHER DEFECTS NOTED.,c_13,cylinder compression low compression
1193902,2020-07-15 09:29:00,2020-07-20 00:00:00,N642ND,14529.0,7230.0,CYL #4 COMPRESSION LOW WHILE HOT.,2020-07-17,"""     """,c_13,cylinder compression low compression
1193902,2020-07-15 09:29:00,2020-07-20 00:00:00,N642ND,14529.0,7230.0,CYL #4 COMPRESSION LOW WHILE HOT.,2020-07-17,PERFORMED COMPRESSION CHECK CYLINDER #4 EXHAUST VALVE LEAKING. BORESCOPED CYLINDER. EXHAUST VALVE BURNED. REMOVED #4 CYLINDER. INSTALLED REPAIRED CYLINDER TO ENGINE. TORQUED HARDWARE IAW LYCOMING SERVICE INSTRUCTION 1029D. ASSEMBLED VALVE TRAIN. CLEANED AND INSTALLED #4 INJECTOR NOZZLE.,c_13,cylinder compression low compression
1193902,2020-07-15 09:29:00,2020-07-20 00:00:00,N642ND,14529.0,7230.0,CYL #4 COMPRESSION LOW WHILE HOT.,2020-07-18,"INSTALLED ROCKER COVER, OIL RETURN LINES. INSTALLED NEW HOSE TO CYL #4 OIL RETURN LINE. OPS AND LEAK CHECK X GOOD. NO FURTHER DEFECTS NOTED.",c_13,cylinder compression low compression
1194309,2020-07-29 15:15:00,2020-08-03 14:47:00,N796ND,5238.5,7200.0,CONSISTENT BACK FIRES FROM R/H ENGINE @ IDLE @ ALTITUDE. ISSUE NOT PRESENT ON GROUND.,2020-07-29,"PERFORMED GROUND RUN, NO DEFECTS NOTED. COMPRESSION CK'ED GOOD. MAG EXTERNAL TIMING CK'ED GOOD. REMOVED, CLEANED, GAPPED & TESTED PLUGS; CK'ED GOOD & REINSTALLED. IGNITION LEADS CK'ED GOOD. ADJUSTED IDLE MIXTURE, CK'ED GOOD.",c_13,cylinder compression low compression
1194827,2020-08-18 05:51:00,2020-08-18 15:25:00,N796ND,5436.5,7230.0,L/H ENG #3 CYL LOW COMPRESSION.,2020-08-18,"STAKED EXHAUST VALVE, COMPRESSION CK GOOD.",c_13,cylinder compression low compression
1194980,2020-08-22 16:08:00,2020-08-28 00:00:00,N678ND,7660.2,7230.0,CYL #2 COMPRESSION LOW,2020-08-24,BORESCOPED CYLINDER. FOUND EXHAUST VALVE CHIPPED.,c_13,cylinder compression low compression
1194980,2020-08-22 16:08:00,2020-08-28 00:00:00,N678ND,7660.2,7230.0,CYL #3 COMPRESSION LOW,2020-08-24,BORESCOPED CYLINDER FOUND NO VISUAL DAMAGE. FOUND LEAD BUILDUP. REQUIRES FURTHER INSPECTION.,c_13,cylinder compression low compression
1194980,2020-08-22 16:08:00,2020-08-28 00:00:00,N678ND,7660.2,7230.0,CYL #2 COMPRESSION LOW,2020-08-25,"REMOVED: ENG. FWD L/H BAFFLING, #2 CHT PROBE, #2 & #4 EGT PROBES, #2 & #4 ROCKER DRAIN TUBES, #2 INTAKE & EXHAUST PIPES, #2 FUEL INJECTION LINE & NOZZLE, #2 CYLINDER PUSH RODS & TUBES, AND #2 CYLINDER & PISTON.",c_13,cylinder compression low compression
1194980,2020-08-22 16:08:00,2020-08-28 00:00:00,N678ND,7660.2,7230.0,CYL #2 COMPRESSION LOW,2020-08-25,"""     """,c_13,cylinder compression low compression
1194980,2020-08-22 16:08:00,2020-08-28 00:00:00,N678ND,7660.2,7230.0,CYL #2 COMPRESSION LOW,2020-08-25,"""     """,c_13,cylinder compression low compression
1194980,2020-08-22 16:08:00,2020-08-28 00:00:00,N678ND,7660.2,7230.0,CYL #3 COMPRESSION LOW,2020-08-25,"C/W CARBON RESISTANCE CHECK ON #3 CYLINDER, NO DEFECTS FOUND.",c_13,cylinder compression low compression
1194980,2020-08-22 16:08:00,2020-08-28 00:00:00,N678ND,7660.2,7230.0,CYL #2 COMPRESSION LOW,2020-08-25,"INSTALLED OVERHAULED CYLINDER AND PISTON. REINSTALLED: PUSH RODS & TUBES, FUEL INJECTOR LINE & NOZZLE, INTAKE & EXHAUST PIPES, AND #2 & #4 ROCKER DRAIN TUBES.",c_13,cylinder compression low compression
1194980,2020-08-22 16:08:00,2020-08-28 00:00:00,N678ND,7660.2,7230.0,CYL #2 COMPRESSION LOW,2020-08-26,"REINSTALLED #2 CHT PROBE, #2 & #4 EGT PROBES, AND ENG. FWD L/H BAFFLING. AD 2015-19-07 COMPLIED WITH NO DEFECTS NOTED",c_13,cylinder compression low compression
1194980,2020-08-22 16:08:00,2020-08-28 00:00:00,N678ND,7660.2,7230.0,CYL #3 COMPRESSION LOW,2020-08-28,"C/W CYL #3 COMPRESSION CHECK AFTER POST PHASE RUN, COMPRESSION 60/80. DETERMINED AIR LEAKING PAST PISTON RINGS, NO DEFECTS NOTED.",c_13,cylinder compression low compression
1195653,2020-09-15 07:23:00,2020-09-15 12:19:00,N680ND,19531.9,7200.0,"DURING CLIMB OUT, #1 EGT ON LEFT ENGINE DROP FROM 1350-1100. THIS WAS FOLLOWED BY ROUGH RUNNING ENGINE, RAN BETTER @ LOWER POWER SETTINGS.",2020-09-15,"PERFORMED COMPRESSION CK, CLEANED & TESTED SPARK PLUGS FOR L/H ENGINE. NO DEFECTS NOTED. RESET L/H ENG L/H & R/H MAG EXTERNAL TIMING. PERFORMED GROUND RUN, OPS & LEAK CK'ED GOOD.",c_13,cylinder compression low compression
1196434,2020-10-08 20:46:00,2020-10-14 00:00:00,N689ND,21358.1,7230.0,"L/H ENGINE CYLINDER #3 COMPRESSION LOW, 40/80",2020-10-09,"""     """,c_13,cylinder compression low compression
1196434,2020-10-08 20:46:00,2020-10-14 00:00:00,N689ND,21358.1,7230.0,"L/H ENGINE CYLINDER #3 COMPRESSION LOW, 40/80",2020-10-09,REMOVED WORN CYLINDER INSTALLED REPAIRED CYLINDER IAW LYCOMING M.M. AND PA-44-180 M.M. OPS & LEAK CHECK GOOD.,c_13,cylinder compression low compression
1196434,2020-10-08 20:46:00,2020-10-14 00:00:00,N689ND,21358.1,7230.0,"L/H ENGINE CYLINDER #3 COMPRESSION LOW, 40/80",2020-10-09,"DURING COMPRESSION CHECK, HAD AIR LEAKING AT OIL TUBE & EXHAUST PIPE. REMOVED LOWER SPARK PLUG & FOUND IT HEAVILY COVERED IN OIL. BOROSCOPED CYLINDER & FOUND OIL POOLING AT BOTTOM.",c_13,cylinder compression low compression
1196436,2020-10-09 05:57:00,2020-10-12 13:51:00,N820ND,5675.799999999999,7230.0,#2 CYLINDER HAS LOW COMPRESSION.,2020-10-09,REMOVED & REPLACED W/ SERVICEABLE CYLINDER KIT IAW LYCOMING OVERHAUL MANUAL. SERVICED ENGINE W/ MINERAL OIL.,c_13,cylinder compression low compression
1196436,2020-10-09 05:57:00,2020-10-12 13:51:00,N820ND,5675.799999999999,7230.0,#2 CYLINDER HAS LOW COMPRESSION.,2020-10-12,"RAN A/C, OPS & LEAK CK GOOD.",c_13,cylinder compression low compression
1196468,2020-10-09 20:23:00,2020-10-12 13:57:00,N721ND,246.0,7230.0,"ENGINE RAN ROUGH & LOST 300 RPM WHEN LEVELED OFF @ 4500, WHILE PERFORMING CRUISE CHECKLIST CONTINUED TO RUN ROUGH UNTIL SHUT DOWN.",2020-10-09,RAN A/C & CONFIRMED PROBLEM. FOUND #2 CYL NOT FIRING AT ALL. FOUND CYLINDER COLD. PERFORMED COMPRESSION CK 79/80. REMOVED ROCKER COVER & TOP SPARK PLUG. REMOVED INJECTOR & TESTED. FOUND TO BE OPERATING NORMAL. SUSPECT STICKING VALVE. REINSTALLED INJECTOR.,c_13,cylinder compression low compression
1196468,2020-10-09 20:23:00,2020-10-12 13:57:00,N721ND,246.0,7230.0,"ENGINE RAN ROUGH & LOST 300 RPM WHEN LEVELED OFF @ 4500, WHILE PERFORMING CRUISE CHECKLIST CONTINUED TO RUN ROUGH UNTIL SHUT DOWN.",2020-10-12,"VALVE CLEARANCE CK GOOD ON INTAKE & EXHAUST, COMPRESSION CK GOOD. CLEANED FUEL NOZZLE. REASSEMBLED ENGINE. RAN A/C, OPS & LEAK CK GOOD.",c_13,cylinder compression low compression
1196870,2020-10-25 13:40:00,2020-10-27 00:00:00,N635ND,10748.0,7230.0,ENGINE RUNS ROUGH AT LOW RPM. LOW COMBUSTION AND CYLINDER HEAD TEMPS NOTED ON CYL #3,2020-10-25,"PERFORMED COMPRESSION TEST. 1= 70/80, 2= 72/80 3= 73/80, 4=70/80.",c_13,cylinder compression low compression
1197575,2020-11-20 13:09:00,2021-12-07 00:00:00,N689ND,21960.1,7200.0,RH ENGINE CYL #2 LOW COMPRESSION 54/80,2020-11-28,"REMOVED CYL. 2 BAFFLING TO FASCILLITATE CYLINDER CHANGE. REMOVED CYLINDER #2, INSTALLED NEW CYLINDER. TORQUED TO SPEC.",c_13,cylinder compression low compression
1197575,2020-11-20 13:09:00,2021-12-07 00:00:00,N689ND,21960.1,7200.0,RH ENGINE CYL #2 LOW COMPRESSION 54/80,2020-11-29,"REINSTALLED VALVE ROCKERS AND PUSH RODS, INTAKE, EXHAUST AND BAFFLES.",c_13,cylinder compression low compression
1197575,2020-11-20 13:09:00,2021-12-07 00:00:00,N689ND,21960.1,7200.0,RH ENGINE CYL #2 LOW COMPRESSION 54/80,2020-12-07,"OPS, LEAK CHECK GOOD",c_13,cylinder compression low compression
1198665,2021-01-20 06:14:00,2021-02-05 12:39:00,N250TH,2133.0,520.0,50 HR CYLINDER BORESCOPE & COMPRESSION.,2021-01-20,C/W 50 HR BORESCOPE & COMPRESSION. NO DEFECTS NOTED.,c_13,cylinder compression low compression
1198665,2021-01-20 06:14:00,2021-02-05 12:39:00,N250TH,2133.0,520.0,50 HR CYLINDER BORESCOPE & COMPRESSION.,2021-01-22,"INSTALLED PRIMERS, MANIFOLD LINES & CYLINDER PLUG.",c_13,cylinder compression low compression
1198693,2021-01-21 15:08:00,2021-01-21 12:42:00,N344Y,1636.0,520.0,50 HR CYLINDER COMPRESSION CK & BORESCOPE.,2021-01-21,PERFORMED COMPRESSION CHECK & BORESCOPE. NO DEFECTS NOTED.,c_13,cylinder compression low compression
1198844,2021-01-28 05:56:00,2021-01-28 13:21:00,N683R,1465.2,520.0,50 HR CYLINDER BORESCOPE & COMPRESSION DUE.,2021-01-28,"C/ W50 HR CYLINDER BORESCOPE, NO DEFECTS NOTED.",c_13,cylinder compression low compression
1199190,2021-02-10 09:33:00,2021-02-17 12:56:00,N344Y,1737.8,520.0,50 HR CYLINDER COMPRESSION CHECK & BORESCOPE.,2021-02-10,"C/W 50 HR CYL COMPRESSION & BORESCOPE. COMPRESSIONS: #1-70, #2-65, #3-72, #4-70, #5-70, #6-72.",c_13,cylinder compression low compression
1199490,2021-02-17 15:43:00,2021-02-19 13:32:00,N683R,1564.0,520.0,50 HR CYLINDER BORESCOPE & COMP CK DUE.,2021-02-17,"PERFORMED COMPRESSION CHECK: #1-77, #2-74, #3-69, #4-74, #5-76, #6-75.",c_13,cylinder compression low compression
1199563,2021-02-19 14:59:00,2021-02-19 15:57:00,N250TH,2242.0,520.0,50 HR CYLINDER BORESCOPE & COMP CK DUE.,2021-02-19,"COMPLETED COMPRESSION CK: #1-73, #2-72, #3-78, #4-78, #5-78, #6-75 AND BORESCOPE NO DEFECTS FOUND @ THIS TIME.",c_13,cylinder compression low compression
1199959,2021-03-03 08:57:00,2021-03-03 14:42:00,N683R,1636.4,7200.0,"FELT INTERMITTENT YAWING IN HOVER & CRUSIE FLIGHT. OCCURED @ INCONSISTENT INTERVALS MORE THAN 5 SECS, LESS THAN 20 SECS.",2021-03-03,"PERFORMED COMPRESSION CK, NO DEFECTS NOTED. TESTED IGNTION LEADS, NO DEFECTS NOTED. FOUND 4 SPARK PLUGS FAILED SPARK PLUG TEST. REMOVED & REPLACED 4 SPARK PLUGS. NEEDS MX FLIGHT - SEE W/O #1199964.",c_13,cylinder compression low compression
1200030,2021-03-04 15:11:00,2021-03-05 15:54:00,N344Y,1847.8,520.0,50 HR CYLINDER BORESCOPE & COMP CK DUE.,2021-03-04,COMPLETED 50 HR BORESCOPE & COMPRESSIONS. NO DEFECTS FOUND @ THIS TIME.,c_13,cylinder compression low compression
1200089,2021-03-05 20:42:00,2021-03-12 13:14:00,N250TH,2332.6,520.0,50 HR CYLINDER BORESCOPE & COMP CK DUE.,2021-03-05,PERFORMED 50 HR CYLINDER COMPRESSION CK.,c_13,cylinder compression low compression
1200211,2021-03-10 06:05:00,2021-03-10 15:03:00,N683R,1694.2,7200.0,"DURING RUN UP ENGINE RPM 60-70%, CREW NOTED DISTINCT & ROUGH SOUNDING VIBRATION ACCOMPANIED BY NOISE. AT 101-102% CONDITION PERSISTED. NO UNUSUAL INDICATION ON ENGINE INSTRUMNENTS.",2021-03-10,"PERFORMED ENGINE COMPRESSION CK, MAG TIMING, IGNITION LEAD TEST. REPLACED 2 SPARK PLUGS. PERFORMED GROUND RUN, NO DEFECTS FOUND. SEE W/O #1200221 FOR MX FLIGHT.",c_13,cylinder compression low compression
1200868,2021-04-01 05:19:00,2021-04-01 11:26:00,N250TH,2437.4,520.0,50 HR CYLINDER COMPRESSION & BORESCOPE.,2021-04-01,"C/W 50 HR CYLINDER COMPRESSION & BORESCOPE, NO DEFECTS NOTED.",c_13,cylinder compression low compression
1200891,2021-04-02 05:45:00,2021-05-24 14:38:00,N683R,1761.4,520.0,50 HR CYLINDER BORESCOPE & COMPRESSION CK DUE.,2021-05-21,N/A - SEE PD #8.,c_13,cylinder compression low compression
1200921,2021-04-03 21:11:00,2021-04-06 00:00:00,N626ND,3937.7999999999997,7230.0,CYLINDER 4 COMPRESSION LOW,2021-04-05,"BORESCOPED CYLINDER, NO DEFECTS NOTED",c_13,cylinder compression low compression
1200921,2021-04-03 21:11:00,2021-04-06 00:00:00,N626ND,3937.7999999999997,7230.0,CYLINDER 4 COMPRESSION LOW,2021-04-06,RE-RUN AND TEST GOOD. COMPRESSION 65/80 NO FURTHER DEFECTS NOTED.,c_13,cylinder compression low compression
1201049,2021-04-08 12:23:00,2021-04-13 00:00:00,N677ND,9259.0,7230.0,CYLINDER #2 LOW COMPRESSION 30/80,2021-04-09,PERFORMED COMPRESSION TEST LEAKAGE @ RINGS & EXHAUST . INSPECTED VALVE SEALING SURFACE & SEAT WITH BORESCOPE. EXHAUST VALVE WORN OUT. REMOVED CYL#2.,c_13,cylinder compression low compression
1201071,2021-04-09 11:48:00,2021-05-07 00:00:00,N621ND,3611.7000000000003,7230.0,LOW COMPRESSION ON CYL #2 58/80,2021-04-17,"""   :""",c_13,cylinder compression low compression
1201101,2021-04-10 19:48:00,2021-04-14 00:00:00,N790ND,12772.4,7230.0,R/H ENG. CYL 2 LOW COMPRESSION (0/80),2021-04-11,"BORESCOPE CYLINDER, NO ABNORMAL WEAR NOTED. POSSIBLE WARPED VALVE. OBTAIN 20/120 RATION AT MAX.",c_13,cylinder compression low compression
1201101,2021-04-10 19:48:00,2021-04-14 00:00:00,N790ND,12772.4,7230.0,R/H ENG. CYL 2 LOW COMPRESSION (0/80),2021-04-12,"PERFORMED CARBON RESISTANCE CHECK. EXHAUST VALVE STUCK. REAMED GUIDE, ASSEMBLED VALVE TRAIN. INSTALLED NEW ROCKER SHAFT END CAPS. INSTALLED NEW ROCKER COVER GASKET. PERFORMED COMPRESION CHECK GOOD 70/80. LEAK CHECK GOOD.",c_13,cylinder compression low compression
1201266,2021-04-16 14:20:00,2021-04-16 13:25:00,N344Y,2024.6,520.0,50 HR CYLINDER BORESCOPE & COMPRESSION DUE.,2021-04-16,C/W 50 HR CYLINDER BORESCOPE & COMPRESSION. NO DEFECTS NOTED.,c_13,cylinder compression low compression
1201360,2021-04-20 10:35:00,2021-04-23 14:02:00,N250TH,2530.2,520.0,50 HR CYLINDER BORESCOPE & COMP CK DUE.,2021-04-21,C/W 50 HR CYLINDER BORESCOPE & COMPRESSION CK.,c_13,cylinder compression low compression
1201571,2021-04-27 13:12:00,2021-04-28 11:57:00,N799ND,8365.0,7230.0,L/H ENG #2 CYL HAS LOW COMPRESSION (20/80).,2021-04-27,REMOVED #2 CYL & STARTED INSTALLATION PROCESS OF NEW CYL BY MEASURING NEW PISTON RING SIDE CLEARANCE & GAP CLEARANCE ON NEW PISTON & BARREL.,c_13,cylinder compression low compression
1201571,2021-04-27 13:12:00,2021-04-28 11:57:00,N799ND,8365.0,7230.0,L/H ENG #2 CYL HAS LOW COMPRESSION (20/80).,2021-04-28,LEAK & OPS CK GOOD.,c_13,cylinder compression low compression
1201571,2021-04-27 13:12:00,2021-04-28 11:57:00,N799ND,8365.0,7230.0,L/H ENG #2 CYL HAS LOW COMPRESSION (20/80).,2021-04-28,INSTALLED NEW CYLINDER ON ENGINE IAW LYCOMING OVERHAUL MANUAL. SERVICED L/H ENGINE W/ 8 QTS MINERAL OIL.,c_13,cylinder compression low compression
1201657,2021-04-29 07:58:00,2021-05-06 14:14:00,N344Y,2125.0,520.0,50 HR CYLINDER BORESCOPE & COMP CK DUE.,2021-04-29,PERFORMED COMPRESSION TEST.,c_13,cylinder compression low compression
1201931,2021-05-06 17:26:00,2021-05-07 13:28:00,N250TH,2634.2,520.0,50 HR COMP CK & CYLINDER BORESCOPE DUE.,2021-05-06,"COMPRESSION CK: GOOD. BORESCOPED CYLINDERS, NO DEFECTS NOTED.",c_13,cylinder compression low compression
1202083,2021-05-11 13:44:00,2021-05-13 00:00:00,N790ND,13115.900000000001,520.0,CONDITION INSPECTION R/H ENGINE,2021-05-11,INSPECTED COMPRESSIONS 1- 72/80 2-60/80 3- 70/80 4 60/80 DETAILED ENGINE INSP.,c_13,cylinder compression low compression
1202083,2021-05-11 13:44:00,2021-05-13 00:00:00,N790ND,13115.900000000001,520.0,CONDITION INSPECTION L/H ENGINE,2021-05-11,INSPECTED ENGINE- COMPRESSIONS 1- 70/80 2-62/80 3-72-80 4 72/80 DETAILED ENGINE INSP. NO DISCREPANCY NOTED -,c_13,cylinder compression low compression
1202625,2021-05-29 14:54:00,2021-06-02 00:00:00,N790ND,13411.9,7220.0,"R/H ENGINE, CYL. #4 LOW COMPRESSION (10/80 PSI)",2021-06-01,"REMOVED ROCKER COVER, INTAKE PIPE LOWER BAFFLES, PERFORM CARBON RESISTANCE CHECK FOUND INTAKE VALVE HANGING UP. REAMED VALVE GUIDE AND CLEANED VALVESTEM. REINSTALLED PARTS REMOVED PERFORMED COMPRESSION TEST AND GOT 25/80",c_13,cylinder compression low compression
1202625,2021-05-29 14:54:00,2021-06-02 00:00:00,N790ND,13411.9,7220.0,"R/H ENGINE, CYL. #4 LOW COMPRESSION (10/80 PSI)",2021-06-02,RAN ENGINE,c_13,cylinder compression low compression
1202625,2021-05-29 14:54:00,2021-06-02 00:00:00,N790ND,13411.9,7220.0,"R/H ENGINE, CYL. #4 LOW COMPRESSION (10/80 PSI)",2021-06-02,CHECKED COMPRESSION AFTER ENG RUN COMPRESSION 40/80,c_13,cylinder compression low compression
1202625,2021-05-29 14:54:00,2021-06-02 00:00:00,N790ND,13411.9,7220.0,"R/H ENGINE, CYL. #4 LOW COMPRESSION (10/80 PSI)",2021-06-02,BORESCOPED CYLINDER AND VALVES. NO DEFECTS NOTED OTHER THAN CARBON BUILDUP ON INTAKE VALVE,c_13,cylinder compression low compression
1202625,2021-05-29 14:54:00,2021-06-02 00:00:00,N790ND,13411.9,7220.0,"R/H ENGINE, CYL. #4 LOW COMPRESSION (10/80 PSI)",2021-06-02,INSPECTED ENG R/H #4 CYLINDER- REMOVED UPPER SPARK PLUG BORESCOPED CYLINDER- COMPRESSION 46/80 NO DEFECTS NOTED INSTALLED UPPER SPARK PLUG-,c_13,cylinder compression low compression
1203588,2021-06-28 13:49:00,2021-07-08 00:00:00,N621ND,3970.5,7230.0,CYL # 2 58/80,2021-07-07,RAN ENGINE BROUGHT ENGINE TO OPERATING TEMPERATURE DISCONNECTED ALL SPARK PLUG LEADS AND REMOVED # 2 LOWER PLUG+PERFORMED COMPRESSION TEST 60/80 INSTALLED PLUG AND PLUG WIRES/LEADS NO FURTHER DEFECTS NOTED,c_13,cylinder compression low compression
1203765,2021-07-06 06:38:00,2021-07-06 13:49:00,N683R,1870.4,520.0,50 HR CYLINDER COMPRESSION CK DUE.,2021-07-06,C/W 50 HR CYLINDER COMPRESSION CK.,c_13,cylinder compression low compression
1203953,2021-07-12 05:54:00,2021-07-12 14:04:00,N250TH,2769.6,550.0,"DURING FLIGHT, SUDDEN YAW THEN LANDED. NO EVIDENCE OF BIRD STRIKE.",2021-07-12,"C/W ROBINSON SL 78 & SI 1577, NO DEFECTS NOTED. COMPRESSIONS GOOD. MX FLIGHT REQUIRED - SEE W/O #1203966.",c_13,cylinder compression low compression
1203967,2021-07-12 07:26:00,2021-07-12 14:11:00,N683R,1890.8,7200.0,"WHILE IN HOVER NOTICED CONSISTENT THUMP EVERY 5-6 SECS, FOLLOWED BY SLIGHT YAW & REDUCED POWER.",2021-07-12,"C/W ROBINSON SL 78 & LYCOMING SI 1577, NO DEFECTS NOTED. COMPRESSIONS GOOD. FOUND #1 TOP SPARK PLUG INOP. REPLACED PLUG. MX FLIGHT REQUIRED - SEE W/O #1203976.",c_13,cylinder compression low compression
1203971,2021-07-12 09:20:00,2021-07-29 11:11:00,N344Y,2322.4,520.0,50 HR CYL COMPRESSION CK DUE.,2021-07-19,C/W 50 HR COMPRESSION CK.,c_13,cylinder compression low compression
1204563,2021-08-04 14:57:00,2021-08-17 00:00:00,N688ND,19870.3,7230.0,LH ENGINE CYLINDERS #3 LOW COMPRESSION 45/80,2021-08-10,REMOVED BAFFLES TO GAIN ACCESS TO CYL #3. REMOVED CYLINDER # 3 FROM AIRCRAFT. CLEANED AND INSP. MATING SURFACE. INSTALLED REPAIR CYLINDER P/N: 05K21104 WITH REFERENCE TO LYCOMING OVERHAUL MM. REINSTALLED BAFFLES AND ALL OTHER COMPONENTS THAT WERE REMOVED TO GAIN ACCESS TO CYLINDER. NO OTHER DEFECTS NOTED.,c_13,cylinder compression low compression
1204563,2021-08-04 14:57:00,2021-08-17 00:00:00,N688ND,19870.3,7230.0,LH ENGINE CYLINDERS #3 LOW COMPRESSION 45/80,2021-08-10,"PERFORMED BORESCOPE & CARBON RESISTENANCE CHECK ON CYLINDER #3. FOUND CARBON BUILD UP ON EXHAUST VALVE. PERFORMED COMPRESSION TEST ON CYLINDER #3, 20/80",c_13,cylinder compression low compression
1205556,2021-09-13 05:43:00,2021-09-13 13:25:00,N250TH,3025.8,520.0,50 HR CYLINDER COMPRESSION CK DUE.,2021-09-13,C/W COMPRESSION CK.,c_13,cylinder compression low compression
1205651,2021-09-15 06:03:00,2021-09-15 16:24:00,N683R,2062.8,520.0,50 HR CYLINDER COMP CHECK DUE.,2021-09-15,C/W 50 HR CYLINDER COMPRESSION CK.,c_13,cylinder compression low compression
1205800,2021-09-20 10:51:00,2021-09-27 15:01:00,N344Y,2517.2,520.0,50 HR CYL COMPRESSION CK DUE.,2021-09-21,PERFORMED COMPRESSION TEST.,c_13,cylinder compression low compression
1206117,2021-09-29 06:34:00,2021-10-08 13:12:00,N250TH,3126.4,520.0,50 HR CYLINDER COMPRESSION CK DUE.,2021-09-29,PERFORMED COMPRESSION CK.,c_13,cylinder compression low compression
1206191,2021-09-30 14:32:00,2021-10-01 14:07:00,N625ND,6392.6,7230.0,#2 CYL HAS LOW COMPRESSION.,2021-10-01,STAKED EXHAUST VALVE. COMPRESSION CK GOOD (70/80). REMOVED & REPLACED ROCKER COVER GASKET W/ NEW.,c_13,cylinder compression low compression
1206446,2021-10-08 13:12:00,2021-10-14 15:40:00,N683R,2137.0,520.0,50 HR CYLINDER COMPRESSION CK DUE.,2021-10-11,C/W 50 HR CYLINDER COMPRESSION CK.,c_13,cylinder compression low compression
1206778,2021-10-23 10:14:00,2021-10-24 11:04:00,N782ND,18990.0,7100.0,"ON CLIMB OUT, RIGHT ENGINE RAN ROUGH AT FULL POWER. R/H #1 CYL EGT 1000, EGT 2, 3, 4 1300.",2021-10-23,"CK'ED #1 SPARK PLUG & COMPRESSION, NO DEFECTS NOTED.",c_13,cylinder compression low compression
1206793,2021-10-25 05:28:00,2021-10-28 11:18:00,N344Y,2614.0,520.0,50 HR CYLINDER COMPRESSION CK DUE.,2021-10-26,PERFORMED 50 HR COMPRESSION CHECK.,c_13,cylinder compression low compression
1206959,2021-11-01 07:23:00,2021-11-02 15:37:00,N250TH,3231.4,520.0,50 HR CYLINDER COMPRESSION CK DUE.,2021-11-01,C/W 50 HR CYL COMPRESSION CK.,c_13,cylinder compression low compression
1207298,2021-11-11 06:26:00,2021-11-16 14:14:00,N250TH,3318.6,520.0,50 HR CYL COMPRESSION CK DUE.,2021-11-11,COMPLETED 50 HR COMP CK.,c_13,cylinder compression low compression
1207365,2021-11-16 19:51:00,2021-11-19 13:23:00,N344Y,2708.8,520.0,50 HR CYL COMPRESSION CK DUE.,2021-11-16,"PERFORMED COMPRESSION CK, CK'ED GOOD.",c_13,cylinder compression low compression
1207613,2021-11-30 06:22:00,2021-12-01 12:44:00,N796ND,10241.5,7230.0,R/H ENGINE #3 CYL HAS LOW COMPRESSION.,2021-11-30,"STAKED BOTH INTAKE & EXHAUST VALVES, COMPRESSION CK GOOD.",c_13,cylinder compression low compression
1207815,2021-12-08 10:34:00,2021-12-14 00:00:00,N793ND,9277.9,7220.0,"R/H ENGINE, CYL. #4 55/80 PSI",2021-12-10,PERFORMED COMPRESSION TEST ON RH ENGINE #4 CYLINDER WITH RESULTS OF 65/80. NO FURTHER DEFECTS NOTED.,c_13,cylinder compression low compression
1207816,2021-12-08 11:22:00,2021-12-09 13:27:00,N250TH,3428.4,520.0,50 HR CYL COMP CHECK DUE.,2021-12-08,COMPLETED COMPRESSION CHECK.,c_13,cylinder compression low compression
1207952,2021-12-14 05:34:00,2021-12-14 15:34:00,N344Y,2816.4,520.0,50 HR CYL COMPRESSION CK DUE.,2021-12-14,C/W 50 HR CYL COMPRESSION CK.,c_13,cylinder compression low compression
1208799,2022-02-03 12:42:00,2022-02-14 10:50:00,N250TH,3516.8,520.0,50 HR CYLINDER COMPRESSION CHECK DUE.,2022-02-04 00:00:00,COMPLETED 50 HR COMP CHECK.,c_13,cylinder compression low compression
1208983,2022-02-12 10:56:00,2022-02-24 14:39:00,N344Y,2902.4,7230.0,50 HR CYLINDER COMP CK DUE.,2022-02-13 00:00:00,COMPRESSION TEST GOOD.,c_13,cylinder compression low compression
1209962,2022-03-21 06:53:00,2022-03-24 12:40:00,N344Y,3025.2,7230.0,DURING COMPRESSION CK FOUND #2 CYL COMPRESSION LOW (40/80).,2022-03-21 00:00:00,"REMOVED ENGINE BAFFLES & #1, 2, 4 ENGINE OIL RETURN LINES.",c_13,cylinder compression low compression
1209962,2022-03-21 06:53:00,2022-03-24 12:40:00,N344Y,3025.2,7230.0,DURING COMPRESSION CK FOUND #2 CYL COMPRESSION LOW (40/80).,2022-03-22 00:00:00,REMOVED CYLINDER & INTAKE VALVE ASSY. INSTALLED & LEAK CK'ED SERVICEABLE INTAKE VALVE IN NEW CYLINDER ASSY. INSTALLED & TORQUED CYLINDER ASSY TO ENGINE CASE.,c_13,cylinder compression low compression
1209962,2022-03-21 06:53:00,2022-03-24 12:40:00,N344Y,3025.2,7230.0,DURING COMPRESSION CK FOUND #2 CYL COMPRESSION LOW (40/80).,2022-03-22 00:00:00,"INSTALLED NEW SERVICEABLE CYLINDER ASSY. REASSEMBLED VALVE TRAIN. PERFORMED DRY TAPPET CLEARANCE - CHECKS GOOD. REINSTALLED ENGINE BAFFLES & #1, 2, 4 OIL RETURN LINES.",c_13,cylinder compression low compression
1209962,2022-03-21 06:53:00,2022-03-24 12:40:00,N344Y,3025.2,7230.0,DURING COMPRESSION CK FOUND #2 CYL COMPRESSION LOW (40/80).,2022-03-24 00:00:00,"RAN UP A/C, OPS & LEAK CK GOOD. MX FLIGHT REQUIRED - SEE PD #5 FOR MX FLIGHT.",c_13,cylinder compression low compression
1210682,2022-04-19 08:05:00,2022-04-21 00:00:00,N785ND,6029.4,7230.0,RT ENG. #2 CYLINDER COMPRESSION PRESSURE LOW. (22PSI),2022-04-20 00:00:00,"PERFORMED GROUND RUN AND RETESTED COMPRESSION, PASSED AT 64PSI/80.",c_13,cylinder compression low compression
1210682,2022-04-19 08:05:00,2022-04-21 00:00:00,N785ND,6029.4,7230.0,"RT ENGINE, #4 CYLINDER COMPRESSION PRESSURE LOW. (56 PSI)",2022-04-20 00:00:00,PERFORMED GROUND RUN AND RETESTED COMPRESSIONS PASSED AT 62 PSI/80.,c_13,cylinder compression low compression
1210682,2022-04-19 08:05:00,2022-04-21 00:00:00,N785ND,6029.4,7230.0,RT ENG. #2 CYLINDER COMPRESSION PRESSURE LOW. (22PSI),2022-04-20 00:00:00,PERFORMED CARBON RESISTANCE CHECK AND BORESCOPED CYLINDER. LAPPED VALVE AND CLEANED EXHAUST VALVE.,c_13,cylinder compression low compression
1210682,2022-04-19 08:05:00,2022-04-21 00:00:00,N785ND,6029.4,7230.0,"RT ENGINE, #4 CYLINDER COMPRESSION PRESSURE LOW. (56 PSI)",2022-04-20 00:00:00,PERFORMED CARBON RESISTANCE CHECK AND BORESCOPED CYLINDER. LAPPED VALVE AND CLEANED EXHAUST VALVE.,c_13,cylinder compression low compression
1211509,2022-05-18 17:27:00,2022-05-20 15:07:00,N796ND,11420.0,7230.0,R/H ENG #3 CYL HAS LOW COMPRESSION.,2022-05-19 00:00:00,REMOVED #3 CYL. TORQUED REPAIRED CYL ASSY TO CASE. SET DRY TAPPET CLEARANCE.,c_13,cylinder compression low compression
1211509,2022-05-18 17:27:00,2022-05-20 15:07:00,N796ND,11420.0,7230.0,R/H ENG #3 CYL HAS LOW COMPRESSION.,2022-05-20 00:00:00,COMPLETED ENGINE REASSEMBLY. OPS & LEAK CK GOOD. DONE IAW LYCOMING OVERHAUL MANUAL.,c_13,cylinder compression low compression
