workorder,date_time_opened,date_time_closed,registration,total_time,ata_code,problem,date,action,cluster,cluster_name
1175550,2018-07-26 22:35:00,2018-08-01 10:31:00,N793ND,4774.1,580.0,MX FLIGHT REQUIRED DUE TO REPLACEMENT OF L/H AILERON.,2018-07-26,"DROOPED R/H FLAP TO MAX 4*, WITNESS HOLES CK GOOD ON EYE BOLTS. MX FLIGHT REQUIRED.",c_49,flap
1175693,2018-08-01 17:34:00,2018-08-01 11:03:00,N689ND,12417.3,550.0,FLAPS OVERSPEED 113 KTS.,2018-08-01,INSPECTED IAW PIPER MM FLAP OVERSPEED CHECKLIST. NO DEFECTS NOTED.,c_49,flap
1175694,2018-08-01 17:34:00,2018-08-01 11:20:00,N523ND,13382.199999999999,550.0,"ADDED FLAPS 20* ON BASE @ 85 KTS & DESCENDED, WHICH INCREASED AIRSPEED TO 87 KTS.",2018-08-01,INSPECTED IAW CESSNA MM FLAP OVERSPEED INSP - REF 172S MX MANUAL 05-50-00 B(2)(D)(1). NO DEFECTS NOTED.,c_49,flap
1175700,2018-08-02 06:24:00,2018-08-02 14:50:00,N529ND,11366.099999999999,2750.0,"R/H FLAP NEEDS CHAFE TAPE, I/B.",2018-08-02,INSTALLED TAPE AFTER CLEANING AREA WHERE TAPE GOES.,c_49,flap
1175722,2018-08-02 20:11:00,2018-08-02 13:36:00,N558ND,10322.4,550.0,"FLAP OVERSPEED, FLAP 25* FOR 3 SECONDS.",2018-08-02,"INSPECTED FLAPS IAW AMM 05-50-00, NO DEFECTS NOTED.",c_49,flap
1175751,2018-08-06 06:07:00,2018-08-06 13:24:00,N558ND,10325.4,2750.0,L/H FLAP NEEDS SMALL CHAFE TAPE.,2018-08-06,INSTALLED TAPE.,c_49,flap
1175767,2018-08-06 15:01:00,2018-08-06 10:43:00,N547ND,12411.099999999999,2750.0,"DURING TRAFFIC PATTERN, WHEN FLAPS SELECTED 20*, INDICATOR & FLAPS WOULD FLUCTUATE UP & DOWN.",2018-08-06,TROUBLESHOT FLAP SWITCHES & FOUND UP SWITCH OUT OF RIG. RIGGED UP SWITCH & OPS CK GOOD.,c_49,flap
1175803,2018-08-07 13:30:00,2018-08-08 11:22:00,N689ND,12514.8,2360.0,L/H & R/H FLAP STATIC WICKS BROKEN.,2018-08-07,REMOVED & REPLACED STATIC WICKS.,c_49,flap
1175883,2018-08-10 15:05:00,2018-08-10 11:01:00,N550ND,10909.6,5510.0,FLAPS DO NOT WORK. STOPPED WORKING DURING FLIGHT.,2018-08-10,CLEANED FLAP CONTROL MICROSWITCHES IN L/H WING. OPS CK GOOD.,c_49,flap
1175926,2018-08-13 17:31:00,2018-08-13 14:26:00,N550ND,10926.4,2400.0,FLAPS FOUND INOP ON PREFLIGHT.,2018-08-13,"INSPECTED, FOUND FLAP MOTOR CONNECTIONS DIRTY. CLEANED CONNECTIONS & REPOSITIONED WIRES. OPS CK GOOD.",c_49,flap
1175934,2018-08-14 05:59:00,2018-08-14 12:36:00,N687ND,15199.7,5750.0,L/H FLAP CHAFING ON NACELLE.,2018-08-14,APPLIED CHAFE TAPE TO NACELLE.,c_49,flap
1175956,2018-08-14 13:45:00,2018-08-15 10:57:00,N561ND,9138.8,2750.0,L/H REAR FLAP CABLE IS WORN.,2018-08-15,REPLACED W/ NEW CABLES & SAFETIED. TENSION & TRAVEL CK GOOD.,c_49,flap
1175957,2018-08-14 13:45:00,2018-08-15 14:24:00,N688ND,14114.6,2360.0,L/H FLAP HAS BROKEN STATIC WICK.,2018-08-14,REMOVED & REPLACED STATIC WICK.,c_49,flap
1176084,2018-08-20 06:31:00,2018-08-20 14:11:00,N793ND,5117.099999999999,2360.0,L/H FLAP STATIC WICK BROKEN.,2018-08-20,REPLACED STATIC WICK.,c_49,flap
1176084,2018-08-20 06:31:00,2018-08-20 14:11:00,N793ND,5117.099999999999,2360.0,R/H FLAP STATIC WICK BROKEN.,2018-08-20,REPLACED STATIC WICK.,c_49,flap
1176383,2018-08-29 18:03:00,2018-08-29 13:47:00,N575ND,13780.5,550.0,FLAP OVERSPEED 115 KTS FOR 4-5 SECONDS.,2018-08-29,"INSPECTED ICA CESSNA 172S MAINTENANCE MANUAL, CH 05-50-00, PARA B. NO DEFECTS NOTED.",c_49,flap
1176874,2018-09-13 14:02:00,2018-09-14 10:28:00,N688ND,14417.6,2360.0,STATIC WICK BROKEN ON L/H FLAP.,2018-09-13,REMOVED & REPLACED STATIC WICK.,c_49,flap
1176957,2018-09-17 06:15:00,2018-09-21 14:13:00,N571ND,14799.3,2750.0,L/H FLAP O/B AFT ROLLER DOESN'T ROLL.,2018-09-17,REMOVED BEARING & ORDERED PART.,c_49,flap
1176957,2018-09-17 06:15:00,2018-09-21 14:13:00,N571ND,14799.3,2750.0,L/H FLAP O/B AFT ROLLER DOESN'T ROLL.,2018-09-20,INSTALLED NEW BEARING. OPS CK GOOD.,c_49,flap
1177022,2018-09-18 10:15:00,2018-09-18 14:27:00,N529ND,11763.300000000001,550.0,FLAPS OVERSPEED 10*.,2018-09-18,"INSPECTED IAW CESSNA MM FLAP OVERSPEED INSPECTION, NO DEFECTS NOTED.",c_49,flap
1177043,2018-09-18 17:31:00,2018-09-18 14:25:00,N550ND,11246.5,2750.0,"FLAPS STUCK IN POSITION, CYCLED LEVER, RESET CIRCUIT BREAKER, NO CHANGE. FLAPS STILL DON'T COME DOWN.",2018-09-18,"CLEANED & LUBED O/B JACK SCREW SWITCH, OPS CK'ED GOOD.",c_49,flap
1177101,2018-09-19 20:31:00,2018-09-19 13:32:00,N562ND,11520.0,550.0,"WHILE CONDUCTING INSTRUMENT APPROACH, ACCIDENTALLY PUT FLAPS TO 20* @ 103 KTS.",2018-09-19,PERFORMED FLAP OVERSPEED INSP IAW CESSNA MM.,c_49,flap
1177141,2018-09-20 13:57:00,2018-09-20 00:00:00,N571ND,14799.3,2750.0,SCREW MISSING FROM O/B FLAP INSPECTION PANEL,2018-09-20,REINSTALLED SCREW,c_49,flap
1177190,2018-09-22 11:47:00,2018-09-22 14:25:00,N529ND,11816.7,5500.0,R/H FLAP SHUTTERS WHEN EXTENDING FLAPS.,2018-09-22,"LUBED R/H FLAP ROLLERS, OPS GOOD.",c_49,flap
1177315,2018-09-26 09:11:00,2018-09-26 00:00:00,N653ND,7571.5,550.0,FLAP OVERSPEED STUDENT EXTENDED FLAPS TO 20 DEGREES AT AIRSPEED 88 KTS. I IMMEDIATELY CORRECTED.,2018-09-26,INSECTED AIRCRAFT IA CESSNA 172 MAINTENANCE MANUAL 5-50-00 FLAP OVERSPEED. NO DEFECTS NOTED.,c_49,flap
1177323,2018-09-26 12:31:00,2018-09-26 15:26:00,N559ND,13584.2,550.0,FLAP EXTENDED INADVERTANTLY DURING EMERGENCY DESCENT PRACTICE. FLAPS 10* DURING MANUEVER W/ AIRSPEED BETWEEN 120-129 KNOTS. NOTICED DURING RECOVERY.,2018-09-26,C/W CESSNA MM 05-50-00 FLAP OVERSPEED INSP. NO DEFECTS NOTED.,c_49,flap
1177518,2018-10-02 13:09:00,2018-10-02 10:14:00,N561ND,9497.9,5500.0,I/B R/H FLAP COVE SUPPORT BRACKET BROKEN.,2018-10-02,REMOVED & REPLACED SUPPORT BRACKET.,c_49,flap
1177520,2018-10-02 13:22:00,2018-10-05 14:57:00,N509ND,19925.7,5700.0,L/H FLAP COVE/WING ROOT SCREW IS MISSING.,2018-10-02,REPLACED MISSING NUTPLATE & SCREW.,c_49,flap
1177579,2018-10-04 14:43:00,2018-10-04 14:41:00,N575ND,14087.1,5510.0,R/H FLAP COVE HAS CRACK.,2018-10-04,STOP DRILLED CRACK. FABRICATED PATCH & RIVETED PATCH ONTO A/C IAW CESSNA 172 STRUCTURE REPAIR MANUAL 51-40-00.,c_49,flap
1177778,2018-10-15 13:50:00,2018-10-15 11:00:00,N689ND,13356.3,5750.0,FLAP CONTROL NEEDS LUBE IN CABIN.,2018-10-15,LUBED FLAP LEVER PIN.,c_49,flap
1177839,2018-10-16 16:31:00,2018-10-16 13:31:00,N550ND,11472.4,550.0,FLAP OVERSPEED FOR ABOUT 30 SECONDS IN TRANSIT FROM PRACTICE AREA.,2018-10-16,"PERFORMED FLAP OVERSPEED INSP IAW CESSNA MM 05-50-00, 2-B. NO DEFECTS NOTED.",c_49,flap
1177925,2018-10-18 14:44:00,2018-10-18 16:04:00,N559ND,13754.0,550.0,OVERSPEED FLAPS ON FINAL. FLAPS 20* @ 99 KTS FOR 3-4 SECS.,2018-10-18,PERFORMED FLAP OVERSPEED INSP IAW CESSNA MM. NO DEFECTS NOTED. OPS GOOD.,c_49,flap
1177992,2018-10-20 19:08:00,2018-10-20 14:15:00,N521ND,14526.900000000001,550.0,FLAP OVERSPEED.,2018-10-20,"PERFORMED FLAP OVERSPEED IAW CESSNA MM CH 5-50-00, 2-B. NO DEFECTS NOTED.",c_49,flap
1178055,2018-10-22 15:18:00,2018-10-23 11:11:00,N529ND,12088.800000000001,5510.0,FLAP TINNERMAN BROKEN.,2018-10-23,REMOVED & REPLACED W/ NEW.,c_49,flap
1178235,2018-10-29 06:16:00,2018-10-29 10:50:00,N550ND,11642.199999999999,550.0,"FOUND A COUPLE OF BIRD STRIKES DURING PREFLIGHT. ONE ON BOTTOM OF EACH FLAP, ONE ONLEFT STABILIZER.",2018-10-29,INSPECTED A/C & FOUND NO DAMAGE. REMOVED BIRD REMAINS.,c_49,flap
1178609,2018-11-09 16:22:00,2018-11-09 15:35:00,N575ND,14312.1,5510.0,"FLAPS CONTROL WORKS INTERMITTENTLY, FLAPS WOULD NOT RETRACT ON GO-AROUND.",2018-11-09,CLEANED FLAP CONTROL MICROSWITCHES IN R/H WING. OPS CK GOOD.,c_49,flap
1178651,2018-11-12 18:46:00,2018-11-12 09:55:00,N575ND,14329.2,2750.0,"AFTER TAKEOFF, FLAPS STAYED IN 10* POSITION & VISUALLY CONFIRMED WOULD NOT RETRACT.",2018-11-12,CLEANED FLAP CONTROL MICROSWITCHES IN R/H WING. OPS CK GOOD.,c_49,flap
1178955,2018-11-21 16:35:00,2018-11-21 14:35:00,N550ND,11859.699999999999,550.0,"FLAP OVERSPEED 5 KTS, 3 SECS @ FLAPS 20*.",2018-11-21,"INSPECTED IAW AMM 05-50, NO DEFECTS NOTED. OPS CK GOOD.",c_49,flap
1178956,2018-11-21 16:48:00,2018-11-21 14:25:00,N557ND,17527.6,550.0,FLAP OVERSPEED BY 5 KTS @ 20*,2018-11-21,"INSPECTED IAW AMM 05-50, NO DEFECTS NOTED. OPS CK GOOD.",c_49,flap
1179321,2018-12-07 11:34:00,2018-12-07 14:32:00,N575ND,14493.6,550.0,"FLAPS OVERSPEED, 10* @ 115 KTS.",2018-12-07,"PERFORMED FLAP OVERSPEED INSP IAW CESSNA MM CH 05-50-00 2, B, 2; NO DEFECTS NOTED.",c_49,flap
1179327,2018-12-07 13:38:00,2018-12-07 14:30:00,N562ND,12111.3,550.0,FLAP OVERSPEED 112 KNOTS 10* FOR 2 SECONDS.,2018-12-07,"PERFORMED FLAP OVERSPEED INSP IAW CESSNA MM 05-50-00 2, B, 2. NO DEFECTS NOTED.",c_49,flap
1179896,2019-01-10 14:34:00,2019-01-10 00:00:00,N559ND,14170.7,2750.0,FOD IN FLAP L/H BOTTOM I/B,2019-01-10,REMOVED FOD,c_49,flap
1179896,2019-01-10 14:34:00,2019-01-10 00:00:00,N559ND,14170.7,2750.0,FOD ON L/H FLAP PUSH ROD INSIDE OF WING,2019-01-10,REMOVED FOD,c_49,flap
1179896,2019-01-10 14:34:00,2019-01-10 00:00:00,N559ND,14170.7,2750.0,L/H FLAP PUSH/PULL ROD BRACKET BOLT LOOSE,2019-01-10,RESECURED BOLT,c_49,flap
1179896,2019-01-10 14:34:00,2019-01-10 00:00:00,N559ND,14170.7,5750.0,SIMULATED CRACK ON O/B R/H FLAP TRACK,2019-01-10,REMOVED SIMULATED CRACK,c_49,flap
1180065,2019-01-18 07:34:00,2019-01-19 00:00:00,N573ND,13439.4,2350.0,"FEED BACK OVER COMMS, WHEN FLAPS ARE MOVED.",2019-01-19,REMOVED AND REPLACED FLAP MOTOR OPS CHECK OK AND NO FEED BACK. NO FURTHER DEFECTS NOTED.,c_49,flap
1181591,2019-03-12 08:04:00,2019-03-12 00:00:00,N653ND,8928.7,3100.0,"FLAP INDICATOR PIN. PIN DOES NOT CORRESPOND TO THE FLAP POSITION, AND LAGS WHEN EXTENDED (20 DEGREE FLAPS WILL INDICATE 10 DEGREES).",2019-03-12,CHECKED RIGGING & CONFIRMED FLAP OPERATION. ADJUSTED FOLLOW UP CABLE. INDICATOR & FLAPS OPERATE PROPERLY. NO FURTHER DEFECTS.,c_49,flap
1181591,2019-03-12 08:04:00,2019-03-12 00:00:00,N653ND,8928.7,3100.0,"FLAP INDICATOR PIN. PIN DOES NOT CORRESPOND TO THE FLAP POSITION, AND LAGS WHEN EXTENDED (20 DEGREE FLAPS WILL INDICATE 10 DEGREES).",2019-03-12,INDICATOR PIN 10 DEGREES BELOW ACTUAL FLAP POSITION.,c_49,flap
1181640,2019-03-15 11:50:00,2019-03-15 00:00:00,N653ND,8954.5,5750.0,LEFT FLAP HAS APPROXIMATELY 5 DEGREES OF GIVE UP WHEN PRESSURE IS PUT ON IT. FLAP MOTOR CAN NOT HOLD IT IN POSITION.,2019-03-15,"INSPECTED FLAPS, FOUND FWD L/H FLAP ROD END WORN. REPLACED L/H FWD FLAP ROD END WITH NEW. INSTALLED NEW NYLON LOCKNUTS AT BOTH RODENDS. LUBED FLAP ROLLERS AND ROD ENDS. INSPECTED FLAP TRACKS. NO FURTHER DEFECTS NOTED.",c_49,flap
1181711,2019-03-18 15:02:00,2019-03-21 00:00:00,N653ND,8983.0,5750.0,R/H OUT BOARD FLAP INSPECTION SCREW BROKE.,2019-03-21,REMOVED & INSTALLED NEW SCREW.,c_49,flap
1182009,2019-03-26 08:01:00,2019-03-26 00:00:00,N653ND,9055.6,2750.0,FLAPS DO NOT WORK SOMETIMES.,2019-03-26,INTERMITTENT FLAP DOWN RESULTS ON INITIAL CHECK. ADJUSTED SWITCH 52008 (FLAPS DOWN SWITCH) & CLEAN BOTH UP & DOWN MICRO SWITCHED WITH CONTACT CLEANER. OPS CHECKED GOOD. NO OTHER DEFECTS NOTEDD.,c_49,flap
1182813,2019-04-23 13:46:00,2019-04-23 12:49:00,N719ND,5603.700000000001,2710.0,AILERON CONTROL TRAVEL NOT HITTING STOPS.,2019-04-23,"READJUSTED RIGGING OF AILERONS BY ADJUSTING PRIMARIES & BALANCE CABLES. TRAVEL CK'ED GOOD. (R/H FLAP IS DROOPED, DO NOT MATCH R/H AILERON TO R/H FLAP).",c_49,flap
1183172,2019-05-04 19:07:00,2019-05-04 15:31:00,N754ND,2468.7,550.0,FLAP OVERSPEED @ 103 KTS.,2019-05-04,INSPECTED FLAPS & CONTROL RODS. NO DAMAGE NOTED. INSPECTED IAW PIPER ARCHER MM CH 05-50-00 & 27-50-00.,c_49,flap
1183522,2019-05-16 21:53:00,2019-05-16 16:02:00,N752ND,2744.3999999999996,550.0,OVERSPED FLAPS ON APPROACH @ 106 KIAS FOR 5 SECS.,2019-05-16,"PERFORMED FLAP OVERSPEED INSP IAW PMM 05-50-00, NO DEFECTS NOTED.",c_49,flap
1183528,2019-05-17 06:27:00,2019-05-17 15:42:00,N556ND,13472.3,550.0,WHEN APPROACHING CROOKSTON NOTICED FLAPS WERE @ 10*.,2019-05-17,"TIGHTENED FLAP HANDLE PIVOT, OPS CK GOOD. INSPECTED IAW CESSNA 05-50-00 PART B.",c_49,flap
1183560,2019-05-17 22:36:00,2019-05-17 15:45:00,N556ND,13496.9,2750.0,"FLAP INDICATOR STAYS @ 10* ON RETRACTION. OCCASSIONALLY GOING TO 10* WILL LEAVE FLAPS UP, EXPERIENCED 2-3 TIMES.",2019-05-17,"FOUND INDICATOR @ HANDLE STICKING, CLEANED & LUBED. VERIFIED INDICATOR TRAVELED CORRECTLY.",c_49,flap
1183583,2019-05-20 06:23:00,2019-05-20 14:52:00,N610ND,203.39999999999998,550.0,"FLAP OVERSPEED @ 104, TURNING BASE TO FINAL.",2019-05-20,"INSPECTED IAW PIPER MM FLAP OVERSPEED INSPECTION, NO DEFECTS NOTED.",c_49,flap
1183620,2019-05-20 13:21:00,2019-05-20 13:49:00,N579ND,9463.4,550.0,FLAP OVERSPEED.,2019-05-20,"INSPECTED FLAPS, NO DEFECTS FOUND. INSPECTED PER 05-50-00, PART 2, B(D)1.",c_49,flap
1183641,2019-05-20 19:10:00,2019-05-20 13:50:00,N754ND,2620.8,550.0,FLAP OVERSPEED BY +2 KNOTS ON TURN TO BASE @ GFK.,2019-05-20,"INSPECTED IAW PMM 05-50-00, NO DEFECTS NOTED.",c_49,flap
1183806,2019-05-27 10:29:00,2019-05-27 15:05:00,N755ND,2349.0,550.0,OVERSPED FLAPS @ 108 KTS.,2019-05-27,"INSPECTED IAW PIPER MM FLAP OVERSPEED CHECKLIST, NO DEFECTS NOTED.",c_49,flap
1183853,2019-05-28 13:35:00,2019-06-06 15:44:00,N770ND,6314.700000000001,2360.0,R/H FLAP STATIC WICK BAD.,2019-05-29,REMOVED & REPLACED STATIC WICK.,c_49,flap
1183922,2019-05-29 22:49:00,2019-05-29 15:25:00,N697ND,10075.3,550.0,"FLAP OVERSPEED, 113 KTS FOR 3 SECS.",2019-05-29,"PERFORMED FLAP OVERSPEED INSP IAW PIPER MM 05-50-00, NO DEFECTS NOTED.",c_49,flap
1184013,2019-06-02 13:29:00,2019-06-02 16:33:00,N741ND,3081.8999999999996,550.0,FLAP OVERSPEED FOR 5 SECONDS.,2019-06-02,"INSPECTED, NO DEFECTS FOUND.",c_49,flap
1184022,2019-06-03 06:11:00,2019-06-03 12:59:00,N793ND,7756.099999999999,2360.0,R/H FLAP STATIC WICK BROKEN.,2019-06-03,REMOVED & REPLACED W/ NEW STATIC WICK.,c_49,flap
1184090,2019-06-03 20:43:00,2019-06-03 16:45:00,N820ND,2407.5,550.0,FLAP OVERSPEED @ 109 KTS FOR 2-3 SECS.,2019-06-03,"PERFORMED FLAP OVERSPEED INSP IAW PIPER MM 05-50-00, NO DEFECTS NOTED.",c_49,flap
1184121,2019-06-04 15:11:00,2019-06-05 13:48:00,N695ND,9380.099999999999,2360.0,L/H FLAP STATIC WICK BROKEN.,2019-06-05,REMOVED & REPLACED W/ NEW.,c_49,flap
1184171,2019-06-05 21:54:00,2019-06-05 13:47:00,N794ND,2921.0,2360.0,STATIC WICK ON R/H FLAP IS BROKEN.,2019-06-05,REMOVED & REPLACED STATIC WICK.,c_49,flap
1184198,2019-06-06 13:32:00,2019-06-07 07:56:00,N680ND,15940.4,2360.0,L/H FLAP & R/H AILERON I/B STATIC WICKS ARE BROKEN.,2019-06-06,REMOVED & REPLACED WICKS.,c_49,flap
1184198,2019-06-06 13:32:00,2019-06-07 07:56:00,N680ND,15940.4,7600.0,BOTH COWL DOORS DON'T LATCH IN HANDLE UP POSITION.,2019-06-06,REMOVED & REPLACED L/H COWL FLAP LATCH LEVER. OPS CK GOOD.,c_49,flap
1184212,2019-06-06 21:30:00,2019-06-06 16:37:00,N770ND,6326.099999999999,550.0,FLAPS WERE OVERSPED BY 4 KTS FOR 5-6 SECONDS.,2019-06-06,C/W PIPER FLAP OVERSPEED CHECKLIST. NO DEFECTS NOTED.,c_49,flap
1184273,2019-06-10 10:29:00,2019-06-10 09:35:00,N792ND,5685.5,2360.0,L/H FLAP STATIC WICK BROKEN.,2019-06-10,REMOVED & REPLACED W/ NEW WICK.,c_49,flap
1184317,2019-06-11 12:00:00,2019-06-11 10:32:00,N794ND,2972.0,7110.0,LEFT COWL FLAP WOULD NOT STAY OPEN DURING FLIGHT.,2019-06-11,INSPECTED L/H COWL LEVER & FOUND LEVER LATCH SPRINGS DISCONNECTED. RECONTOURED SPRING & REINSTALLED. OPS CK GOOD.,c_49,flap
1184325,2019-06-11 15:12:00,2019-06-11 11:00:00,N792ND,5702.0,7600.0,"R/H COWL FLAP DOESN'T REMAIN OPEN, SAME FOR ALL SPEEDS.",2019-06-11,"ADJUSTED & RECONTOURED L/H & R/H COWL LATCH HANDLES, SPRINGS & BUSHINGS. LUBED PUSH ROD SLIDES, OPS CK'ED GOOD.",c_49,flap
1184570,2019-06-18 13:42:00,2019-06-18 13:08:00,N794ND,2972.0,7110.0,R/H ENGINE COWL FLAP DOESN'T MOVE.,2019-06-18,"LUBED COWL FLAP PUSH-PULL ROD, OPS CK GOOD.",c_49,flap
1184610,2019-06-19 13:47:00,2019-06-20 14:56:00,N783ND,7348.799999999999,2360.0,R/H FLAP STATIC WICK BROKEN.,2019-06-19,REMOVED & REPLACED W/ NEW STATIC WICK.,c_49,flap
1184630,2019-06-20 06:11:00,2019-06-20 16:17:00,N764ND,5376.299999999999,2360.0,STATIC WICK ON R/H FLAP IS BROKEN.,2019-06-20,REPLACED STATIC WICK.,c_49,flap
1184686,2019-06-21 06:20:00,2019-06-21 12:47:00,N705ND,3244.5,2360.0,STATIC WICK ON L/H FLAP BROKEN.,2019-06-21,REMOVED & REPLACED W/ NEW.,c_49,flap
1184828,2019-06-26 07:04:00,2019-06-26 15:17:00,N794ND,3056.5,7600.0,L/H COWL FLAP WOULD NOT REMAIN LOCKED/OPEN WHILE IN FLIGHT. WOULD OPEN LEFT COWL FLAP & IT WOULD REPEATEDLY CLOSE.,2019-06-26,"REPLACED L/H COWL FLAP LEVER & SPRING, CK'ED GOOD.",c_49,flap
1184848,2019-06-26 13:50:00,2019-06-26 15:18:00,N684ND,360.9,2360.0,R/H FLAP STATIC WICK BROKEN.,2019-06-26,REMOVED & REPLACED STATIC WICK.,c_49,flap
1184867,2019-06-27 06:04:00,2019-06-28 09:10:00,N781ND,7019.3,2360.0,BOTH FLAPS STATIC WICK ARE BROKEN.,2019-06-27,REMOVED & REPLACED W/ NEW.,c_49,flap
1184867,2019-06-27 06:04:00,2019-06-28 09:10:00,N781ND,7019.3,5500.0,CENTER PULLEYS & FLAP BAR NEED TO BE LUBED.,2019-06-27,LUBED PULLEYS & FLAP BAR.,c_49,flap
1184912,2019-06-28 06:02:00,2019-07-01 11:19:00,N793ND,8037.6,2360.0,L/H FLAP STATIC WICK BROKEN.,2019-06-28,INSTALLED NEW STATIC WICKS.,c_49,flap
1184980,2019-07-01 09:33:00,2019-07-01 14:05:00,N610ND,802.8000000000001,550.0,FLAP OVERSPEED @ 107 KTS IN PATTERN.,2019-07-01,"INSPECTED IAW PIPER MM FLAP OVERSPEED CHECKLIST, NO DEFECTS FOUND. NO FURTHER ACTION REQUIRED.",c_49,flap
1185013,2019-07-02 05:54:00,2019-07-02 10:37:00,N782ND,10509.6,5750.0,FLAP INDICATION RECORDING SYSTEM HAS 2 BROKEN TABS.,2019-07-02,"PARTS UNAVAILABLE, DISABLED SYSTEM BY UNPLUGGING CANNON PLUG. PLUG DEFERRED IAW 91.213D.",c_49,flap
1185033,2019-07-02 13:12:00,2019-07-11 10:44:00,N776ND,2892.3,2360.0,R/H FLAP STATIC WICK BROKEN.,2019-07-09,REPLACED STATIC WICK.,c_49,flap
1185046,2019-07-02 18:13:00,2019-07-02 13:10:00,N705ND,3352.7999999999997,550.0,FLAP OVERSPEED.,2019-07-02,C/W FLAP OVERSPEED CHECKLIST. NO DEFECTS NOTED.,c_49,flap
1185074,2019-07-03 14:13:00,2019-07-03 13:56:00,N684ND,467.70000000000005,550.0,"FLAP OVERSPEED, 105 KTS FOR 3 SECONDS.",2019-07-03,"PERFORMED FLAP OVERSPEED INSP IAW PIPER MM 05-50-00, NO DEFECTS NOTED.",c_49,flap
1185081,2019-07-03 16:34:00,2019-07-03 14:16:00,N751ND,5427.9,550.0,FLAP OVERSPEED BY 1 KNOT FOR 1-2 SECONDS.,2019-07-03,"INSPECTED IAW PIPER MM 05-50-00 FLAP OVERSPEED INSP, NO DEFECTS NOTED.",c_49,flap
1185107,2019-07-08 06:09:00,2019-07-08 15:44:00,N772ND,3071.7,3100.0,FLAPS UP POSITION INDICATION SENSOR NEEDS TO BE REPOSITIONED.,2019-07-08,"ADJUSTED SENSOR POSITION, OPS CK GOOD.",c_49,flap
1185289,2019-07-13 12:11:00,2019-07-15 13:03:00,N799ND,2232.0,580.0,MX FLIGHT REQUIRED FOR ROLL TENDENCIES W/ AUTOPILOT OFF.,2019-07-15,DROOPED R/H FLAP TO MAX ALLOWABLE. MAINTENANCE FLIGHT REQUIRED.,c_49,flap
1185322,2019-07-15 14:46:00,2019-07-15 14:00:00,N783ND,7653.799999999999,2360.0,L/H FLAP STATIC WICK BROKEN.,2019-07-15,INSTALLED NEW STATIC WICK.,c_49,flap
1185396,2019-07-17 13:13:00,2019-07-17 13:15:00,N781ND,7257.8,550.0,EXCEEDED VFE BY 10 KTS.,2019-07-17,"INSPECTED IAW PIPER MM FLAP OVERSPEED CHECKLIST, NO DEFECTS NOTED.",c_49,flap
1185413,2019-07-17 17:27:00,2019-07-17 13:16:00,N767ND,3022.8,550.0,"FLAP OVERSPEED 100 KTS, 10* FOR A FEW SECONDS.",2019-07-17,"INSPECTED IAW PIPER FLAP OVERSPEED CHECKLIST, NO DEFECTS NOTED.",c_49,flap
1185446,2019-07-18 13:41:00,2019-07-23 10:05:00,N817ND,2543.1000000000004,2360.0,R/H FLAP STATIC WICK BROKEN.,2019-07-18,INSTALLED NEW STATIC WICK.,c_49,flap
1185466,2019-07-19 06:19:00,2019-07-19 15:18:00,N768ND,5706.0,3100.0,FLAP INDICATING SYSTSEM NEEDS TO BE REINSTALLED.,2019-07-19,"INSTALLED FLAP POSITION SENSOR. TESTED SYSTEM, OPS CK GOOD.",c_49,flap
1185474,2019-07-19 08:41:00,2019-07-19 15:05:00,N714ND,5242.799999999999,3100.0,FLAP SWITCH ARM BROKEN.,2019-07-19,REMOVED & REPLACED ARM.,c_49,flap
1185504,2019-07-22 06:05:00,2019-07-30 15:21:00,N781ND,7328.8,2360.0,L/H & R/H FLAP STATIC WICKS BROKEN.,2019-07-22,REMOVED & REPLACED STATIC WICKS.,c_49,flap
1185505,2019-07-22 06:06:00,2019-07-22 13:21:00,N794ND,3342.5,2360.0,L/H FLAP STATIC WICK BROKEN.,2019-07-22,REMOVED & REPLACED W/ NEW STATIC WICK.,c_49,flap
1185625,2019-07-24 13:23:00,2019-07-25 10:12:00,N792ND,6041.0,2360.0,BOTH FLAP STATIC WICKS ARE BROKEN.,2019-07-24,REMOVED & REPLACED STATIC WICKS.,c_49,flap
1185832,2019-07-30 13:30:00,2019-07-30 14:49:00,N754ND,3507.6000000000004,550.0,FLAP OVERSPEED @ 110 KNOTS.,2019-07-30,"INSPECTED IAW CHECKLIST LOCATED IN PIPER MAINTENANCE MANUAL 5-50, NO DEFECTS NOTED.",c_49,flap
1185846,2019-07-31 06:04:00,2019-08-13 13:56:00,N526ND,17529.9,2750.0,DETENTS WORN ON FLAP INDICATOR SWITCH.,2019-07-31,REPROFILED DETENTS W/ A FILE. TRAVEL CK GOOD.,c_49,flap
1186646,2019-08-29 14:52:00,2019-08-29 10:57:00,N798ND,3012.0,7110.0,"L/H COWL FLAP SPRING POSSIBLY BROKEN, DOESN'T LOCK.",2019-08-29,"FOUND LATCH SPRING POPPED OFF LATCH, SECURED SPRING. OPS CK GOOD.",c_49,flap
1186784,2019-09-03 21:36:00,2019-09-03 14:36:00,N625ND,345.0,550.0,OVERSPED FLAPS. AIRSPEED @ 105.,2019-09-03,C/W PIPER MM 05-50-00 FLAP OVERSPEED CHECKLIST. NO DEFECTS NOTED.,c_49,flap
1186790,2019-09-04 05:58:00,2019-09-04 13:08:00,N794ND,3939.5,7110.0,R/H COWL FLAP WILL NOT LOCK IN CENTER POSITION.,2019-09-04,"REMOVED & REPLACED W/ NEW LOCK LATCH, OPS CK GOOD.",c_49,flap
1186798,2019-09-04 09:57:00,2019-09-04 14:23:00,N632ND,336.6,550.0,EXTENDED FLAPS ABOVE 102 & EXCEEDED VFE.,2019-09-04,"INSPECTED IAW PIPER MM FLAP OVERSPEED CHECKLIST, NO DEFECTS NOTED.",c_49,flap
1186829,2019-09-05 06:00:00,2019-09-05 15:31:00,N621ND,559.8,2750.0,LOOSE JAM NUT ON R/H FLAP CONTROL ROD (FWD END).,2019-09-05,TIGHTENED JAM NUT.,c_49,flap
1186831,2019-09-05 06:00:00,2019-09-05 12:40:00,N783ND,8548.8,2360.0,L/H FLAP STATIC WICK BROKEN.,2019-09-05,REPLACED W/ NEW.,c_49,flap
1186831,2019-09-05 06:00:00,2019-09-05 12:40:00,N783ND,8548.8,7110.0,L/H COWL FLAP LEVER DOES NOT LATCH.,2019-09-05,"ADJUSTED LOCK TAB, OPS CK GOOD.",c_49,flap
1186913,2019-09-06 22:15:00,2019-09-06 13:24:00,N794ND,3992.5,550.0,VFE WAS EXCEEDED @ 115 KNOTS W/ FLAPS 10* FOR ABOUT 8 SECS.,2019-09-06,"PERFORMED FLAP OVERSPEED INSP IAW PIPER MM 05-50-00, NO DEFECTS NOTED.",c_49,flap
1187028,2019-09-11 13:28:00,2019-09-11 13:10:00,N546ND,10584.5,2750.0,FLAP MOTOR COUPLING WORN.,2019-09-11,REMOVED & REPLACED COUPLING.,c_49,flap
1187085,2019-09-13 14:47:00,2019-09-13 14:42:00,N618ND,1415.1,2360.0,R/H FLAP STATIC WICK BROKEN.,2019-09-13,REMOVED & REPLACED STATIC WICK W/ NEW.,c_49,flap
1187085,2019-09-13 14:47:00,2019-09-13 14:42:00,N618ND,1415.1,550.0,FLAP OVERSPEED.,2019-09-13,INSPECTED IAW FLAP OVERSPEED INSPECTION FOUND IN PIPER MM SEC 05-50-00. NO DEFECTS NOTED.,c_49,flap
1187189,2019-09-16 21:33:00,2019-09-16 14:21:00,N697ND,11252.8,7900.0,"SIGNIFICANT OIL LEAK, OIL IS LEAKING OUT OF COWLING & SLICK REACHES ALL THE WAY BACK TO FLAP ON COPILOT SIDE.",2019-09-16,"CLEANED A/C, PERFORMED GROUND RUN, LEAK CK'ED GOOD.",c_49,flap
1187192,2019-09-17 06:23:00,2019-09-17 14:22:00,N799ND,3258.5,2360.0,R/H FLAP STATIC WICK BROKEN.,2019-09-17,REPLACED W/ NEW STATIC WICK.,c_49,flap
1187207,2019-09-17 11:40:00,2019-09-17 13:47:00,N621ND,633.3,550.0,FLAP OVERSPEED 113 KTS @ 10*.,2019-09-17,"INSPECTED, NO DEFECTS FOUND.",c_49,flap
1187311,2019-09-19 13:52:00,2019-09-27 13:30:00,N680ND,17111.9,2360.0,L/H & R/H FLAP STATIC WICKS ARE BROKEN.,2019-09-19,REPLACED STATIC WICKS.,c_49,flap
1187374,2019-09-21 10:47:00,2019-09-23 00:00:00,N653ND,10150.0,5310.0,CRACKS IN L/H FLAP COVE TRAILING EDGE RIVETS,2019-09-23,STOP DRILLED CRACKS,c_49,flap
1187434,2019-09-23 19:04:00,2019-09-23 13:20:00,N622ND,535.8,550.0,"FLAP OVERSPEED ON DOWNWIND, FLAPS WERE EXTENDED TO 10* W/ AIRSPEED 3 KTS ABOVE LIMITS.",2019-09-23,"PERFORMED FLAP OVERSPEED INSP IAW PIPER MM 05-50-00, NO DEFECTS NOTED.",c_49,flap
1187439,2019-09-24 05:58:00,2019-09-25 13:11:00,N781ND,8165.8,2360.0,L/H FLAP STATIC WICK BROKEN.,2019-09-24,REPLACED W/ NEW.,c_49,flap
1187471,2019-09-24 18:46:00,2019-09-24 14:45:00,N783ND,8624.800000000001,550.0,FLAP OVERSPEED.,2019-09-24,"PERFORMED FLAP OVERSPEED INSP IAW PIPER MAINTENANCE MANUAL 05-50-00, NO DEFECTS NOTED.",c_49,flap
1187589,2019-09-27 19:12:00,2019-09-27 14:39:00,N631ND,763.2,550.0,TEMPORARY FLAPS OVERSPEED @ 108-111 KNOTS.,2019-09-27,"PERFORMED FLAP OVERSPEED INSP IAW PMM 05-50-00, NO DEFECTS NOTED.",c_49,flap
1187591,2019-09-27 20:19:00,2019-09-27 14:40:00,N842ND,490.0,550.0,FLAP OVERSPEED BY 1 KT.,2019-09-27,"PERFORMED FLAP OVERSPEED INSP IAW PMM 05-50-00, NO DEFECTS NOTED.",c_49,flap
1188144,2019-10-18 20:51:00,2019-10-18 10:49:00,N842ND,640.0,550.0,FLAP OVERSPEED 114 KTS 25*.,2019-10-18,"INSPECTED FLAPS, NO DEFECTS FOUND.",c_49,flap
1188176,2019-10-21 06:01:00,2019-10-21 11:03:00,N695ND,12326.8,2360.0,L/H FLAP STATIC WICK BROKEN.,2019-10-21,REMOVED & REPLACED W/ NEW STATIC WICK.,c_49,flap
1188176,2019-10-21 06:01:00,2019-10-21 11:03:00,N695ND,12326.8,7110.0,COWL FLAP LEVERS DON'T FULLY LOCK.,2019-10-21,"TIGHTENED PIVOT BOLT, OPS CK GOOD.",c_49,flap
1188778,2019-11-08 05:50:00,2019-11-08 15:25:00,N648ND,1090.1999999999998,2360.0,R/H FLAP & I/B AILERON STATIC WICKS BROKEN.,2019-11-08,REPLACED BOTH W/ NEW.,c_49,flap
1188855,2019-11-12 05:52:00,2019-11-12 16:00:00,N703ND,3825.4,2360.0,R/H I/B AILERON & FLAP STATIC WICKS BROKEN.,2019-11-12,REPLACED BOTH W/ NEW STATIC WICKS.,c_49,flap
1188912,2019-11-13 05:26:00,2019-11-13 15:12:00,N711ND,6861.900000000001,2360.0,R/H FLAP STATIC WICK BROKEN.,2019-11-13,REMOVED & REPLACED W/ NEW STATIC WICK.,c_49,flap
1188945,2019-11-13 15:39:00,2019-11-13 15:08:00,N773ND,3783.2999999999997,550.0,FLAP OVERSPEED 109 KTS MAX LESS THAN 10 SECONDS.,2019-11-13,"INSPECTED IAW PIPER MM FLAP OVERSPEED CHECKLIST, NO DEFECTS NOTED.",c_49,flap
1188952,2019-11-13 18:03:00,2019-11-14 15:20:00,N755ND,3973.5,2360.0,L/H FLAP STATIC WICK BROKEN.,2019-11-14,REMOVED & REPLACED STATIC WICK W/ NEW.,c_49,flap
1189018,2019-11-16 11:46:00,2019-11-16 13:25:00,N772ND,4265.1,550.0,"WHILE ON DOWNWIND, FLAPS ADDED TO 10* ABOVE 102 KTS.",2019-11-16,"C/W FLAP OVERSPEED INSP, NO DEFECTS NOTED.",c_49,flap
1189096,2019-11-20 06:25:00,2019-11-20 11:09:00,N823ND,1247.4,2360.0,L/H FLAP STATIC WICK BROKEN.,2019-11-20,REMOVED & REPLACED STATIC WICK.,c_49,flap
1189097,2019-11-20 07:23:00,2019-11-20 10:42:00,N649ND,1207.8000000000002,550.0,OVERSPED FLAPS @ 104 KNOTS FOR APPROXIMATELY 3 SECS.,2019-11-20,"PERFORMED FLAP OVERSPEED IAW PIPER MM 05-50-00, NO DEFECTS NOTED.",c_49,flap
