workorder,date_time_opened,date_time_closed,registration,total_time,ata_code,problem,date,action,cluster,cluster_name
1234443,2024-09-25 06:22:00,2024-10-17 14:24:00,N794ND,26548.600000000002,5510.0,On run up found that none of the flap indicators worked,2024-10-02 13:11:00,Adjusted flap compensator potentiometer and tightened and loctited set screws holding the arm on the potentiometer shaft.,c_49,flap
1234443,2024-09-25 06:22:00,2024-10-17 14:24:00,N794ND,26548.600000000002,5510.0,On run up found that none of the flap indicators worked,2024-10-02 14:32:00,Performed flap position calibration. Ops and travel check good,c_49,flap
1234444,2024-09-25 06:24:00,2024-10-17 14:09:00,N847ND,17999.2,7610.0,Cowl flap levers loose,2024-09-25 13:32:00,Installed new washer onto cowl flap levers bolt.,c_49,flap
1234506,2024-09-26 11:45:00,2024-10-18 09:55:00,N877ND,24094.6,3200.0,During config demo we did not get the non-mutiple aural alert for the check gear with the flaps 25 and 40 degrees with the gear up. Did receive mutable check gear.,2024-09-26 14:24:00,Adjusted microswitch on flap torque tube. Ops check good.,c_49,flap
1234699,2024-10-03 07:30:00,2024-10-25 13:21:00,N796ND,22769.7,2360.0,Both RH and LH flap static wicks broken,2024-10-07 20:59:00,Removed and replaced RH and LH flap static wicks with new,c_49,flap
1234699,2024-10-03 07:30:00,2024-10-25 13:21:00,N796ND,22769.7,2750.0,Flap handle sticky/binding on last notch of flap extension,2024-10-07 21:10:00,Lubed flap handle notched and detent,c_49,flap
1234720,2024-10-03 16:14:00,2024-10-21 14:44:00,N725ND,4740.0,590.0,Flap overspeed at 102 KIAS,2024-10-03 16:15:00,Inspected IAW Piper MM flap overspeed inspection checklist. No defects noted. See attached checklist.,c_49,flap
1234748,2024-10-04 10:24:00,2024-10-21 14:51:00,N641ND,10331.099999999999,1130.0,Flap placard has been covered with tape.,2024-10-04 13:56:00,Removed tape.,c_49,flap
1234748,2024-10-04 10:24:00,2024-10-21 14:51:00,N641ND,10331.099999999999,5510.0,Zip tie placed on L/H flap rail to simulate FOD.,2024-10-04 14:07:00,Removed zip tie from L/H flap rail.,c_49,flap
1234748,2024-10-04 10:24:00,2024-10-21 14:51:00,N641ND,10331.099999999999,5510.0,L/H flap push/pull rod jam nut has been loosened.,2024-10-04 14:07:00,Tightened L/H flap push/pull rod jam nut.,c_49,flap
1234755,2024-10-04 12:41:00,2024-10-21 14:54:00,N797ND,17921.2,3140.0,"during stall training with flaps 40 degrees stall horn would come on consistantly 2-3 knots after reaching full stall. stalls at flaps 25,10,0 worked as expected.",2024-10-04 13:32:00,"cleaned flap switches, ops check good on ground. MX flight required. see UND WO# 1234756",c_49,flap
1234756,2024-10-04 13:34:00,2024-10-21 14:54:00,N797ND,17921.2,580.0,MX flight required for stall operation at all flap postions,2024-10-04 15:46:00,Performed Mx flight and found stall horn coming on too late.,c_49,flap
1234807,2024-10-07 06:31:00,2024-10-22 14:06:00,N725ND,4748.4,1130.0,Flap lever placard needs to be replaced,2024-10-07 14:23:00,Fabricated new flap lever placard and installed,c_49,flap
1234889,2024-10-09 06:27:00,2024-10-22 14:47:00,N877ND,24302.1,2360.0,RH Flap static wick broken,2024-10-09 11:44:00,"Removed RH flap static wick, screw broke upon removal. Extracted screw and replaced RH flap static wick",c_49,flap
1234889,2024-10-09 06:27:00,2024-10-22 14:47:00,N877ND,24302.1,2360.0,RH Flap static wick broken,2024-10-09 12:11:00,Accepted,c_49,flap
1234890,2024-10-09 06:32:00,2024-10-22 14:49:00,N381ND,3401.1000000000004,5750.0,RH FLAP AFT ROD END BOLT LOOSE,2024-10-09 12:55:00,TIGHTENED AND SAFETIED RH FLAP AFT ROD END BOLT,c_49,flap
1234901,2024-10-09 11:02:00,2024-10-22 15:03:00,N309ND,168.60000000000002,590.0,"In pattern in Grand Forks, had 10deg. of flaps in and forgot to retract. Oversped flaps.",2024-10-09 11:02:00,"Performed flap overspeed inspection IAW PMM 05-50-00, no defects noted.",c_49,flap
1234970,2024-10-10 15:09:00,2024-10-23 14:38:00,N327ND,3626.1000000000004,1130.0,Flap handle placard damaged,2024-10-10 18:54:00,"Removed damaged flap handle placard, fabricated and installed a new one",c_49,flap
1235022,2024-10-13 09:24:00,2024-10-24 11:34:00,N895ND,14951.2,3230.0,On post flight noticed LH wing flap covered in dark black oil.,2024-10-13 15:04:00,"Removed and replaced LH MLG oleo strut o-rings and wiper strip, serviced with 5606 and nitrogen to spec. Leak check good.",c_49,flap
1235162,2024-10-17 06:21:00,2024-11-05 15:24:00,N847ND,18374.2,2360.0,L/H and R/H Flap Static Wicks Are Broken,2024-10-17 13:05:00,Removed and replaced L/H and R/H flap static wick with new.,c_49,flap
1235163,2024-10-17 06:31:00,2024-10-28 10:27:00,N506ND,248.70000000000002,2750.0,Flap position switch needs to be adjusted,2024-10-17 14:25:00,Adjusted flap position switch. Ops check good,c_49,flap
1235163,2024-10-17 06:31:00,2024-10-28 10:27:00,N506ND,248.70000000000002,2750.0,Flap position switch needs to be adjusted,2024-10-18 12:17:00,Accepted,c_49,flap
1235232,2024-10-21 09:37:00,2024-10-25 10:43:00,N892ND,5667.0,2360.0,LH flap static wick broken,2024-10-22 08:12:00,removed and replaced LH flap static wick with new,c_49,flap
1235268,2024-10-21 18:01:00,2024-10-25 10:49:00,N797ND,18150.7,7110.0,COWL FLAP WILL NOT STAY OPEN.,2024-10-21 18:51:00,ADJUSTED INTERIOR LH ENGINE COWL FLAP CONTROL. ADJUSTED RH ENGINE LOWER OUTSIDE COWL FLAP ROD END. OPS AND TRAVEL CHECK GOOD.,c_49,flap
1235268,2024-10-21 18:01:00,2024-10-25 10:49:00,N797ND,18150.7,7110.0,COWL FLAP WILL NOT STAY OPEN.,2024-10-21 20:04:00,Accepted,c_49,flap
1235313,2024-10-23 06:23:00,2024-12-05 15:41:00,N798ND,26354.899999999998,2360.0,R/H FLAP STATIC WICK BROKEN,2024-10-23 14:45:00,REMOVED AND REPLACED R/H FLAP STATIC WICK WITH NEW,c_49,flap
1235313,2024-10-23 06:23:00,2024-12-05 15:41:00,N798ND,26354.899999999998,7110.0,R/H ENGINE LOWER COWL CRACK IB OF COWL FLAP DOOR,2024-10-25 23:42:00,"Started RH lower cowl crack repair. Cut new interal doubler to size. Fabricated exteral skin patch from 2024-T3 .032"" aluminum. Fitted and drill both of those to the cowl",c_49,flap
1235313,2024-10-23 06:23:00,2024-12-05 15:41:00,N798ND,26354.899999999998,7110.0,R/H ENGINE LOWER COWL CRACK IB OF COWL FLAP DOOR,2024-10-28 23:27:00,Continued cowl repair,c_49,flap
1235313,2024-10-23 06:23:00,2024-12-05 15:41:00,N798ND,26354.899999999998,7110.0,R/H ENGINE LOWER COWL CRACK IB OF COWL FLAP DOOR,2024-10-29 23:23:00,Assisted,c_49,flap
1235313,2024-10-23 06:23:00,2024-12-05 15:41:00,N798ND,26354.899999999998,7110.0,R/H ENGINE LOWER COWL CRACK IB OF COWL FLAP DOOR,2024-10-29 23:43:00,Installed external skin patch and internal doubler. Riveted IAW AC43.13-1B Chpt 4 sect 4-57,c_49,flap
1235374,2024-10-24 12:15:00,2024-10-25 13:41:00,N797ND,18170.2,7110.0,LH cowl flap will not stay open.,2024-10-24 13:30:00,Removed and replaced LH cowl flap lock lever with new. Ops check good.,c_49,flap
1235374,2024-10-24 12:15:00,2024-10-25 13:41:00,N797ND,18170.2,7110.0,LH cowl flap will not stay open.,2024-10-24 13:54:00,Assisted and Accepted,c_49,flap
1235384,2024-10-24 14:53:00,2024-11-05 16:02:00,N359ND,3618.6000000000004,2360.0,Left Flap Static Wick Damaged,2024-10-24 21:09:00,Removed and Replaced Left flap static wick with new.,c_49,flap
1235384,2024-10-24 14:53:00,2024-11-05 16:02:00,N359ND,3618.6000000000004,2360.0,Left Flap Static Wick Damaged,2024-10-24 21:11:00,Accepted,c_49,flap
1235470,2024-10-28 06:20:00,2024-11-07 11:01:00,N780ND,17156.0,2360.0,LH flap static wick broken,2024-10-28 13:14:00,Removed and Replaced L/H Flap Static Wick,c_49,flap
1235470,2024-10-28 06:20:00,2024-11-07 11:01:00,N780ND,17156.0,7110.0,R/H Cowl Flap Lever Won't Lock,2024-10-29 14:19:00,Removed and replaced RH cowl flap latch and spring with new.,c_49,flap
1235470,2024-10-28 06:20:00,2024-11-07 11:01:00,N780ND,17156.0,7110.0,R/H Cowl Flap Lever Won't Lock,2024-11-01 12:18:00,"Reinstalled and Safetied Clevis Pin ,Reinstalled Interior Cosmetic Cover",c_49,flap
1235514,2024-10-29 06:30:00,2024-11-06 11:16:00,N305ND,3336.7,2360.0,RH flap static wick missing.,2024-10-29 10:14:00,REMOVED AND REPLACED R/H FLAP STATIC WICK WITH NEW,c_49,flap
1235569,2024-10-30 06:23:00,2024-11-12 14:38:00,N641ND,10401.9,5700.0,WING SKIN UNDER FLAPS NEAR WING ROOT HAS CRACKS ON BOTH L/H AND R/H,2024-10-30 23:24:00,Removed left and right flaps for access.,c_49,flap
1235569,2024-10-30 06:23:00,2024-11-12 14:38:00,N641ND,10401.9,5700.0,WING SKIN UNDER FLAPS NEAR WING ROOT HAS CRACKS ON BOTH L/H AND R/H,2024-10-30 23:46:00,Removed damaged portion of RH flap skin.,c_49,flap
1235569,2024-10-30 06:23:00,2024-11-12 14:38:00,N641ND,10401.9,5700.0,WING SKIN UNDER FLAPS NEAR WING ROOT HAS CRACKS ON BOTH L/H AND R/H,2024-10-30 23:47:00,"Started repair of LH flap skin. Removed damaged portion of skin. Fabricated doubler from 2024 T3 0.025"" aluminum",c_49,flap
1235569,2024-10-30 06:23:00,2024-11-12 14:38:00,N641ND,10401.9,5700.0,WING SKIN UNDER FLAPS NEAR WING ROOT HAS CRACKS ON BOTH L/H AND R/H,2024-10-31 23:14:00,"Fabricated doubler from 2024 T-3 .025"" aluminum and riveted to repair area of RH flap skin IAW SRM 51-40-00.",c_49,flap
1235569,2024-10-30 06:23:00,2024-11-12 14:38:00,N641ND,10401.9,5700.0,WING SKIN UNDER FLAPS NEAR WING ROOT HAS CRACKS ON BOTH L/H AND R/H,2024-10-31 23:26:00,Completed repair of LH flap skin IAW SRM 51-40-00,c_49,flap
1235569,2024-10-30 06:23:00,2024-11-12 14:38:00,N641ND,10401.9,5700.0,WING SKIN UNDER FLAPS NEAR WING ROOT HAS CRACKS ON BOTH L/H AND R/H,2024-11-01 23:54:00,Reinstalled flaps. Ops check good,c_49,flap
1235587,2024-10-30 12:16:00,2024-11-06 14:12:00,N725ND,5110.5,590.0,Flap overspeed. Flaps were pulled to 10 degree 103 KTS for 1 second,2024-10-30 12:49:00,Inspected A/C IAW Piper MM flap overspeed checklist. No defects noted,c_49,flap
1235605,2024-10-30 17:08:00,2024-11-04 10:22:00,N785ND,13491.4,550.0,Flap overspeed.,2024-10-30 17:30:00,Inspected aircraft per flap overspeed. REF M.M. CH 05-50 and CH 27-50. No defects noted.,c_49,flap
1235697,2024-11-01 17:33:00,2024-11-07 13:44:00,N309ND,426.29999999999995,590.0,Potential flap overspeed at 4v4 in the downwind. Flaps unintentionally forgot to be removed after soft field take off.,2024-11-01 17:34:00,Performed flap overspeed inspection IAW PMM 05-50-00. No defects noted,c_49,flap
1235698,2024-11-01 17:43:00,2024-11-07 13:45:00,N388ND,3003.3,590.0,"Entering a base, noticed airspeed was high. Took out power and added flaps at 107kts.",2024-11-01 17:44:00,Performed flap overspeed inspection IAW PMM 05-50-00. No defects noted,c_49,flap
1235749,2024-11-05 06:28:00,2024-11-14 14:29:00,N794ND,26918.600000000002,2360.0,rh flap static wick damaged,2024-11-05 10:00:00,Removed and Replaced static wick,c_49,flap
1235786,2024-11-05 16:43:00,2024-11-11 10:03:00,N793ND,15191.9,550.0,Flap overspeed at 114kts.,2024-11-05 16:45:00,"Inspected flaps and flap torque tube/pushrods in reference with Piper PA-44-180 MM 05-50-00, paragraph 4, and 27-50-00, paragraph 4.",c_49,flap
1235831,2024-11-07 10:05:00,2024-11-18 15:13:00,N799ND,23378.8,580.0,MX flight required after installation of new aileron. See WO 1235804,2024-11-15 13:02:00,Drooped R/H flap to full amount. Found both witness holes to be covered. Mx flight required to check for R/H rollling.See Wko#1236041,c_49,flap
1235868,2024-11-07 21:10:00,2024-11-12 14:21:00,N307ND,5871.9,590.0,Flap overspeed on approach 106kts flaps 25deg. 5 seconds.,2024-11-07 21:13:00,"Performed flap overspeed insp. IAW PMM 05-50-00, no defects noted.",c_49,flap
1235915,2024-11-11 06:04:00,2024-11-19 14:25:00,N797ND,18481.7,2360.0,LH Flap missing static wick.,2024-11-11 12:08:00,Removed and replaced LH flap static wick with new.,c_49,flap
1235915,2024-11-11 06:04:00,2024-11-19 14:25:00,N797ND,18481.7,2360.0,LH Flap missing static wick.,2024-11-11 13:08:00,ACCEPTED,c_49,flap
1235920,2024-11-11 06:35:00,2024-11-14 15:01:00,N359ND,3835.2000000000003,2360.0,R/H FLAP STATIC WICK BROKEN,2024-11-11 13:47:00,Removed and replaced R/H flap static wick with new,c_49,flap
1235953,2024-11-12 14:55:00,2024-11-19 14:31:00,N842ND,15079.7,2360.0,RH flap static wick broken.,2024-11-12 17:39:00,Removed and Replaced RH Flap static wick with new.,c_49,flap
1235953,2024-11-12 14:55:00,2024-11-19 14:31:00,N842ND,15079.7,2360.0,LH flap static wick broken.,2024-11-12 17:40:00,Removed and Replaced LH flap static wick with new.,c_49,flap
1235953,2024-11-12 14:55:00,2024-11-19 14:31:00,N842ND,15079.7,2360.0,LH flap static wick broken.,2024-11-12 18:02:00,Approved,c_49,flap
1235953,2024-11-12 14:55:00,2024-11-19 14:31:00,N842ND,15079.7,2360.0,RH flap static wick broken.,2024-11-12 18:02:00,Approved,c_49,flap
1235953,2024-11-12 14:55:00,2024-11-19 14:31:00,N842ND,15079.7,2750.0,RH flap pushrod aft attachment screw is loose,2024-11-12 20:51:00,Tightened and resecured RH flap pushrod aft attachment screw.,c_49,flap
1235953,2024-11-12 14:55:00,2024-11-19 14:31:00,N842ND,15079.7,2750.0,RH flap pushrod aft attachment screw is loose,2024-11-12 22:37:00,Approved,c_49,flap
1236014,2024-11-14 14:53:00,2024-11-22 10:33:00,N333ND,420.29999999999995,2360.0,RH Flap Static Wick Damaged,2024-11-14 18:13:00,Removed and replaced RH Flap Static Wick.,c_49,flap
1236014,2024-11-14 14:53:00,2024-11-22 10:33:00,N333ND,420.29999999999995,2360.0,RH Flap Static Wick Damaged,2024-11-14 18:29:00,Accepted,c_49,flap
1236065,2024-11-17 08:20:00,2024-11-19 14:43:00,N327ND,4028.1000000000004,2360.0,R/H FLAP STATIC WICK BROKE,2024-11-17 17:05:00,REMOVED AND REPLACED R/H FLAP STATIC WICK,c_49,flap
1236065,2024-11-17 08:20:00,2024-11-19 14:43:00,N327ND,4028.1000000000004,2750.0,BOTH FLAP ROD END BOLTS NEED TO BE TIGHTENED,2024-11-18 09:44:00,Tightened left and right flap FWD and Aft rod end attachment bolts and secured.,c_49,flap
1236065,2024-11-17 08:20:00,2024-11-19 14:43:00,N327ND,4028.1000000000004,2750.0,BOTH FLAP ROD END BOLTS NEED TO BE TIGHTENED,2024-11-18 10:00:00,ASSISTED,c_49,flap
1236127,2024-11-18 21:03:00,2024-11-19 16:06:00,N323ND,3828.5,590.0,Flap overspeed @ 103 for 2 seconds,2024-11-18 21:31:00,Inspected flap system IAW Piper PA28-181 MM 05-50-00.  No defects noted.,c_49,flap
1236153,2024-11-19 15:04:00,2024-11-22 09:05:00,N688ND,26932.3,550.0,Flap overspeed at 112kts.,2024-11-19 15:07:00,"Inspected flaps and flap torque tube/pushrods IAW Piper PA-44-180 MM 05-50-00, paragraph 4, and 27-50-00, paragraph 4.",c_49,flap
1236153,2024-11-19 15:04:00,2024-11-22 09:05:00,N688ND,26932.3,550.0,Flap overspeed at 112kts.,2024-11-19 15:08:00,Assisted,c_49,flap
1236301,2024-11-26 06:31:00,2024-12-05 15:58:00,N305ND,3532.9,2360.0,R/H flap static wick worn,2024-11-26 12:59:00,Removed and replaced R/H flap static wick with new,c_49,flap
1236394,2024-12-02 14:43:00,2024-12-23 13:32:00,N877ND,24963.1,2510.0,cowl flap lever console cracked,2024-12-03 20:22:00,STOP DRILLED CRACK IN COWL FLAP LEVER CONSOLE,c_49,flap
1236452,2024-12-04 07:57:00,2024-12-12 10:26:00,N307ND,6048.6,2750.0,BOTH L/H AND R/H FLAP FWD AND AFT ROD ENDS NEED TO BE TIGHTENED,2024-12-05 09:40:00,"TIGHTENED BOTH L/H AND R/H FLAP FWD AND AFT ROD ENDS, SAFETIED",c_49,flap
1236496,2024-12-05 13:33:00,2024-12-10 12:39:00,N688ND,27098.8,550.0,Flap overspeed.,2024-12-05 13:35:00,"Inspected flaps and flap torque tube/pushrods IAW Piper PA-44-180 MM 05-50-00, paragraph 4, and 27-50-00, paragraph 4.",c_49,flap
1236517,2024-12-05 19:17:00,2024-12-12 10:38:00,N725ND,5382.6,5750.0,"DURING PREFLIGHT WHEN ATTEMPTING TO BRING FLAPS, THE HANDLE LOWERED BUT THE FLAPS STAYED DOWN.",2024-12-05 19:53:00,LUBED FLAPS. OPS CHECK GOOD.,c_49,flap
1236686,2024-12-12 08:28:00,2024-12-16 14:32:00,N689ND,19212.399999999998,550.0,"Static wick missing on L/H wing, inboard on flap.",2024-12-12 08:30:00,"Installed new static wick on L/H wing, inboard on the flap.",c_49,flap
1236736,2024-12-13 12:29:00,2024-12-16 10:16:00,N320ND,5454.299999999999,590.0,Base got low level wind sheer. Got to 103 Kts for one second,2024-12-13 12:31:00,Inspected IAW flap overspeed checklist. No defects noted. See attached checklist,c_49,flap
1236745,2024-12-13 15:41:00,2024-12-31 13:36:00,N796ND,23418.2,7110.0,Pilot states right cowl flap would not stay locked in up position.,2024-12-13 16:45:00,Lubed LH and RH cowl flap levers. Ops check good.,c_49,flap
1236762,2024-12-16 06:44:00,2024-12-23 14:31:00,N646ND,11760.0,2360.0,Left flap static wick is broken.,2024-12-16 09:49:00,Installed new static wick on left flap.,c_49,flap
1236799,2024-12-17 09:27:00,2024-12-24 09:31:00,N662ND,12945.8,2360.0,R/H flap static wick broken,2024-12-17 13:42:00,Replaced R/H flap static wick with new.,c_49,flap
1236813,2024-12-17 19:02:00,2024-12-24 10:11:00,N785ND,13900.900000000001,2750.0,Flaps indicating incorrectly,2024-12-18 08:21:00,Adjusted Flap position indication sending unit to correct indication,c_49,flap
1236813,2024-12-17 19:02:00,2024-12-24 10:11:00,N785ND,13900.900000000001,2360.0,R/H flap static wick missing.,2024-12-19 06:04:00,Replaced R/H flap static wick with new.,c_49,flap
1236849,2024-12-18 18:03:00,2024-12-24 09:57:00,N823ND,14911.0,2360.0,L/H flap static wick missing.,2024-12-19 06:11:00,Replaced static wick on L/H flap.,c_49,flap
1236849,2024-12-18 18:03:00,2024-12-24 09:57:00,N823ND,14911.0,2750.0,Flap lever placard missing,2024-12-19 13:29:00,Replaced flap lever placard with new.,c_49,flap
1236853,2024-12-19 08:05:00,2025-01-14 13:27:00,N797ND,18797.199999999997,2360.0,L/H and R/H Flap Static Wicks Broken,2024-12-19 14:46:00,REMOVED AND REPLACED L/H AND R/H FLAP STATIC WICKS WITH NEW.,c_49,flap
1236853,2024-12-19 08:05:00,2025-01-14 13:27:00,N797ND,18797.199999999997,7220.0,L/H Engine cowl flap does not lock properly,2024-12-20 12:40:00,REMOVED AND REPLACED L/H COWL FLAP LEVER WITH NEW. OPS CHECK GOOD.,c_49,flap
1236858,2024-12-19 10:32:00,2024-12-23 14:27:00,N609ND,15459.2,1130.0,Flap lever placard missing,2024-12-20 06:39:00,Installed new flap lever placard to flap handle.,c_49,flap
1236920,2024-12-21 14:58:00,2024-12-24 09:51:00,N729ND,11683.8,550.0,Flap overspeed.,2024-12-21 15:00:00,"Inspected flaps and flap torque tube/pushrods IAW Piper PA-28-181 MM 05-50-00, paragraph 4, and 27-50-00, paragraph 2.",c_49,flap
1236921,2024-12-21 15:06:00,2024-12-24 10:10:00,N753ND,13547.1,550.0,Flap overspeed.,2024-12-21 15:08:00,"Inspected flaps and flap torque tube/pushrods IAW Piper PA-28-181 MM 05-50-00, paragraph 4, and 27-50-00, paragraph 2.",c_49,flap
1237211,2025-01-12 11:44:00,2025-01-13 13:23:00,N663ND,15513.7,550.0,Flap overspeed.,2025-01-12 11:45:00,"Inspected flaps and flap torque tube/pushrods IAW Piper PA-28-181 MM 05-50-00, paragraph 4, and 27-50-00, paragraph 2.",c_49,flap
1237230,2025-01-13 16:16:00,2025-01-14 09:34:00,N684ND,11881.3,550.0,Flap overspeed at 10 degrees flaps at 105kts.,2025-01-13 16:18:00,"Inspected flaps and flap torque tube/pushrods in reference with Piper PA-28-181 MM 05-50-00, paragraph 4, and 27-50-00, paragraph 2.",c_49,flap
1237273,2025-01-14 17:20:00,2025-01-17 10:07:00,N607ND,19768.9,550.0,Flap overspeed,2025-01-14 17:21:00,"Inspected flaps and flap torque tube/pushrods IAW Piper PA-28-181 MM 05-50-00, paragraph 4, and 27-50-00, paragraph 2.",c_49,flap
1237355,2025-01-17 06:26:00,2025-01-17 14:13:00,N780ND,17601.0,3140.0,"during stall practice, we got no stall warning horn. did a full stall with flaps and achieved a full stall with nose drop but no warning horn. also did a stall with no flaps and never got a warning. during post flight both tabs moved freely as they should.",2025-01-17 06:29:00,"cleaned stall warning switches, ops check good on ground. MX flight required, see UND WO# 1237356",c_49,flap
1237380,2025-01-20 06:26:00,2025-01-28 13:58:00,N799ND,23728.8,2360.0,L/H Flap Static Wick Broken,2025-01-20 16:01:00,Removed and replaced LH Flap Static Wick.,c_49,flap
1237380,2025-01-20 06:26:00,2025-01-28 13:58:00,N799ND,23728.8,2360.0,L/H Flap Static Wick Broken,2025-01-20 16:15:00,ACCEPTED,c_49,flap
1237380,2025-01-20 06:26:00,2025-01-28 13:58:00,N799ND,23728.8,7110.0,R/H Cowl Flap Control Won't Lock,2025-01-21 09:44:00,"Repositioned RH cowl flap control locking tab, ops check good",c_49,flap
1237412,2025-01-21 17:35:00,2025-01-22 13:50:00,N729ND,11902.2,550.0,Flap overspeed 103kts.,2025-01-21 17:37:00,"Inspected flaps and flap torque tube/pushrods in reference with Piper PA-28-181 MM 05-50-00, paragraph 4, and 27-50-00, paragraph 2.",c_49,flap
1237425,2025-01-22 15:51:00,2025-01-30 12:20:00,N833ND,14615.4,550.0,Flap overspeed,2025-01-27 10:24:00,"Inspected flaps and flap torque tube/pushrods IAW Piper PA-28-181 MM 05-50-00, paragraph 4, and 27-50-00, paragraph 2.",c_49,flap
1237425,2025-01-22 15:51:00,2025-01-30 12:20:00,N833ND,14615.4,550.0,Flap overspeed,2025-01-27 10:27:00,Assisted,c_49,flap
1237425,2025-01-22 15:51:00,2025-01-30 12:20:00,N833ND,14615.4,550.0,Flap overspeed,2025-01-27 10:28:00,Approved,c_49,flap
1237431,2025-01-23 06:23:00,2025-01-31 11:18:00,N798ND,27009.899999999998,7160.0,LH cowl flap door not locking in any position.,2025-01-23 14:42:00,Removed and replaced LH cowl flap lever with new. Ops check good.,c_49,flap
1237431,2025-01-23 06:23:00,2025-01-31 11:18:00,N798ND,27009.899999999998,7160.0,LH cowl flap door not locking in any position.,2025-01-23 14:50:00,Accepted,c_49,flap
1237433,2025-01-23 08:56:00,2025-01-23 14:18:00,N780ND,17615.5,580.0,Mx flight required to check stall warning system,2025-01-23 09:23:00,"On the first 0 degree flap stall, no warning horn was noted until in the full stall nose down at 61 kts. Second 0 flap stall warning a 61 kts and full stall at 60 kts. First full flaps stall warning at 59 and stall at 57. Second was 57 and 57. Rebecca Briest BRIE 6610096CFI 11/26",c_49,flap
1237507,2025-01-27 11:06:00,2025-01-28 09:09:00,N625ND,12135.1,550.0,Flap overspeed,2025-01-27 11:08:00,"Inspected flaps and flap torque tube/pushrods in reference with Piper PA-28-181 MM 05-50-00, paragraph 4, and 27-50-00, paragraph 2.",c_49,flap
1237541,2025-01-28 06:28:00,2025-01-30 10:35:00,N755ND,9113.8,2360.0,L/H stab and R/H flap static wick broken,2025-01-28 08:38:00,Removed and replaced LH stab and RH flap static wick with new,c_49,flap
1237559,2025-01-28 14:44:00,2025-02-10 09:44:00,N504ND,14727.5,2360.0,RH flap static wick broken,2025-01-29 08:12:00,Replaced broken R/H flap static wick with new one.,c_49,flap
1237680,2025-01-31 18:28:00,2025-02-03 09:53:00,N622ND,13041.800000000001,550.0,Flap overspeed.,2025-01-31 18:30:00,"Inspected flaps and flap torque tube/pushrods IAW Piper PA-28-181 MM 05-50-00, paragraph 4, and 27-50-00, paragraph 2.",c_49,flap
1237706,2025-02-03 06:59:00,2025-02-03 13:57:00,N320ND,5638.5,590.0,"Flap overspeed, 10 degrees at 110 knots for 6-7 second.",2025-02-03 07:27:00,"Inspected flaps IAW Piper MM 5-50-00, no defects noted.",c_49,flap
1237771,2025-02-04 15:06:00,2025-02-05 14:42:00,N689ND,19864.4,550.0,Flap overspeed.,2025-02-04 15:10:00,"Inspected flaps and flap torque tube/pushrods IAW Piper PA-44-180 MM 05-50-00, paragraph 4, and 27-50-00, paragraph 4.",c_49,flap
1237772,2025-02-04 15:18:00,2025-02-19 12:21:00,N688ND,29015.1,2360.0,Left flap static wick is broken.,2025-02-05 11:12:00,Installed new static wick on left flap.,c_49,flap
1237823,2025-02-05 14:59:00,2025-02-12 10:44:00,N725ND,5647.799999999999,2360.0,R/H Flap Static Wick Broken,2025-02-05 20:26:00,Removed and Replaced R/H Flap Static Wick,c_49,flap
1237823,2025-02-05 14:59:00,2025-02-12 10:44:00,N725ND,5647.799999999999,2750.0,"Flaps ""UP"" Micro Switch INOP",2025-02-06 10:09:00,Adjusted micro switch arm ops check good,c_49,flap
1237888,2025-02-07 17:19:00,2025-02-12 14:37:00,N305ND,3874.0,2360.0,Pilot reports broken static wick.,2025-02-07 17:21:00,Replaced right flap static wick with new.,c_49,flap
1237961,2025-02-10 14:45:00,2025-06-17 13:53:00,N307ND,6321.900000000001,1130.0,Flap Handle Placard Illegable,2025-02-11 17:31:00,"Removed ""FLAP HANDLE"" Placard and Fabricated and Installed ""FLAP HANDLE"" Placard",c_49,flap
1238158,2025-02-15 13:31:00,2025-02-19 14:48:00,N754ND,9422.1,2360.0,Pilot reports broken static wick.,2025-02-15 13:32:00,Replaced right flap static wick with new.,c_49,flap
1238171,2025-02-15 17:17:00,2025-02-19 16:08:00,N305ND,4006.9,590.0,Discovered on preflight that the flaps will not retract on their own.,2025-02-15 17:40:00,Tested flaps. Ops check normal.  Problem caused by tailwind at tiedown.,c_49,flap
1238194,2025-02-17 06:23:00,2025-02-20 15:51:00,N842ND,15835.2,2360.0,RH flap static wick and LH IB and OB aileron static wick broke,2025-02-17 12:33:00,"Removed and replaced RH flap, LH and RH aileron static wicks with new.",c_49,flap
1238222,2025-02-18 06:27:00,2025-02-21 15:05:00,N799ND,24152.8,7110.0,LH COWL FLAP CONTROL NOT WORKING PROPERLY,2025-02-18 12:49:00,REMOVED PLASTIC TRIM. REMOVED AND REPLACED LH COWL FLAP LOCK AND LOCK SPRING WITH NEW.,c_49,flap
1238237,2025-02-18 09:04:00,2025-03-03 15:10:00,N678ND,8504.5,2750.0,Anti chafe tape is peeling off of left flap.,2025-02-19 09:50:00,Removed old anti chafe tape from left flap and installed new anti chaff tape to left flap.,c_49,flap
1238237,2025-02-18 09:04:00,2025-03-03 15:10:00,N678ND,8504.5,2750.0,"Light surface corrosion on flap transmission cables behind rear spar, FWD of right flap bay and INBD of flap motor.",2025-02-19 15:30:00,"Inspected flap cables in right wing, Treated light surface corrosion with ACF50. No further defects noted.",c_49,flap
1238237,2025-02-18 09:04:00,2025-03-03 15:10:00,N678ND,8504.5,2750.0,One button missing from R/H flap,2025-02-20 15:24:00,Replaced missing flap button on right flap with new button.,c_49,flap
1238241,2025-02-18 10:20:00,2025-02-21 15:54:00,N362ND,4683.9,2360.0,R/H flap has broken static wick,2025-02-18 10:28:00,Removed and Replaced static wick on R/H flap,c_49,flap
1238278,2025-02-18 20:22:00,2025-02-27 14:49:00,N768ND,12556.7,2360.0,pilot reports RH flap has broken static wick,2025-02-18 20:24:00,removed and replaced with new RH flap static wick.,c_49,flap
