workorder,date_time_opened,date_time_closed,registration,total_time,ata_code,problem,date,action,cluster,cluster_name
1158278,2016-10-20 05:50:00,2016-10-21 14:12:00,N677ND,3250.7999999999997,7230.0,#3 CYL HAS LOW COMPRESSION (40/80).,2016-10-20,STARTED REMOVING BAFFLING.,c_13,cylinder compression low compression
1158278,2016-10-20 05:50:00,2016-10-21 14:12:00,N677ND,3250.7999999999997,7230.0,#3 CYL HAS LOW COMPRESSION (40/80).,2016-10-21,LEAK & RUN UP CK GOOD.,c_13,cylinder compression low compression
1158278,2016-10-20 05:50:00,2016-10-21 14:12:00,N677ND,3250.7999999999997,7230.0,#3 CYL HAS LOW COMPRESSION (40/80).,2016-10-21,"REMOVED CYL, FITTED NEW INTAKE VALVE, LAPPED BOTH VALVES. CLEANED CYL.",c_13,cylinder compression low compression
1158445,2016-10-25 19:16:00,2016-10-28 00:00:00,N509ND,10704.6,5100.0,"MAJOR STRUCTUAL AND ENGINE/PROPELLER REPAIRS REQUIRED. SEE WKO# 115751,1153970 OR # 1049508",2016-10-03,"(CONTD) (4) MAIN BEARINGS P/N 18D26098,  (8) COMPRESSION PISTON RINGS P/N 74241, (4) OIL REGULATING PISTON RINGS P/N 14H21950, (8) PISTON PIN PLUGS P/N 72198, (2) PISTON PINS P/N LW-14078, (3)PUSH ROD TUBES P/N 15G23461, (CONTD)",c_13,cylinder compression low compression
1159069,2016-11-17 05:54:00,2016-11-17 14:34:00,N515ND,11714.4,7230.0,#3 CYL EGT LOW ON RUN UP W/ ROUGH RUNNING ENGINE AFTER START.,2016-11-17,"PERFORMED COMPRESSION CK, FOUND #3 CYL LOW. REMOVED CYL, REAMED EXHAUST GUIDE, LAPPED VALVE. LEAK CK GOOD. REINSTALLED CYL, TORQUED TO CASE. DRY TAPPET CLEARANCE CK GOOD. REASSEMBLED CYL. RAN A/C, OPS & LEAK CK GOOD.",c_13,cylinder compression low compression
1159231,2016-11-23 14:20:00,2016-11-27 11:01:00,N538ND,22447.1,7230.0,#4 CYLINDER HAS LOW COMPRESSION.,2016-11-25,"REMOVED CYL FROM ENG. REMOVED & REPLACED EXHAUST VALVE. DURING LEAK CK, FOUND INTAKE VALVE LEAKING. AFTER FURTHER INSP, FOUND WORN INTAKE SEAT. CYL IS NOT REPAIRABLE. TURNED NEW LAPPED EXHAUST VALVE BACK INTO INVENTORY.",c_13,cylinder compression low compression
1159231,2016-11-23 14:20:00,2016-11-27 11:01:00,N538ND,22447.1,7230.0,#4 CYLINDER HAS LOW COMPRESSION.,2016-11-25,RETRIEVED NEW CYL ASSY FROM INVENTORY.,c_13,cylinder compression low compression
1159231,2016-11-23 14:20:00,2016-11-27 11:01:00,N538ND,22447.1,7230.0,#4 CYLINDER HAS LOW COMPRESSION.,2016-11-25,FITTED RINGS TO PISTON. INSTALLED PISTON & CYL ASSY TO ENGINE. TORQUED CYL BASE NUTS TO SPECS. ALL WORK PERFORMED IAW LYCOMING DIRECT DRIVE MANUAL.,c_13,cylinder compression low compression
1159231,2016-11-23 14:20:00,2016-11-27 11:01:00,N538ND,22447.1,7230.0,#4 CYLINDER HAS LOW COMPRESSION.,2016-11-27,"INSTALLED ""MINERAL OIL ONLY"" STICKERS.",c_13,cylinder compression low compression
1159231,2016-11-23 14:20:00,2016-11-27 11:01:00,N538ND,22447.1,7230.0,#4 CYLINDER HAS LOW COMPRESSION.,2016-11-27,COMPELTED INSTALLATION OF BAFFLING & EXHAUST VALVE. LASH CK'ED GOOD. SERVICED W/ MINERAL OIL. RUN UP & LEAK CK'ED GOOD.,c_13,cylinder compression low compression
1159353,2016-12-01 10:46:00,2016-12-05 00:00:00,N513ND,10984.4,7200.0,COMPRESSION ON #3 CYLINDER 8/80 PSI,2016-12-03,VALVE GUIDE REAMED AND CLEANED. COMPRESSION TEST NOW 71/80,c_13,cylinder compression low compression
1159577,2016-12-10 07:44:00,2016-12-13 00:00:00,N510ND,10886.2,7220.0,#3 COMPRESSION LOW 65/80,2016-12-12,PERFORM CARBON RESISTANCE CHECK NO CARBON FOUND COMPRESSION IN PASSIVE RANGE,c_13,cylinder compression low compression
1159790,2016-12-16 13:12:00,2016-12-20 10:06:00,N652ND,6449.700000000001,7230.0,#3 CYLINDER HAS BAD COMPRESSION.,2016-12-17,REMOVED #3 CYL. FITTED NEW PISTON & RINGS. FITTED & TORQUED NEW CYLINDER.,c_13,cylinder compression low compression
1159790,2016-12-16 13:12:00,2016-12-20 10:06:00,N652ND,6449.700000000001,7230.0,#3 CYLINDER HAS BAD COMPRESSION.,2016-12-19,DRY TAPPET CLEARANCE CK GOOD. REASSEMBLED ENGINE. SERVICED W/ MINERAL OIL.,c_13,cylinder compression low compression
1159790,2016-12-16 13:12:00,2016-12-20 10:06:00,N652ND,6449.700000000001,7230.0,#3 CYLINDER HAS BAD COMPRESSION.,2016-12-20,COMPLETED ENGINE REASSEMBLY.,c_13,cylinder compression low compression
1159790,2016-12-16 13:12:00,2016-12-20 10:06:00,N652ND,6449.700000000001,7230.0,#3 CYLINDER HAS BAD COMPRESSION.,2016-12-20,"RAN ENGINE, OPS & LEAK CK GOOD.",c_13,cylinder compression low compression
1159869,2016-12-20 06:12:00,2016-12-20 13:47:00,N573ND,16664.5,7100.0,#4 CYLINDER HAS LOW COMPRESSION.,2016-12-20,"REMOVED CYL. FOUND BURNT VALVE. LAPPED & FITTED NEW EXHAUST VALVE. TORQUED CYL TO CASE. DRY TAPPET LASH CK GOOD. COMPLETED ENGINE REASSEMBLY. RAN A/C, OPS & LEAK CK GOOD.",c_13,cylinder compression low compression
1159925,2016-12-22 16:04:00,2017-01-13 13:49:00,N523ND,10396.4,7200.0,ENGINE RUNNING VERY ROUGH & SHAKING AFTER START UP.,2017-01-09,RAN ENGINE TO WARM CYLINDERS. PERFORMED COMPRESSION CK. REAMED #4 EXHAUST & INTAKE VALVES. CLEANED #2 & 4 INJECTOR NOZZLES & SWAPPED POSITIONES ON INSTALLATION.,c_13,cylinder compression low compression
1160517,2017-01-20 13:38:00,2017-01-21 14:24:00,N642ND,3621.2999999999997,7230.0,#4 CYL HAS LOW COMPRESSION.,2017-01-20,"REMOVED CYLINDER FROM ENGINE, INSPECTED & FOUND BURNT EXHAUST VALVE. REMOVED & REPLACED VALVE. GROUND EXHAUST SEAT, LAPPED & FITTED VALVE TO CYL HEAD. REAMED EXHAUST VALVE GUIDE. REINSTALLED CYLINDER ONTO ENGINE. TORQUED TO SPECS.",c_13,cylinder compression low compression
1160517,2017-01-20 13:38:00,2017-01-21 14:24:00,N642ND,3621.2999999999997,7230.0,#4 CYL HAS LOW COMPRESSION.,2017-01-20,FOUND DRY TAPPET CLEARANCE W/IN SPECS & ALL FLUID LINES TORQUED & RECONNECTED ONTO CYLINDER. ALL WORK PERFORMED IAW LYCOMING DIRECT DRIVE ENGINE MANUAL.,c_13,cylinder compression low compression
1160517,2017-01-20 13:38:00,2017-01-21 14:24:00,N642ND,3621.2999999999997,7230.0,#4 CYL HAS LOW COMPRESSION.,2017-01-21,"RAN UP A/C, LEAK CK GOOD.",c_13,cylinder compression low compression
1160579,2017-01-24 06:23:00,2017-01-25 10:38:00,N530ND,18021.3,7230.0,#3 CYLINDER HAS LOW COMPRESSION.,2017-01-24,"REMOVED #3 CYL, GROUND INTAKE VALVE & SEAT, LAPPED EXHAUST VALVE & REINSTALLED CYLINDER ON ENGINE & TORQUED. REPLACED INTAKE PUSH ROD W/ -28, DRY TAPPET CLEARANCE CK'ED GOOD. ALL WORK DONE IAW LYCOMING OVERHAUL MANUAL.",c_13,cylinder compression low compression
1160579,2017-01-24 06:23:00,2017-01-25 10:38:00,N530ND,18021.3,7230.0,#3 CYLINDER HAS LOW COMPRESSION.,2017-01-24,"REINSTALLED BAFFLING, EXHAUST INTAKE TUBES, OIL RETURN LINES, FUEL INJ LINE, OIL PRESSURE LINE & MISC CLAMPS.",c_13,cylinder compression low compression
1160579,2017-01-24 06:23:00,2017-01-25 10:38:00,N530ND,18021.3,7230.0,#3 CYLINDER HAS LOW COMPRESSION.,2017-01-25,RUN UP LEAK CK GOOD.,c_13,cylinder compression low compression
1160742,2017-01-30 12:27:00,2017-01-30 13:35:00,N677ND,3821.7000000000003,7200.0,"ENGINE STARTED MAKING ABNORMAL SOUND IN FLIGHT. ABNORMAL VIBRATION, ALL INDICATIONS NORMAL.",2017-01-30,"RAN UP A/C, COULD NOT DUPLICATE IRREGULOR SOUNDS OR VIBRATIONS. PERFORMED COMPRESSION CK; ALL GOOD. MAINTENANCE FLIGHT REQUIRED - SEE W/O #1160746.",c_13,cylinder compression low compression
1161082,2017-02-09 21:30:00,2017-02-09 14:06:00,N558ND,12696.699999999999,7100.0,"ON CLIMB OUT, THERE WAS A HUGE THUMP IN ENGINE & THEN ENGINE STARTED RUNNING ROUGH WHEN RPM GOES OVER 2100.",2017-02-09,"PERFORMED CYLINDER COMPRESSION CK; FOUND ALL CYLS W/IN SPECS. RAN A/C, FOUND ENGINE OPERATING NORMAL. COULD NOT DUPLICATE PROBLEM. MX FLIGHT REQUIRED TO CK ENGINE OPERATION - SEE W/O #1161085.",c_13,cylinder compression low compression
1161147,2017-02-13 05:52:00,2017-02-14 11:02:00,N522ND,16343.6,7230.0,#3 CYL LOW COMPRESSION (48/80).,2017-02-13,"PERFORMED COMPRESSION TEST, FOUND #3 CYL @ 48 PSI. STAKED BOTH INTAKE & EXHAUST VALVES. PSI REMOVED 48/80. REMOVED BAFFLES & NECESSARY ITEMS FOR #3 CYL REMOVAL. REMOVED #3 CYL, MEASURED BOTH INTAKE & EXHAUST VALVE GUIDES. BOTH W/N LIMITS.",c_13,cylinder compression low compression
1161147,2017-02-13 05:52:00,2017-02-14 11:02:00,N522ND,16343.6,7230.0,#3 CYL LOW COMPRESSION (48/80).,2017-02-13,GROUND VALVES & STARTED GRINDING VALVE SEATS.,c_13,cylinder compression low compression
1161147,2017-02-13 05:52:00,2017-02-14 11:02:00,N522ND,16343.6,7230.0,#3 CYL LOW COMPRESSION (48/80).,2017-02-14,"FINISHED GROUNDING VALVE SEATS & FITTING VALVES INTO SEATS, LAPPED VALVES. FOUND TO BE W/IN SPECS. REINSTALLED SPRINGS & RETAINER. INSTALLED CYLINDER IAW LYCOMING DIRECT DRIVE MANUAL. PERFORMED DRY TAPPET CK, EXCHANGE BOTH PUSH RODS, FOUND W/IN SPECS.",c_13,cylinder compression low compression
1161147,2017-02-13 05:52:00,2017-02-14 11:02:00,N522ND,16343.6,7230.0,#3 CYL LOW COMPRESSION (48/80).,2017-02-14,"INSTALLED BAFFLES & ALL NECESSARY PARTS FOR #3 CYLINDER. PERFORMED COMPRESSION TEST (75/80). RAN A/C, OPS & LEAK CK'ED GOOD.",c_13,cylinder compression low compression
1161227,2017-02-14 13:40:00,2017-02-15 15:44:00,N559ND,15480.0,7230.0,#4 CYLINDER COMPRESSION @ 45/80.,2017-02-14,STAKED VALVES. CYLINDER STAYED @ 45/80. REMOVED BAFFLES & ITEMS NEEDED FOR #4 CYL REMOVAL. REMOVED #4 CYL.,c_13,cylinder compression low compression
1161227,2017-02-14 13:40:00,2017-02-15 15:44:00,N559ND,15480.0,7230.0,#4 CYLINDER COMPRESSION @ 45/80.,2017-02-15,OPS & LEAK CK'ED GOOD.,c_13,cylinder compression low compression
1161227,2017-02-14 13:40:00,2017-02-15 15:44:00,N559ND,15480.0,7230.0,#4 CYLINDER COMPRESSION @ 45/80.,2017-02-15,FOUND EXHAUST VALVE BURNT & GUIDE WORN.,c_13,cylinder compression low compression
1161227,2017-02-14 13:40:00,2017-02-15 15:44:00,N559ND,15480.0,7230.0,#4 CYLINDER COMPRESSION @ 45/80.,2017-02-15,"INSTALLED NEW CYL ASSY & TORQUED TO CASE. DRY TAPPET CLEARANCE CK GOOD. REASSEMBLED ENGINE, SERVICED W/ MINERAL OIL.",c_13,cylinder compression low compression
1161369,2017-02-18 12:10:00,2017-02-20 14:44:00,N574ND,17473.4,7200.0,"DURING START UP, ENGINE STARTED BUT RAN VERY ROUGH & WOULD NOT HOLD.",2017-02-18,"RAN A/C, CONFIRMED DISCREP. PERFORMED COMPRESSION CK (#1-72/80, #2-70/80, #3-70/80, #4-72/80).",c_13,cylinder compression low compression
1161405,2017-02-20 15:02:00,2017-02-21 16:23:00,N538ND,23018.0,7200.0,"ENGINE RAN ROUDH, IDLE LOW, WOULDN'T GO TO FULL POWER.",2017-02-20,"PERFORMED COMPRESSION TEST, FOUND #3 CYL TO HAVE LOW COMPRESSION (25/80). REMOVED BAFFLES & NECESSARY PARTS FOR #3 CYL REMOVAL. REMOVED CYL. FOUND EXHAUST VALVE WORN. REMOVED & REPLACED EXHAUST VALVE & GROUND EXHAUST SEAT.",c_13,cylinder compression low compression
1161405,2017-02-20 15:02:00,2017-02-21 16:23:00,N538ND,23018.0,7200.0,"ENGINE RAN ROUDH, IDLE LOW, WOULDN'T GO TO FULL POWER.",2017-02-21,"FINISHED CYLINDER INSTALLATION. PERFORMED DRY TAPPET CLEARANCE CK, OPS GOOD, AFTER INSTALLING SERVICEABLE ROCKER ARMS & NEW PUSH RODS. INSTALLED BAFFLES & FLUID LINES. PERFORMED COMPRESSION TEST - 73/80. OPS & LEAK CK GOOD.",c_13,cylinder compression low compression
1161412,2017-02-21 06:28:00,2017-02-24 12:52:00,N680ND,5435.5,7230.0,R/H ENG #4 CYL COMPRESSION 40/80.,2017-02-22,REMOVED CYLINDER. DRAINED & CLEANED LIFTERS.,c_13,cylinder compression low compression
1161412,2017-02-21 06:28:00,2017-02-24 12:52:00,N680ND,5435.5,7230.0,R/H ENG #3 CYL COMPRESSION 59/80.,2017-02-22,REMOVED BAFFLES & CYLINDER. DRAINED & CLEANED LIFTERS.,c_13,cylinder compression low compression
1161412,2017-02-21 06:28:00,2017-02-24 12:52:00,N680ND,5435.5,7230.0,R/H ENG #4 CYL COMPRESSION 40/80.,2017-02-23,INSTALLED NEW CYL ASSY. BEGAN INSTALLING BAFFLES.,c_13,cylinder compression low compression
1161412,2017-02-21 06:28:00,2017-02-24 12:52:00,N680ND,5435.5,7230.0,R/H ENG #3 CYL COMPRESSION 59/80.,2017-02-23,INSTALLED NEW CYLINDER ASSY. BEGAN INSTALLING BAFFLES.,c_13,cylinder compression low compression
1161412,2017-02-21 06:28:00,2017-02-24 12:52:00,N680ND,5435.5,7230.0,R/H ENG #3 CYL COMPRESSION 59/80.,2017-02-24,"COMPLETED INSTALLATION OF BAFFLES & EXHAUST SYSTEM. RAN ENGINE, OPS & LEAK CK GOOD.",c_13,cylinder compression low compression
1161412,2017-02-21 06:28:00,2017-02-24 12:52:00,N680ND,5435.5,7230.0,R/H ENG #4 CYL COMPRESSION 40/80.,2017-02-24,"COMPLETED INSTALLATION OF BAFFLES & EXHAUST. RAN ENG, OPS & LEAK CK GOOD. MX BREAK-IN FLIGHT REQUIRED.",c_13,cylinder compression low compression
1161418,2017-02-21 09:28:00,2017-02-22 13:01:00,N547ND,8452.400000000001,7230.0,"DURING ENGINE START, ENGINE WAS RUNNING VERY ROUGH. WENT THROUGH CHECKLIST & NOTHING WORKED. AFTER ABOUT 5 MINS IT SMOOTHED OUT A LITTLE, BUT WAS STILL SHAKING. ALSO WHEN PULLED POWER BACK TO IDLE, ENGINE SHUT ITSELF DOWN.",2017-02-21,"RAN UP A/C, CONFIRMED DISCREP. REVIEWED FDM DATA, FOUND CYL #2, 4 EGT'S TO BE MUCH LOWER TEMP THAN #1, 3. PERFORMED COMPRESSION CK ON CYLS #2, 4; BOTH 75/80. REMOVED SPARK PLUGS & VALVE COVERS. FOUND #2 CYL EXHAUST VALVE STUCK. REAMED GUIDE ON #2 CYL EXH.",c_13,cylinder compression low compression
1161761,2017-03-03 19:52:00,2017-03-05 14:50:00,N558ND,12909.1,7220.0,CYL 3 OR 4 HAS A STUCK EXHAUST VALVE.,2017-03-03,"PERFORMED COMPRESSION TEST, VERIFIED #4 CYL HAS ZERO COMPRESSION & EXHAUST VALVE IS NOT CLOSING.",c_13,cylinder compression low compression
1161875,2017-03-08 18:53:00,2017-03-10 10:23:00,N528ND,15040.6,7230.0,ENGINE VERY ROUGH AFTER START - DOES NOT RUN AT IDLE.,2017-03-08,"PERFORMED COMPRESSION TEST, FOUND #4 CYL 0/80. BORESCOPED CYLINDER. FOUND EXHAUST VALVE HIT PISTION.",c_13,cylinder compression low compression
1162014,2017-03-13 23:19:00,2017-03-14 15:59:00,N785ND,497.0,7100.0,"ROUGHNESS ON R/H ENGINE. SUSPECT CARB ICE, BUT CARB HEAT DID NOT HELP. RAN ENGINE ROUGHNESS CHECKLIST W/ NO CHANGES. ONCE CARB HEAT, #2 EGT DROPPED TO ZERO & ROUGHNESS AMPLIFIED.",2017-03-13,PERFORMED COMPRESSION CK - ALL CYLINDERS WERE W/IN LIMITS. REMOVED TOP SPARK PLUGS.,c_13,cylinder compression low compression
1162208,2017-03-21 06:24:00,2017-03-22 10:06:00,N688ND,6639.5,7230.0,"L/H ENG #4 CYL IS CRACKED, FOUND ON COMPRESSION TEST.",2017-03-21,"REMOVED ALL CYLINDERS, REINSTALLED 4 NEW CYLINDERS. TORQUED TO CASE, DRY TAPPET CLEARANCE CK GOOD.",c_13,cylinder compression low compression
1162208,2017-03-21 06:24:00,2017-03-22 10:06:00,N688ND,6639.5,7230.0,"L/H ENG #4 CYL IS CRACKED, FOUND ON COMPRESSION TEST.",2017-03-22,"RAN A/C, OPS & LEAK CK GOOD. SEE W/O #1162272 FOR BREAK-IN FLIGHT.",c_13,cylinder compression low compression
1162208,2017-03-21 06:24:00,2017-03-22 10:06:00,N688ND,6639.5,7230.0,"L/H ENG #4 CYL IS CRACKED, FOUND ON COMPRESSION TEST.",2017-03-22,"INSTALLED REMAINING BAFFLES, INTAKE & EXHAUST. SERVICED W/ 20W50 TYPE M OIL.",c_13,cylinder compression low compression
1162308,2017-03-23 13:06:00,2017-03-24 14:14:00,N557ND,14374.6,7230.0,#1 CYL COMPRESSION LOW.,2017-03-23,"REMOVED & REPLACED #1 CYLINDER, DUE TO BURNT EXHAUST VALVE, W/ SERVICEABLE CYLINDER IAW LYCOMING OVERHAUL MANUAL.",c_13,cylinder compression low compression
1162308,2017-03-23 13:06:00,2017-03-24 14:14:00,N557ND,14374.6,7230.0,#1 CYL COMPRESSION LOW.,2017-03-24,OPS & LEAK CK GOOD.,c_13,cylinder compression low compression
1162567,2017-03-31 15:41:00,2017-03-31 14:48:00,N507ND,13267.8,7200.0,"AUDIBLE RPM LOSS & ENGINE ROUGHNESS WHILE LEVELING IN DOWN WIND. IT WAS BRIEF, RAN ENGINE ROUGHNESS CHECKLIST.  CK'ED FINE. ON CLIMB OUT, FELT UNUSUAL AMOUNT OF VIBRATION, PERFORMED FULL STOP.",2017-03-31,"PERFORMED COMPRESSION CK: CYL #1-78, #2-75, #3-78, #4-78. REMOVED IGNITION HARNESS CAPS AT MAGS, REPAIRED 2 LEADS ON L/H MAG. REINSTALLED CAPS. PERFORMED GROUND RUN, OPS CK'ED GOOD.",c_13,cylinder compression low compression
1162713,2017-04-05 13:12:00,2017-04-05 14:37:00,N680ND,6043.5,7230.0,"LOW COMPRESSION ON CYLINDER #2, L/H ENGINE.",2017-04-05,FOUND COMPRESSION BELOW 40/80 PSI & LEAKING OUT EXHAUST VALVE. REMOVED & REPLACED L/H ENG CYL #2 IAW LYCOMING OVERHAUL MANUAL. OPS & LEAK CK'ED GOOD.,c_13,cylinder compression low compression
1162901,2017-04-11 17:27:00,2017-04-11 10:19:00,N529ND,12007.5,7200.0,"NOTICED AN ABNORMAL TICKING OR VIBRATION NOISE FROM ENGINE BETWEEN 1500-2000 RPM, IN FLIGHT.",2017-04-11,"PERFORMED VISUAL INSP OF ENGINE & COMPRESSION CK (#1-64, #2-75, #3-74, #4-72). RAN A/C, OPS CK GOOD. OK FOR SERVICE.",c_13,cylinder compression low compression
1162936,2017-04-12 15:31:00,2017-04-14 14:31:00,N524ND,18137.7,7230.0,LOW COMPRESSION ON CYL #3 (55).,2017-04-13,"REMOVED CYL, FOUND TO BE BURNT EXHAUST VALVE. INSTALLED NEW EXHAUST VALVE, CUT SEAT & LAPPED VALVE IN. REINSTALLED CYLINDER, TORQUED TO CASE. DRY TAPPET CLEARANCE CK GOOD.",c_13,cylinder compression low compression
1162936,2017-04-12 15:31:00,2017-04-14 14:31:00,N524ND,18137.7,7230.0,LOW COMPRESSION ON CYL #3 (55).,2017-04-14,OPS & LEAK CK GOOD.,c_13,cylinder compression low compression
1162997,2017-04-14 14:29:00,2017-04-14 14:56:00,N528ND,15423.1,7230.0,LOW COMPRESSION ON CYL #1.,2017-04-14,FOUND TO HAVE 57/80 PSI COMP & BURNT EXHAUST VALVE. REMOVED & REPLACED CYL #1 CYL ASSY IAW LYCOMING OVERHAUL MANUAL. OPS & LEAK CK'ED GOOD. SERVICED W/ MINERAL OIL.,c_13,cylinder compression low compression
1163174,2017-04-21 06:38:00,2017-04-22 13:43:00,N572ND,13329.6,7230.0,COMPRESSION IS LOW #2 CYLINDER.,2017-04-21,REMOVED CYLINDER FROM ENGINE. FOUND EXHAUST VALVE WORN. GROUND BOTH INTAKE & EXHAUST SEATS. GROUND INTAKE VALVE & INSTALLED NEW EXHAUST VALVE. LAPPED & FITTED BOTH VALVES. ALL WORK DONE IAW LYCOMING DIRECT DRIVE MANUAL.,c_13,cylinder compression low compression
1163174,2017-04-21 06:38:00,2017-04-22 13:43:00,N572ND,13329.6,7230.0,COMPRESSION IS LOW #2 CYLINDER.,2017-04-21,REINSTALLED CYLINDER TO ENGINE & TORQUE BASE NUTS TO SPECS. DRY TAPPET CLEARACE GOOD AFTER REPLACING INTAKE PUSH ROD TUBE TO MEET SPECS. DONE IAW LYCOMING DIRECT DRIVE MANUAL.,c_13,cylinder compression low compression
1163174,2017-04-21 06:38:00,2017-04-22 13:43:00,N572ND,13329.6,7230.0,COMPRESSION IS LOW #2 CYLINDER.,2017-04-22,"RECONECTED OIL RETURN LINES. REINSTALLED BAFFLES. PERFORMED ENGINE RUN UP, OPS & LEAK CK GOOD.",c_13,cylinder compression low compression
1163270,2017-04-24 15:37:00,2017-05-03 13:22:00,N652ND,7543.799999999999,7100.0,#4 CYLINDER IS CRACKED. COMPRESSION IS 64/80 BUT IS LEAKING AIR OUT TOP OF CYL. ENGINE HAS 2514.6 HRS TT/SMOH. RECOMMEND ENGINE CHANGE. OLD OIL FILTER IS TEMPORARILY INSTALLED & NOT SAFEITED. OIL SCREEN HAS BEEN REMOVED & FOUND TO BE DAMAGED - SEE PD #4.,2017-05-01,"REMOVED BAFFLES, FITTINGS, HOSES & ACCESSORIES. REMOVED ENIGNE FROM A/C.",c_13,cylinder compression low compression
1163270,2017-04-24 15:37:00,2017-05-03 13:22:00,N652ND,7543.799999999999,7100.0,#4 CYLINDER IS CRACKED. COMPRESSION IS 64/80 BUT IS LEAKING AIR OUT TOP OF CYL. ENGINE HAS 2514.6 HRS TT/SMOH. RECOMMEND ENGINE CHANGE. OLD OIL FILTER IS TEMPORARILY INSTALLED & NOT SAFEITED. OIL SCREEN HAS BEEN REMOVED & FOUND TO BE DAMAGED - SEE PD #4.,2017-05-02,"INSTALLED OVERHAULED ENGINE S/N L-27003-51E ON A/C. STARTED INSTALL OF BAFFLES, ETC...",c_13,cylinder compression low compression
1163270,2017-04-24 15:37:00,2017-05-03 13:22:00,N652ND,7543.799999999999,7100.0,#4 CYLINDER IS CRACKED. COMPRESSION IS 64/80 BUT IS LEAKING AIR OUT TOP OF CYL. ENGINE HAS 2514.6 HRS TT/SMOH. RECOMMEND ENGINE CHANGE. OLD OIL FILTER IS TEMPORARILY INSTALLED & NOT SAFEITED. OIL SCREEN HAS BEEN REMOVED & FOUND TO BE DAMAGED - SEE PD #4.,2017-05-03,COMPLETED ENGINE INSTALLATION. OPS & LEAK CK GOOD. SEE W/O #1163538 FOR BREAK-IN FLIGHT.,c_13,cylinder compression low compression
1163543,2017-05-03 19:33:00,2017-05-03 15:38:00,N513ND,12248.6,7100.0,RECOVERING FROM A MANUEVER; ENGINE BEGAN SPUTTERING & LOST A LOT OF POWER. ADJUSTED MIXTURE & TOOK OUT THE THROTTLE & ENGINE RAN OK AFTER THAT.,2017-05-03,"RAN A/C & FOUND #2 CYL MISSING. CLEANED OFF SPARK PLUGS BY LEANING. PROBLEM WENT AWAY. CLEANED #2 CYL SPARK PLUG & TORQUED TO SPECS. PERFORMED COMPRESSION CK & FOUND 75/80. RAN A/C AGAIN, OPS CK GOOD. MX FLIGHT REQ'D TO CK ENG CONDITION - SEE W/O #1163547",c_13,cylinder compression low compression
1163752,2017-05-10 05:54:00,2017-05-11 10:54:00,N576ND,17315.1,7233.0,#4 COMPRESSION IS 20/80.,2017-05-10,"REMOVED CYLINDER, FOUND EXHAUST VALVE TO BE BURNT. STARTED CHANGE FOR SERVICEABLE CYLINDER.",c_13,cylinder compression low compression
1163752,2017-05-10 05:54:00,2017-05-11 10:54:00,N576ND,17315.1,7233.0,#4 COMPRESSION IS 20/80.,2017-05-11,"REMOVED PISTON FROM CONNECTING ROD. INSPECTED PISTON PIN, NO DEFECTS. INSTALLED SERVICEABLE PISTON PIN, PISTON & RINGS. MEASURED RING GAP & CLEARANCES - NO DEFECTS. CHECKS GOOD. INSTALLED SERVICEABLE CYLINDER. TORQUED TO LYCOMING OVERHAUL MANUAL SPECS.",c_13,cylinder compression low compression
1163752,2017-05-10 05:54:00,2017-05-11 10:54:00,N576ND,17315.1,7233.0,#4 COMPRESSION IS 20/80.,2017-05-11,"PERFORMED LIFTER INSP & TEST, NO DEFECTS. PERFORMED DRY TAPPET & CLEARANCE CK, NO DEFECTS. RAN A/C, OPS CK GOOD. NO LEAKS.",c_13,cylinder compression low compression
1164166,2017-05-25 14:06:00,2017-05-26 14:14:00,N549ND,13126.5,3240.0,TIRE PRESSURES LOW.,2017-05-26,SERVICED TIRE PRESSURES W/ COMPRESSED AIR.,c_13,cylinder compression low compression
1164224,2017-05-29 13:47:00,2017-05-31 14:40:00,N654ND,7216.799999999999,7200.0,CYL #2 HAS LOW COMPRESSION.,2017-05-29,"FOUND CYL CRACKED. DECIDED TO CHANGE ENG DUE TO ENG HOURS. REMOVED ALTERNATOR, STARTER & EXHAUST. DISCONNECTED LINES, WIRES, CABLES & HOSES. REMOVED ENG FROM MOUNT. CLEANED & INSPECTED MOOUNT. NO DEFECTS NOTED.",c_13,cylinder compression low compression
1164224,2017-05-29 13:47:00,2017-05-31 14:40:00,N654ND,7216.799999999999,7200.0,CYL #2 HAS LOW COMPRESSION.,2017-05-29,"TRANSFERRED SERVICEABLE COMPONENTS TO OVERHAULED ENGINE S/N L-32674-51E. INSTALLED ENG ON MOUNT W/ NEW MOUNTS & HARDWARE. TORQUED TO SPECS. BEGAN ROUTING & CONNECTING LINES, WIRES, CABLES & HOSES.",c_13,cylinder compression low compression
1164224,2017-05-29 13:47:00,2017-05-31 14:40:00,N654ND,7216.799999999999,7200.0,CYL #2 HAS LOW COMPRESSION.,2017-05-30,FINISHED ROUTING & SECURED ALL ELECTRICAL & FLUID LINES. DRAINED PERSERVATIVE OIL & SERVICED W/ MINERAL OIL. PRE-OILED ENGINE. INSTALLED & TORQUED SPARK PLUGS. INSTALLED LEADS.,c_13,cylinder compression low compression
1164731,2017-06-16 13:17:00,2017-06-19 14:49:00,N769ND,1099.1999999999998,7230.0,#4 CYLINDER HAS LOW COMPRESSION (40/80).,2017-06-19,"RAN A/C, TESTED COMPRESSION AGAIN - CYLINDER TESTED @ 73.",c_13,cylinder compression low compression
1164737,2017-06-16 17:00:00,2017-06-21 00:00:00,N608ND,10554.3,7231.0,#4 CYLINDER COMPRESSION LOW,2017-06-19,PREFORMED A CARBON RESISTANCE REAM ON THIS CYLINDER AND CHECKED COMPRESSION. 76/80 WAS INDICATED. OPS CHECK OK. NO DEFECTS NOTED,c_13,cylinder compression low compression
1164740,2017-06-17 07:02:00,2017-06-17 14:17:00,N507ND,14028.3,7200.0,"DURING CLIMB ENGINE STUTTERED, DURING CRUISE THERE AFTER ENGINE RAN NOTICEABLY ROUGH.",2017-06-17,"RAN UP A/C, COULD NOT DUPLICATE DISCREP. CK'ED COMPRESSION - ALL CK GOOD. RAN A/C AGAIN & COULD NOT DUPLICATE DISCREP. OPS CK GOOD.",c_13,cylinder compression low compression
1164845,2017-06-21 06:16:00,2017-06-21 00:00:00,N532ND,14240.4,7220.0,#2 AND #4 CYLINDERS HAVE MARGINAL LOW COMPRESSIONS,2017-06-21,"RUN UP AND RECHECK OF COMPRESSIONS #2 @ 72#, #4 @ 74# OPS CHECK OK",c_13,cylinder compression low compression
1165138,2017-07-03 10:41:00,2017-07-07 00:00:00,N633ND,11315.5,7230.0,CYLINDER #4 HAS NO COMPRESSION,2017-07-06,PERFORMED CARBON RESISTANCE REAM. COMPRESSION CHECK 70/80. NO DEFECTS NOTED,c_13,cylinder compression low compression
1165244,2017-07-08 08:08:00,2017-07-08 09:55:00,N561ND,6467.3,7220.0,DURING FLIGHT A/C HAD ENGINE ROUGHNESS TWICE. ENGINE RUN UP TESTED GOOD.,2017-07-08,"PEFORMED COMPRESSION CK, ALL CHECKS GOOD.  RAN UP A/C FOR SEVERAL MINUTES AT DIFFERENT POWER SETTINGS. NO ROUGHNESS NOTED. SEE W/O #1165247 FOR MX FLIGHT.",c_13,cylinder compression low compression
1165248,2017-07-08 10:28:00,2017-07-08 09:59:00,N509ND,16972.5,7100.0,"ON CLIMB OUT, A/C BEGAN TO SHAKE VIOLENTLY.",2017-07-08,RAN A/C FOR SEVERAL MINUTES & NO DEFECTS FOUND. PERFORMED COMPRESSION CK - ALL CHECKS GOOD. SEE W/O #1165252 FOR MX FLIGHT.,c_13,cylinder compression low compression
1165429,2017-07-14 08:47:00,2017-07-17 12:23:00,N546ND,16189.099999999999,7100.0,ENGINE HAD EXCESSIVE VIBRATIONS ON START UP.,2017-07-14,"RAN UP A/C, PERFORMED COMPRESSION TEST; FOUND EXHAUST VALVE ON #3 CYL STICKING OPEN.",c_13,cylinder compression low compression
1165762,2017-07-26 18:19:00,2017-07-29 00:00:00,N652ND,6752.8,7200.0,"ROUGH ENGINE DURING BEGINNING OF RUN UP (NO EFT CYL #1, 4 FOR FIRST 2 MIN)",2017-07-27,"PERFORMED DIFFERENTIAL COMPRESSION CHECK CYL #1=75, #2=72, #3=75, #4=74",c_13,cylinder compression low compression
1165965,2017-08-04 08:59:00,2017-08-09 14:08:00,N560ND,12698.6,7100.0,FLYING BACK FROM PRACTICE AREA; RPM DROPPED FROM 2400 TO 2000. RAN ENGINE ROUGHNESS CHECKLIST BACK TO GRAND FORKS.,2017-08-04,RAN A/C & FOUND #3 CYLINDER MISFIRING. PERFORMED COMPRESSION CK & FOUND EXHAUST VALVE STICKING ON #3 CYL. INSPECTED & FOUND VALVE HIT PISTON. RETRIEVED PARTS FROM INVENTORY.,c_13,cylinder compression low compression
1165976,2017-08-04 11:54:00,2017-08-05 00:00:00,N654ND,5568.400000000001,7230.0,ENGINE CYLINDER #3 TESTED LOW ON COMPRESSION CHECK,2017-08-05,"PERFORMED CARBON RESISTANCE CHECK. FOUND CARBON BUILDUP. REEMED EXHAUST GUIDE REINSTALLED IAW LYCOMING SERVICE INSTRUCTION 1425A. NO FURTHER DEFECTS NOTED. INSPECTED CYLINDERS 1,2,4. NO DEFECTS NOTED",c_13,cylinder compression low compression
1166027,2017-08-08 06:05:00,2017-08-10 12:53:00,N510ND,12688.6,7200.0,"WHILE PRACTICING GROUND REFERENCE MANUEVER, ENGINE COUGHED & GAVE A SLIGHT SHAKE.",2017-08-09,COULD NOT DUPLICATE ON RUN UP W/ TEMPS NORMAL. COMPRESSIONS ALL OVER 70/80.,c_13,cylinder compression low compression
