workorder,date_time_opened,date_time_closed,registration,total_time,ata_code,problem,date,action,cluster,cluster_name
1170203,2018-01-20 09:39:00,2018-01-23 00:00:00,N633ND,12730.900000000001,7210.0,CRANK SEAL WORN,2018-01-22,"REMOVED PROPELLER, REMOVED WORN SEAL. INSTALLED NEW SEAL.",engine_general_unspecified,engine_general unspecified
1170377,2018-01-25 14:25:00,2018-01-25 00:00:00,N508ND,16105.5,7100.0,INSULATION BLOCKING ENGINE BREATHER TUBE ICING HOLE,2018-01-25,REPOSITION INSULATION,engine_general_unspecified,engine_general unspecified
1170874,2018-02-12 05:52:00,2018-02-13 12:58:00,N714ND,1103.1,7320.0,AIR BOX BUSHINGS WORN OUT.,2018-02-13,"REMOVED & REPLACED AIR BOX, OPS GOOD.",engine_general_unspecified,engine_general unspecified
1170926,2018-02-12 22:55:00,2018-02-13 13:17:00,N790ND,2338.0,580.0,MX FLIGHT REQUIRED TO CK PROPER GOVERNING OF R/H ENGINE RPM.,2018-02-13,"FLEW A/C TO PRACTICE AREA, AT HIGH CONTINUOUS POWER, NO ABNORMAL INDICATIONS WERE OBSERVED. OPERATION CK GOOD. DALFRED JOHN 3596286 CFI 6/19.",engine_general_unspecified,engine_general unspecified
1171076,2018-02-20 09:32:00,2018-02-22 00:00:00,N577ND,16013.7,7170.0,BREATHER HOSE SEEPING AT ENGINE,2018-02-22,"TIGHTENED BREATHER HOSE, CLEANED AREA",engine_general_unspecified,engine_general unspecified
1171076,2018-02-20 09:32:00,2018-02-22 00:00:00,N577ND,16013.7,7170.0,BREATHER HOSE SEEPING AT ENGINE,2018-02-22,LEAK CHECK GOOD. NO FURTHER DEFECTS NOTED.,engine_general_unspecified,engine_general unspecified
1171537,2018-03-08 05:35:00,2018-03-08 15:57:00,N791ND,2437.0,6100.0,L/H ENG ACCUMULATOR LOW.,2018-03-08,SERVICED W/ N2 TO SPECS.,engine_general_unspecified,engine_general unspecified
1172851,2018-04-23 09:44:00,2018-04-23 11:34:00,N531ND,14661.8,1200.0,CAMERA REQIRES NEW SD CARD,2018-04-23,BILLING PURPOSES ONLY. NEW SD CARDS PROVIDED BY SAFTEY OFFICER,engine_general_unspecified,engine_general unspecified
1172852,2018-04-23 09:45:00,2018-04-23 11:35:00,N532ND,14438.6,1200.0,CAMERA REQIRES NEW SD CARD,2018-04-23,BILLING PURPOSES ONLY. NEW SD CARDS PROVIDED BY SAFTEY OFFICER,engine_general_unspecified,engine_general unspecified
1172857,2018-04-23 09:46:00,2018-04-23 11:58:00,N602ND,10191.400000000001,1200.0,CAMERA REQUIRES NEW SD CARD,2018-04-23,BILLING PURPOSES ONLY. NEW SD CARDS PROVIDED BY SAFTEY OFFICER,engine_general_unspecified,engine_general unspecified
1172858,2018-04-23 09:46:00,2018-04-23 11:59:00,N605ND,13573.2,1200.0,CAMERA REQURES NEW SD CARD,2018-04-23,BILLING PURPOSES ONLY. NEW SD CARDS PROVIDED BY SAFTEY OFFICER,engine_general_unspecified,engine_general unspecified
1172859,2018-04-23 09:46:00,2018-04-23 11:59:00,N608ND,12897.6,1200.0,CARERA REQUIRES NEW SD CARD,2018-04-23,BILLING PURPOSES ONLY. NEW SD CARDS PROVIDED BY SAFTEY OFFICER,engine_general_unspecified,engine_general unspecified
1172860,2018-04-23 09:46:00,2018-04-23 12:00:00,N633ND,13613.2,1200.0,CAMERA REQUIRES NEW SD CARD,2018-04-23,BILLING PURPOSES ONLY. NEW SD CARDS PROVIDED BY SAFTEY OFFICER,engine_general_unspecified,engine_general unspecified
1172861,2018-04-23 09:47:00,2018-04-23 12:05:00,N652ND,8990.8,1200.0,CAMERA NEEDS NEW SD CARD,2018-04-23,BILLING PURPOSES ONLY. NEW SD CARDS PROVIDED BY SAFTEY OFFICER,engine_general_unspecified,engine_general unspecified
1172954,2018-04-25 10:44:00,2018-04-27 00:00:00,N532ND,14469.5,7310.0,FUEL DIVIDER DRAIN HOSE CRACKED,2018-04-26,REMOVED CRACKED HOSE. INSTALLED NEW HOSE. NO FURTHER DEFECTS NOTED.,engine_general_unspecified,engine_general unspecified
1173121,2018-05-01 13:37:00,2018-05-10 11:10:00,N642ND,8127.299999999999,7100.0,ENGINE TIME CHANGE DUE.,2018-05-01,"REMOVED ENGINE HARNESS. REMOVED ENGINE. INSPECTED ENGINE MOUNT, FOUND TO BE IN GOOD CONDITION. STARTED INSTALLATION OF SERVICEABLE ENGINE S/N L-19932-51E. TORQUED ENGINE TO ENGINE MOUNT. STARTED ALTERNATOR S/N H-Q1110083 INSTALL ONTO OVERHAULED ENGINE.",engine_general_unspecified,engine_general unspecified
1173121,2018-05-01 13:37:00,2018-05-10 11:10:00,N642ND,8127.299999999999,7310.0,FLOW DIVIDER NOT CORRECT FOR ENGINE SPEC SHEET (P/N 63B23360-70),2018-05-07,LYCOMING SENT CORRECT PART (P/N 63B26756). INSTALLED ON ENGINE.,engine_general_unspecified,engine_general unspecified
1173552,2018-05-15 09:39:00,2018-05-15 00:00:00,N577ND,16737.0,7910.0,OIL QUICK DRAIN VALVE LEAKING,2018-05-15,"DRAINED OIL, REMOVED SUMP QUICK DRAIN FOUND SEAL HARD & CRACKED. INSTALL NEW VALVE. SERVICE ENGINE W/ 7 QTS OIL. NO FURTHER DEFECTS NOTED.",engine_general_unspecified,engine_general unspecified
1176607,2018-09-05 13:43:00,2018-09-06 13:01:00,N729ND,738.9000000000001,7160.0,AIR BOX BOTTOM BEARING WORN.,2018-09-06,REMVOED UNREPAIRABLE AIR BOX. INSTALLED REPAIRED AIR BOX ASSY. TRAVEL CK'ED GOOD.,engine_general_unspecified,engine_general unspecified
1177211,2018-09-23 10:00:00,2018-09-23 00:00:00,N634ND,11723.3,7200.0,"DURING RUN-UP IN THE HOLD BAY, THE AIRCRAFT ENGINE DIED",2018-09-23,PERFORMED ENGINE RUN. MADE SEAONAL ADJUSTMENT TO FUEL SERVO. NO FURTHER DISCREPANCIES NOTED. OPS CHECK GOOD.,engine_general_unspecified,engine_general unspecified
1177410,2018-09-28 13:27:00,2018-09-28 11:09:00,N705ND,1102.8000000000002,7160.0,AIR BOX WORN.,2018-09-28,REMOVED & REPLACED AIR BOX. OPS CK GOOD.,engine_general_unspecified,engine_general unspecified
1177458,2018-10-01 10:09:00,2018-10-04 15:00:00,N571ND,14848.2,7200.0,ENGINE CHANGE DUE (TBO REACHED).,2018-10-01,REMOVED ENGINE FROM AIRFRAME. INSTALLED ENGINE S/N L-30678-51E ON AIRFRAME. REPLACED HOSES.,engine_general_unspecified,engine_general unspecified
1177458,2018-10-01 10:09:00,2018-10-04 15:00:00,N571ND,14848.2,400.0,AD RESEARCH NEEDS TO BE DONE FOR ENGINE REPLACEMENT.,2018-10-03,UPDATED ADS FROM LYCOMING LIST.,engine_general_unspecified,engine_general unspecified
1177523,2018-10-02 12:44:00,2018-10-04 00:00:00,N531ND,16203.5,3710.0,VACUUM TOO LOW @ 1600 RPM DURING POST,2018-10-03,ADJUSTED VAC REG FOR 4.5 MIN @ 1200 RPM; 5.5 IN HG @ MAX POWER,engine_general_unspecified,engine_general unspecified
1177705,2018-10-10 11:09:00,2018-10-15 00:00:00,N634ND,11918.9,3710.0,VACUUM OUT OF RANGE @ HIGH RPM.,2018-10-13,PERFORMED ENGINE RUN. UNABLE TO DUPLICATE.,engine_general_unspecified,engine_general unspecified
1178022,2018-10-22 06:35:00,2018-10-22 13:34:00,N524ND,9508.6,7900.0,OIL QUICK DRAIN LEAKS.,2018-10-22,REMOVED & REPLACED W/ NEW AND RESAFETIED.,engine_general_unspecified,engine_general unspecified
1179470,2018-12-13 06:40:00,2018-12-18 12:22:00,N509ND,20237.1,520.0,AD RESEARCH NEEDS TO BE DONE FOR ENGINE CHANGE.,2018-12-14,PERFORMED AD RESEARCH & UPDATED AS REQUIRED.,engine_general_unspecified,engine_general unspecified
