workorder,date_time_opened,date_time_closed,registration,total_time,ata_code,problem,date,action,cluster,cluster_name
1168752,2017-11-14 06:23:00,2017-11-14 14:32:00,N739ND,904.1999999999999,7230.0,#2 CYL FWD BAFFLE SCREW MISSING.,2017-11-14,INSTALLED NEW SCREW.,c_8,baffle screw
1169127,2017-11-29 13:30:00,2017-11-29 13:17:00,N514ND,19545.7,7230.0,R/H REAR ENGINE BAFFLE MOUNTING SCREW MISSING.,2017-11-29,INSTALLED NEW SCREW.,c_8,baffle screw
1169483,2017-12-12 13:34:00,2017-12-12 14:26:00,N574ND,11596.9,7230.0,R/H AFT BAFFLE SCREW LOOSE.,2017-12-12,RESECURED SCREW.,c_8,baffle screw
1169579,2017-12-18 06:14:00,2017-12-18 10:43:00,N561ND,7679.599999999999,7230.0,MISSING SCREW ON ENGINE BAFFLE I/B OF OIL COOLER.,2017-12-18,"REMOVED OIL COOLER FROM BAFFLE, INSTALLED NEW SCREW. INSTALLED OIL COOLER TO BAFFLE.",c_8,baffle screw
1170302,2018-01-23 15:51:00,2018-01-24 11:15:00,N573ND,17877.9,7230.0,"SCREW FOR BAFFLE, BEHIND OIL TUBE, LOOSE.",2018-01-24,TIGHTENED SCREW.,c_8,baffle screw
1170717,2018-02-07 06:09:00,2018-02-07 13:49:00,N576ND,18770.9,7230.0,"BAFFLE SCREW LOOSE, BEHIND OIL TUBE.",2018-02-07,TIGHTENED SCREW.,c_8,baffle screw
1170847,2018-02-11 07:23:00,2018-02-12 00:00:00,N540ND,21030.3,7230.0,CYL #3 AFT BAFFLE SCREW FALLEN OUT,2018-02-11,REINSTALLED SCREW.,c_8,baffle screw
1172149,2018-04-02 14:06:00,2018-04-02 11:02:00,N558ND,9196.8,7230.0,BAFFLE SCREW SHEARED.,2018-04-02,"REMOVED & REPLACED SCREW. TIGHTENED OIL LINE, LEAK CK GOOD.",c_8,baffle screw
1172217,2018-04-04 14:07:00,2018-04-04 15:29:00,N529ND,10089.6,7230.0,"SCREW LOOSE FOR BAFFLE, BEHIND DIPSTICK TUBE.",2018-04-04,TIGHTENED SCREW.,c_8,baffle screw
1174181,2018-06-06 13:18:00,2018-06-06 12:59:00,N641ND,2919.3,7230.0,"BAFFLE SCREW, BEHIND OIL TUBE, MISSING.",2018-06-06,FOUND SCREW & INSTALLED.,c_8,baffle screw
1174183,2018-06-06 13:19:00,2018-06-06 13:41:00,N529ND,10776.9,7230.0,BAFFLE SCREW MISSING BEHIND OIL FILLER TUBE.,2018-06-06,REPLACED SCREW.,c_8,baffle screw
1175440,2018-07-23 13:17:00,2018-07-26 00:00:00,N532ND,15371.9,7140.0,BAFFLE SCREW MISSING ON R/H,2018-07-25,REPLACED BAFFLE SCREW NO FURTHER DEFECTS NOTED.,c_8,baffle screw
1175504,2018-07-25 14:05:00,2018-07-26 10:04:00,N527ND,18216.2,7110.0,"SCREW LOOSE AT BAFFLE, BEHIND OIL TUBE.",2018-07-26,TIGHTENED SCREW.,c_8,baffle screw
1176192,2018-08-22 13:45:00,2018-08-22 13:40:00,N550ND,11012.8,7230.0,R/H AFT ENGINE BAFFLE MOUNTING SCREW MISSING.,2018-08-22,INSTALLED NEW BAFFLE MOUNTING SCREW.,c_8,baffle screw
1177579,2018-10-04 14:43:00,2018-10-04 14:41:00,N575ND,14087.1,7100.0,SCREW MISSING ON #4 CYL BAFFLE.,2018-10-04,REPLACED SCREW.,c_8,baffle screw
